152, clidle, https://github.com/ajeetdsouza/clidle, "Play Wordle over SSH", "cli,command-line,go,golang,ssh,wordle", 2022-02-01 23:32:55 +0000 UTC
112, tiny-resolver, https://github.com/jvns/tiny-resolver, "", "", 2022-02-01 18:15:24 +0000 UTC
41, Atomic-Arbitrage, https://github.com/mev-squad/Atomic-Arbitrage, "Just the essentials done well", "", 2022-02-03 03:16:40 +0000 UTC
32, wordle, https://github.com/AshishShenoy/wordle, "A terminal Wordle written in Go", "", 2022-02-02 18:10:08 +0000 UTC
29, fonetic-go, https://github.com/s0md3v/fonetic-go, "golang implementation of fonetic (https://github.com/s0md3v/fonetic)", "", 2022-02-01 23:45:41 +0000 UTC
25, cancelreader, https://github.com/muesli/cancelreader, "A cancelable reader for Go", "", 2022-02-06 03:35:15 +0000 UTC
22, nune, https://github.com/lordlarker/nune, "High-performance numerical engine based on generic tensors", "", 2022-02-02 11:12:12 +0000 UTC
19, benchmore, https://github.com/felixge/benchmore, "", "", 2022-02-05 19:42:05 +0000 UTC
18, go-p11-kit, https://github.com/google/go-p11-kit, "PKCS #11 modules in Go without cgo", "", 2022-02-01 21:14:41 +0000 UTC
17, tinygui, https://github.com/spearson78/tinygui, "A minimal material design based UI toolkit for Tiny Go projects", "", 2022-02-02 12:51:17 +0000 UTC
15, dominantcolor, https://github.com/stuartmscott/dominantcolor, "", "", 2022-02-01 16:18:30 +0000 UTC
15, furui, https://github.com/masibw/furui, "A process-based communication control system for containers.", "ebpf,go,network", 2022-02-01 08:22:19 +0000 UTC
14, sixmap, https://github.com/bradfitz/sixmap, "tool to visualize the SIX (Seattle Internet Exchange) route server coverage", "", 2022-02-02 17:17:31 +0000 UTC
14, mango-cobra, https://github.com/muesli/mango-cobra, "cobra adapter for mango", "", 2022-02-01 00:35:41 +0000 UTC
13, fluff, https://github.com/rwxrob/fluff, "# Fluff, Local cloud-init VMware VMs", "", 2022-02-03 19:29:27 +0000 UTC
12, mango-kong, https://github.com/alecthomas/mango-kong, "Mango (man page generator) integration for Kong", "", 2022-02-05 04:16:10 +0000 UTC
11, bubblelister, https://github.com/treilik/bubblelister, "", "", 2022-02-01 22:32:45 +0000 UTC
7, nvote, https://github.com/rdbell/nvote, "Decentralized, vote-driven community similar to services like Reddit and HackerNews. Built on nostr.", "", 2022-02-06 01:47:49 +0000 UTC
6, simple-messenger, https://github.com/AbolfazlHosseini200/simple-messenger, "", "", 2022-02-02 09:08:14 +0000 UTC
6, sstreamcry, https://github.com/AkinoKaede/sstreamcry, "Shadowsocks stream bomb", "", 2022-02-03 08:35:11 +0000 UTC
6, go-wordle, https://github.com/XiaoMengXinX/go-wordle, "A CLI version of popular game Wordle powered by golang", "", 2022-02-01 18:51:47 +0000 UTC
6, wipe-discord, https://github.com/diamondburned/wipe-discord, "TUI application to erase Discord messages", "", 2022-02-04 06:44:34 +0000 UTC
5, ecookie, https://github.com/Sina-Ghaderi/ecookie, "sign, encrypt and authenticate http cookies with golang ", "authentication,cookie,encryption,golang,http", 2022-02-02 16:55:15 +0000 UTC
5, TouchSimulation, https://github.com/kp7742/TouchSimulation, "Touch Simulation in Golang - Simulate Touch Points using UInput", "", 2022-02-05 09:52:40 +0000 UTC
5, shelloverreversessh, https://github.com/magisterquis/shelloverreversessh, "A little implant which SSH's back with a shell", "", 2022-02-01 22:31:48 +0000 UTC
5, mango-coral, https://github.com/muesli/mango-coral, "coral adapter for mango", "", 2022-02-02 12:55:27 +0000 UTC
4, sqlitefs, https://github.com/jilio/sqlitefs, "sqlite as a filesystem for golang apps", "golang,sqlite", 2022-02-02 17:18:40 +0000 UTC
4, euphoria, https://github.com/syhily/euphoria, "📖 A personal library for manage EPUBs.", "", 2022-02-03 20:31:01 +0000 UTC
4, zibr, https://github.com/dchest/zibr, "Repack ZIP or PNG files into Brotli", "", 2022-02-01 11:08:10 +0000 UTC
4, go-cent-app, https://github.com/plin2k/go-cent-app, "https://cent.app/en/merchant/api", "", 2022-02-04 12:08:52 +0000 UTC
4, go-threema, https://github.com/karalabe/go-threema, "Threema messaging from Go", "chatbot,golang,messaging,threema", 2022-02-05 23:34:49 +0000 UTC
4, wordle-cli, https://github.com/nimblebun/wordle-cli, "play wordle in your command line", "bubbles,bubbletea,cli,command-line-app,go,golang,lipgloss,terminal,tui,wordle", 2022-02-06 07:37:15 +0000 UTC
4, esquenta-imersao-6-golang-kafka, https://github.com/codeedu/esquenta-imersao-6-golang-kafka, "", "", 2022-02-02 01:04:42 +0000 UTC
4, k8s-graph, https://github.com/knabben/k8s-graph, "Kubernetes ownerReferences graphs", "", 2022-02-03 00:11:51 +0000 UTC
4, go-tracer, https://github.com/rfyiamcool/go-tracer, "golang simple tracer client", "", 2022-02-05 15:50:43 +0000 UTC
3, lookup-stock, https://github.com/codingpot/lookup-stock, "", "", 2022-02-01 07:26:10 +0000 UTC
3, hui2ochko, https://github.com/neex/hui2ochko, "exploit for CVE-2021-43848", "", 2022-02-03 16:31:13 +0000 UTC
3, cypress-dashboard-exporter, https://github.com/rguilmont/cypress-dashboard-exporter, "Exporter your cypress.io dashboard into prometheus Metrics", "", 2022-02-06 09:01:38 +0000 UTC
3, injective-price-oracle, https://github.com/InjectiveLabs/injective-price-oracle, "Injective's Oracle with dynamic price feeds (for External Integrations)", "", 2022-02-03 22:08:46 +0000 UTC
3, Simple-Weather-API, https://github.com/PrakashAnalyst/Simple-Weather-API, "Simple weather api app created using golang and Open Weather API key", "", 2022-02-05 08:56:55 +0000 UTC
3, go-unvcode, https://github.com/XiaoMengXinX/go-unvcode, "go-unvcode", "", 2022-02-06 09:08:21 +0000 UTC
3, bfc, https://github.com/liamg/bfc, "A compiler for brainfuck by someone who has no idea how compilers work", "bad,brainfuck,brainfuck-compiler,compiler", 2022-02-03 19:00:32 +0000 UTC
3, Chrome-Password-Dumper, https://github.com/Sorrow446/Chrome-Password-Dumper, "Chrome password dumper written in Go for Linux and Windows.", "", 2022-02-03 13:00:29 +0000 UTC
3, goFunctionStomping, https://github.com/3rsh1/goFunctionStomping, "FunctionStomping (using golang) : A new shellcode injection technique.", "", 2022-02-02 07:18:53 +0000 UTC
3, mango-pflag, https://github.com/muesli/mango-pflag, "pflag adapter for mango", "", 2022-02-01 00:46:17 +0000 UTC
3, gke-config-helper, https://github.com/carlpett/gke-config-helper, "A small utility to generate a kubectl configuration file for all clusters you have access to in GKE.", "gke,kubectl,kubernetes", 2022-02-01 20:21:25 +0000 UTC
3, nfp, https://github.com/xuri/nfp, "Go Microsoft Excel™ Number Format Parser", "ecma-376,excel,excelize,go,golang,lexer,number-format,number-formating,parser,spreadsheet", 2022-02-04 16:36:43 +0000 UTC
3, slack-emoji-bot, https://github.com/ryho/slack-emoji-bot, "This Slack bot will post the newly created custom Slack emojis to the channel of your choice.", "emojis,slack,slack-bot,unicode", 2022-02-04 16:20:17 +0000 UTC
3, worldrenderer, https://github.com/JustTalDevelops/worldrenderer, "render minecraft: bedrock worlds using dragonfly", "", 2022-02-04 17:28:37 +0000 UTC
3, Go-Postgresql-Query-Builder, https://github.com/SamuelBanksTech/Go-Postgresql-Query-Builder, "A query builder for Postgresql in Go", "", 2022-02-03 15:22:36 +0000 UTC
2, Muffin, https://github.com/billyeatcookies/Muffin, "an interpreter written in go", "", 2022-02-03 05:28:04 +0000 UTC
2, maskerito, https://github.com/firdasafridi/maskerito, "maskerito is masking library for golang. Especially for indonesia dictionary. ", "", 2022-02-01 07:57:56 +0000 UTC
2, shttp, https://github.com/ecnepsnai/shttp, "Finally, secure HTTP!", "", 2022-02-05 04:25:31 +0000 UTC
2, sex-bot, https://github.com/marcos-inja/sex-bot, "the sex bot and its uncreative responses 👀", "bot,discord-bot,discordgo", 2022-02-05 03:19:50 +0000 UTC
2, go-astiav, https://github.com/asticode/go-astiav, "", "", 2022-02-05 09:26:19 +0000 UTC
2, renda, https://github.com/vvatanabe/renda, "Renda is a go library that repeatedly executes any processes.", "", 2022-02-05 07:06:20 +0000 UTC
2, funcstat, https://github.com/gostaticanalysis/funcstat, "", "", 2022-02-04 22:56:45 +0000 UTC
2, go_input_history, https://github.com/flewsoftware/go_input_history, "Package input history contains structs and methods to aid in developing cli ui's with input history", "", 2022-02-04 05:53:54 +0000 UTC
2, dogeRPC3, https://github.com/Shaneumayanga/dogeRPC3, "Much RPC , Much connections", "", 2022-02-03 19:08:34 +0000 UTC
2, puppet, https://github.com/midsummer-hub/puppet, "", "", 2022-02-03 07:06:27 +0000 UTC
2, lobby, https://github.com/noxworld-dev/lobby, "Nox lobby server", "", 2022-02-04 18:36:40 +0000 UTC
2, go-mail, https://github.com/gustavocioccari/go-mail, "Email service using Kafka consumer", "", 2022-02-04 14:43:01 +0000 UTC
2, lms-notifier, https://github.com/ArashSameni/lms-notifier, "A simple tool to keep track of lms modules", "", 2022-02-05 19:21:56 +0000 UTC
2, Go-for-Beginners, https://github.com/PrakashAnalyst/Go-for-Beginners, "This repository contains all source code files to learn Go programming concepts for Beginners", "", 2022-02-03 07:06:54 +0000 UTC
2, superlint, https://github.com/ammario/superlint, "A language-agnostic framework for lint rules written in Go", "", 2022-02-06 20:08:04 +0000 UTC
2, koios-rest-go-client, https://github.com/howijd/koios-rest-go-client, "[WIP] Go Client library for Koios API", "cardano,cardano-api,cardano-community,golang-api,golang-library", 2022-02-04 06:44:03 +0000 UTC
2, eventapp, https://github.com/najibjodiansyah/eventapp, "Group Project Group 5", "", 2022-02-03 02:13:36 +0000 UTC
2, lyric-go, https://github.com/SukiEva/lyric-go, "🎼 Golang Lyric API", "api,golang,lyrics", 2022-02-02 05:33:06 +0000 UTC
2, envisage, https://github.com/golangsugar/envisage, "Lightweight package that makes easier and safer to deal with environment variables.", "", 2022-02-02 19:36:58 +0000 UTC
2, pitch, https://github.com/raphaelreyna/pitch, "Like tar but different", "", 2022-02-02 16:16:30 +0000 UTC
2, goServe, https://github.com/brainstewdev/goServe, "Small and Simple http server", "hosting,http,http-server", 2022-02-01 16:04:06 +0000 UTC
2, pacemaker, https://github.com/sonirico/pacemaker, "rate limit library", "crypto,crypto-exchange,fixed-window,golang,limiter,rate,rate-limiting,token-bucket", 2022-02-05 00:15:58 +0000 UTC
2, rustpm, https://github.com/leona/rustpm, "Process manager and automated updates for RustDedicated", "", 2022-02-02 00:09:51 +0000 UTC
2, ByteDanceMall, https://github.com/tianshengdiwangK/ByteDanceMall, "", "", 2022-02-06 07:22:42 +0000 UTC
2, gopix, https://github.com/souzawagner/gopix, "Gerador Pix Copia e Cola / QRCode em Golang", "", 2022-02-01 03:10:53 +0000 UTC
2, ethernet, https://github.com/0x9ef/ethernet, "Implementation of Ethernet 2, 802.1Q, 802.1P, 802.11 (Wireless Ethernet) frame serialization/deserialization", "encoding,ethernet,frame,golang,network,serialization,wireless", 2022-02-05 11:15:51 +0000 UTC
2, fungsi, https://github.com/zero-one-group/fungsi, "A utility library for FP in Go using Generics.", "", 2022-02-05 05:54:25 +0000 UTC
2, kaastolon, https://github.com/basalam/kaastolon, "A fork of solon PostgreSQL HA With our customizations", "", 2022-02-05 15:03:43 +0000 UTC
2, gNOI-examples, https://github.com/burnyd/gNOI-examples, "", "", 2022-02-03 19:09:19 +0000 UTC
2, mikorm, https://github.com/didintri196/mikorm, "Library ORM Mikrotik API using go", "", 2022-02-04 17:05:21 +0000 UTC
2, CultureBot, https://github.com/coolblknerd/CultureBot, "A slack bot used to act as a companion to new people in tech. Helps people find resources, mentors, and helps users get trained up on whatever skill they’re looking to learn in order to enter or advance their tech career.", "", 2022-02-05 20:18:52 +0000 UTC
2, go_restapi, https://github.com/janakapdj/go_restapi, "", "", 2022-02-01 11:19:50 +0000 UTC
2, scd4x-exporter, https://github.com/aldernero/scd4x-exporter, "A Prometheus exporter for the Adafruit SCD-40 sensor", "", 2022-02-02 02:40:40 +0000 UTC
2, http-teleport, https://github.com/Enrico204/http-teleport, "A Go HTTP debug/interactive reverse proxy, inspired to Laravel Telescope - mirror of https://gitlab.com/Enrico204/http-telescope", "debug,http,reverse-proxy", 2022-02-05 11:06:13 +0000 UTC
2, Great, https://github.com/Mirinda2001/Great, "基于Go语言实现的web框架", "", 2022-02-02 09:25:05 +0000 UTC
2, hire.via.ssh, https://github.com/TomKelross/hire.via.ssh, "An attempt to make a short CV or cover letter available over a SSH TUI. A chance to play around with charmbracelet/wish really.", "", 2022-02-02 23:16:22 +0000 UTC
2, allah, https://github.com/Cqdet/allah, "Allah, but in Dragonfly", "", 2022-02-04 01:22:42 +0000 UTC
2, crimsonq, https://github.com/ywadi/crimsonq, "A Multi Message Consumer Queue with persistence and Queue Stages. Crimson Queue allows you to have multiple consumers listening on topics and receive a copy of a message that targets its topic providing multiple consumers for a queue message and complex message routing. Utilizes the same methodology as MQTT topic routing but with queue stages and persistence.,", "", 2022-02-01 23:36:22 +0000 UTC
2, RIFF-Extractor, https://github.com/Sorrow446/RIFF-Extractor, "RIFF file extractor written in Go.", "", 2022-02-05 04:34:21 +0000 UTC
2, bump-version, https://github.com/wesleimp/bump-version, "Bump a given semantic version, following a given version fragment.", "golang,semantic-version", 2022-02-02 22:00:50 +0000 UTC
2, bugle, https://github.com/ccutch/bugle, "mlm demo add help@mailem.ai", "", 2022-02-03 06:17:11 +0000 UTC
2, go-indexeddb, https://github.com/huffduff/go-indexeddb, "An indexeddb in Go", "", 2022-02-01 18:39:09 +0000 UTC
2, projet-red, https://github.com/antaww/projet-red, "", "", 2022-02-02 16:18:05 +0000 UTC
2, maddeningbugs, https://github.com/impact-eintr/maddeningbugs, "让我破大防的 bug 们", "", 2022-02-03 13:27:52 +0000 UTC
2, generics, https://github.com/zeroflucs/generics, "Fluent/LINQ style slice and map operations, using Go generics.", "fluent,generics,go,golang", 2022-02-01 22:56:57 +0000 UTC
2, acnh-website, https://github.com/antaww/acnh-website, "Website built from acnh's api", "", 2022-02-02 14:58:43 +0000 UTC
2, game-of-life, https://github.com/fr13n8/game-of-life, "An implementation of Conway's Game of Life.", "", 2022-02-05 10:49:13 +0000 UTC
2, dugopg, https://github.com/durudex/dugopg, "PostgreSQL tool", "go,golang,postgresql", 2022-02-06 14:31:47 +0000 UTC
2, todo-list, https://github.com/acmenezes/todo-list, "In workshop live coding created operator", "", 2022-02-04 20:53:00 +0000 UTC
2, dnage, https://github.com/qbit/dnage, "Encrypt data for a host's ssh public key, verified via DNSSEC/SSHFP", "", 2022-02-03 00:10:40 +0000 UTC
