1987, lima, https://github.com/AkihiroSuda/lima, "Lima: Linux-on-Mac (\"macOS subsystem for Linux\", \"containerd for Mac\")", "macos,vm,qemu,containerd", 2021-05-14 07:30:56 +0000 UTC
77, core, https://github.com/bitclout/core, "BitClout core node", "bitclout", 2021-05-18 15:12:24 +0000 UTC
51, elcarro-oracle-operator, https://github.com/GoogleCloudPlatform/elcarro-oracle-operator, "El Carro is a new project that offers a way to run Oracle databases in Kubernetes as a portable, open source, community driven, no vendor lock-in container orchestration system. El Carro provides a powerful declarative API for comprehensive and consistent configuration and deployment as well as for real-time operations and monitoring.", "", 2021-05-13 04:46:26 +0000 UTC
47, go-sqlmap, https://github.com/EmYiQing/go-sqlmap, "ä½¿ç”¨Golangç¼–å†™ç®€æ˜“ç‰ˆSqlmap", "sql-injection,web-security,sqlmap,pentest-tool", 2021-05-13 13:04:31 +0000 UTC
43, nats-roundtripper, https://github.com/ripienaar/nats-roundtripper, "", "", 2021-05-15 09:59:14 +0000 UTC
40, jsonc, https://github.com/tidwall/jsonc, "Parse json with comments and trailing commas.", "", 2021-05-14 01:16:42 +0000 UTC
35, go-notion, https://github.com/dstotijn/go-notion, "Go client for the Notion API.", "golang,client,notion,notion-api", 2021-05-13 20:09:09 +0000 UTC
31, run-evm-code, https://github.com/fxfactorial/run-evm-code, "run ABI encoded data against the ethereum blockchain", "", 2021-05-16 22:37:42 +0000 UTC
28, fhttp, https://github.com/zMrKrabz/fhttp, "The f stands for flex.", "", 2021-05-15 16:55:42 +0000 UTC
27, gorm-relationships-examples, https://github.com/harranali/gorm-relationships-examples, "GORM relationships examples ", "", 2021-05-14 11:39:27 +0000 UTC
15, backend, https://github.com/bitclout/backend, "HTTP API for a BitClout node", "bitclout", 2021-05-18 15:12:31 +0000 UTC
15, probr-pack-aks, https://github.com/probr/probr-pack-aks, "AKS compliance validation pack for Probr", "", 2021-05-14 11:21:52 +0000 UTC
14, iamzero, https://github.com/common-fate/iamzero, "Identity & Access Management simplified and secure.", "aws,security,cloud,iam,security-tools,cloud-security", 2021-05-13 07:41:19 +0000 UTC
13, voronoi-interp, https://github.com/unixpickle/voronoi-interp, "Create cool animations by gradually adding pixels to an interpolated image.", "", 2021-05-13 13:02:58 +0000 UTC
12, remoteaddr, https://github.com/netinternet/remoteaddr, "Go http real ip header parser", "go,golang,http,proxy,ip,forwarder,real-ip", 2021-05-14 15:19:49 +0000 UTC
10, koala, https://github.com/heiyeluren/koala, "koalaé€šç”¨é¢‘ç‡æ§åˆ¶ç³»ç»Ÿï¼Œä¸€ä¸ªåº”å¯¹æ‰€æœ‰é¢‘æ¬¡æ§åˆ¶é«˜åº¦é…ç½®åŒ–çš„é€šç”¨åä½œå¼Šç³»ç»Ÿï¼Œé«˜æ€§èƒ½å¯æ‰©å±•ã€‚ (the require golang >= 1.0)", "", 2021-05-18 17:06:01 +0000 UTC
10, dependabotbot, https://github.com/cmgriffing/dependabotbot, "Just a simple CLI tool to group dependabot PRs by dependency and merge them.", "", 2021-05-13 22:14:31 +0000 UTC
9, go-patch-overlay, https://github.com/felixge/go-patch-overlay, "WIP", "", 2021-05-13 14:40:22 +0000 UTC
8, emojimage, https://github.com/cjdenio/emojimage, "i don't even know", "", 2021-05-14 01:54:37 +0000 UTC
8, mkvm, https://github.com/Xe/mkvm, "Makes a VM, imaginative name, I know", "", 2021-05-16 03:47:30 +0000 UTC
8, yo, https://github.com/lucasepe/yo, "An alternative syntax to generate YAML (or JSON) from commandline.  => https://youtu.be/QL6DsCLFQ30", "", 2021-05-14 15:47:01 +0000 UTC
8, chia-bls-go, https://github.com/chuwt/chia-bls-go, "chia-bls-signature in go, chia bls ç­¾åå·¥å…·goå®ç°(WIP)", "bls-signature,chia,chia-blockchain", 2021-05-15 00:36:13 +0000 UTC
8, go_shell_socket, https://github.com/spxvszero/go_shell_socket, "run shell scripts by websocket with go lauguage", "", 2021-05-16 06:30:19 +0000 UTC
7, mocker, https://github.com/Ananto30/mocker, "Create your own mock server with just a JSON file!", "go,golang,mock-server,fasthttp", 2021-05-18 08:17:44 +0000 UTC
7, go-notion, https://github.com/sorcererxw/go-notion, "Notion Official API Go Client.", "api,golang,notion", 2021-05-13 19:29:12 +0000 UTC
6, benchfmt-convert, https://github.com/prattmic/benchfmt-convert, "Convert various benchmarking formats to benchfmt", "", 2021-05-14 21:45:11 +0000 UTC
6, floppa-programming-language, https://github.com/5elenay/floppa-programming-language, "Floppa programming language inspired by the brainf*ck programming language. Created just for fun and you can convert your brainf*ck code to floppa code.", "golang,compiler,brainfuck,floppa,big-floppa", 2021-05-15 18:52:37 +0000 UTC
6, vine, https://github.com/vineio/vine, "", "", 2021-05-16 09:51:51 +0000 UTC
6, simpleCloudInGO, https://github.com/ranon-rat/simpleCloudInGO, "Its a simple cloud", "go,docker,cloud,sqlite,cloud-storage", 2021-05-13 09:57:31 +0000 UTC
6, farely, https://github.com/chermehdi/farely, "A load balancer supporting multiple LB strategies written in Go", "", 2021-05-16 17:04:55 +0000 UTC
5, veilig, https://github.com/noqqe/veilig, "Toy TLS certificate viewer", "", 2021-05-18 06:32:15 +0000 UTC
5, scan27, https://github.com/Abhinivesh27/scan27, "A simple port scanner written in go", "", 2021-05-14 09:14:18 +0000 UTC
5, idiomatic-testing-in-go, https://github.com/inancgumus/idiomatic-testing-in-go, "Learn to write idiomatic tests in Go", "", 2021-05-13 12:03:22 +0000 UTC
5, prometheus-lib-example, https://github.com/lilic/prometheus-lib-example, "Example of how to avoid Prometheus globals in your library.", "library,prometheus,instrumentation", 2021-05-14 12:49:39 +0000 UTC
5, vffmod, https://github.com/wii-tools/vffmod, "A library for interacting with the VFF format, used on the Nintendo Wii.", "golang,wii,golang-library,wii-homebrew,wii-tools", 2021-05-13 03:48:51 +0000 UTC
4, goodbots, https://github.com/eywu/goodbots, "Verify IP addresses of respectful crawlers like Googlebot by reverse dns and forward dns lookups", "", 2021-05-16 06:31:15 +0000 UTC
4, ok, https://github.com/ErrorNoInternet/ok, "This is a command that simply prints \"ok\" onto your screen whenever you run the \"ok\" command", "", 2021-05-15 14:13:01 +0000 UTC
4, dabulang, https://github.com/stickyPiston/dabulang, "Dabulang is an interpreted object-oriented programming language aimed towards game development.", "programming-language,golang,game-development", 2021-05-17 10:14:51 +0000 UTC
4, token-scanner, https://github.com/RoBlockHead/token-scanner, "Simple Discord Bot to scan for leaked tokens in chat and reset them", "", 2021-05-13 14:26:38 +0000 UTC
4, heapalyzer, https://github.com/jordanlewis/heapalyzer, "", "", 2021-05-15 00:58:39 +0000 UTC
3, go-algorithm, https://github.com/HanTianPeng/go-algorithm, "å—¨ï¼å¤§å®¶å¥½ï¼Œæˆ‘æ˜¯Conkï¼Œå…¨æ ˆæ‰“æ‚å·¥ã€‚æ¥ä¸‹æ¥è®¡åˆ’æ¯å‘¨è‡³å°‘ç”¨Goåˆ·ä¸€é“ç®—æ³•é¢˜ï¼Œæ¬¢è¿å¤§å®¶å›´è§‚ã€‚JavaScriptè€…å¯ä»¥å‚è€ƒæˆ‘çš„fullstackreviewé¡¹ç›®ã€‚è°¢è°¢ï¼", "", 2021-05-17 15:47:02 +0000 UTC
3, terraform-provider-statusflare, https://github.com/statusflare-com/terraform-provider-statusflare, "", "monitoring,terraform,logging,monitoring-tool", 2021-05-14 15:04:26 +0000 UTC
3, edgevpn, https://github.com/mudler/edgevpn, ":sailboat: EdgeVPN: the immutable, decentralized, statically built VPN. NO central server!", "", 2021-05-14 21:18:10 +0000 UTC
3, membin, https://github.com/membin/membin, "Membin is an in-memory database that can be stored on disk. Data model smiliar to key-value but values store as JSON byte array.", "go,json,database,nosql,key-value,membin", 2021-05-16 19:37:52 +0000 UTC
3, arcoz.site, https://github.com/Arcoz0308/arcoz.site, "", "", 2021-05-15 07:15:08 +0000 UTC
3, yigim-gateway-go, https://github.com/paladium/yigim-gateway-go, "SDK for Yigim Payment Gateway", "go,api,sdk,payment,yigim", 2021-05-16 15:42:15 +0000 UTC
3, cpuworker, https://github.com/hnes/cpuworker, "", "", 2021-05-17 15:19:26 +0000 UTC
3, emojictl, https://github.com/gkze/emojictl, "Manage your emojis!", "", 2021-05-15 02:14:39 +0000 UTC
3, notiongo, https://github.com/tempor1s/notiongo, "(Golang) Go bindings for Notion (WIP)", "go,golang,notion,notion-api,notiongo", 2021-05-15 02:27:25 +0000 UTC
3, chia-bouncer, https://github.com/St3ffn/chia-bouncer, "CLI Tool to remove unwanted connections from your Chia Node based on Geo IP Location.", "go,cli,golang,chia,chia-blockchain,chia-farmer,chia-network,chia-farm", 2021-05-15 12:08:00 +0000 UTC
3, openid-decode-token, https://github.com/marcosgmgm/openid-decode-token, "", "", 2021-05-14 12:19:25 +0000 UTC
3, xk6bundler, https://github.com/szkiba/xk6bundler, "Bundle k6 with extensions as fast and easily as possible", "xk6,k6-extension", 2021-05-16 14:13:21 +0000 UTC
3, exploit-framework, https://github.com/krishpranav/exploit-framework, "A multiple reverse shell sessions/clients manager via terminal written in go", "go,golang,reverse-shell,exploit,ctf,exploitation,exploit-framework,reverse-shell-as-a-service", 2021-05-16 12:40:21 +0000 UTC
3, goMysqlSync, https://github.com/j262965682/goMysqlSync, "mysql to mysql è½»é‡çº§å¤šçº¿ç¨‹çš„åº“è¡¨æ•°æ®åŒæ­¥", "", 2021-05-17 11:50:53 +0000 UTC
3, crypto-legends, https://github.com/ThePrimeagen/crypto-legends, "Like Apex Legends.  Just more, better, faster, and less recoil", "", 2021-05-18 15:38:41 +0000 UTC
3, Doge-Misc, https://github.com/timwhitez/Doge-Misc, "æ‚ ç‰© æ”¶ çº³", "", 2021-05-16 07:23:07 +0000 UTC
3, gin-grom, https://github.com/charmber/gin-grom, "é€‚ç”¨äºåˆæ­¥å…¥é—¨ï¼Œå¿«é€Ÿæ­å»ºgin+gromåç«¯çš„æ–°æ‰‹ï¼Œæ— éœ€å¤æ‚æ“ä½œï¼Œä¸‹è½½ï¼Œå®‰è£…ä¾èµ–åŒ…å³å¯å®Œæˆå¯åŠ¨ï¼Œä»£ç ç®€æ´æ˜“æ‡‚ï¼Œå³ä½¿ä¸ä¼šgoè¯­è¨€ä¹Ÿèƒ½ä½¿ç”¨åªéœ€è¦ä¸‹è½½å®Œæˆåï¼Œåˆå§‹åŒ–go.modè‡ªåŠ¨ä¸‹è½½ç›¸åº”ä¾èµ–åŒ…å³å¯", "", 2021-05-14 11:06:45 +0000 UTC
3, BekeshBekesh, https://github.com/SibZamini/BekeshBekesh, "", "", 2021-05-15 07:47:37 +0000 UTC
3, icka, https://github.com/osm/icka, "", "", 2021-05-16 13:43:03 +0000 UTC
2, github_bot, https://github.com/hack-as-a-service/github_bot, "GitHub bot for haas", "", 2021-05-15 18:14:18 +0000 UTC
2, forwarder, https://github.com/anthhub/forwarder, "A forwarder for forwarding k8s cluster pod programmatically.", "", 2021-05-16 08:43:12 +0000 UTC
2, cowin_alerts, https://github.com/raydwaipayan/cowin_alerts, "", "", 2021-05-15 19:20:32 +0000 UTC
2, redalert, https://github.com/yaronsumel/redalert, "notifies you on red alert based on city filter", "", 2021-05-15 13:41:06 +0000 UTC
2, opa-bundle-api, https://github.com/XenitAB/opa-bundle-api, "Proof-of-concept for an API to produce OPA bundles", "", 2021-05-14 08:33:58 +0000 UTC
2, gh-release, https://github.com/inherelab/gh-release, "Github release action", "", 2021-05-15 02:04:59 +0000 UTC
2, queremosipv6, https://github.com/wpjunior/queremosipv6, "O que falta para gente navegar apenas em IPV6 ?", "", 2021-05-16 11:25:22 +0000 UTC
2, sakata-shoten-common, https://github.com/OH-DEER-NO-BEER/sakata-shoten-common, "sakata-shoten\u00a0ã®é›»å­æ±ºæ¸ˆã‚’å¸ã‚‹ã‚¢ãƒ¬", "", 2021-05-15 16:54:27 +0000 UTC
2, go-graphql-workshop, https://github.com/sit-go-community/go-graphql-workshop, "", "", 2021-05-18 06:44:18 +0000 UTC
2, ZeptoChain, https://github.com/XGZepto/ZeptoChain, "A blockchain written in Go.", "", 2021-05-15 23:26:53 +0000 UTC
2, restful, https://github.com/nokia/restful, "A powerful RESTful framework for Go.", "golang,rest,restful,golang-library", 2021-05-17 06:36:46 +0000 UTC
2, notion-go, https://github.com/mkfsn/notion-go, "Unofficial notion API client in Go", "go,api,open-source,notion", 2021-05-14 04:06:39 +0000 UTC
2, scrapligo, https://github.com/scrapli/scrapligo, "scrapli, but in go!", "", 2021-05-18 22:11:57 +0000 UTC
2, redis-operator, https://github.com/xiangyue520/redis-operator, "", "", 2021-05-14 01:18:07 +0000 UTC
2, goprompt, https://github.com/Gympass/goprompt, "A minimalistic prompt library for CLI applications", "cli,prompt,tui", 2021-05-13 16:48:15 +0000 UTC
2, go-bootstraper, https://github.com/vchitai/go-bootstraper, "", "", 2021-05-14 02:39:02 +0000 UTC
2, nomad-hcloud-autoscaler, https://github.com/AndrewChubatiuk/nomad-hcloud-autoscaler, "", "", 2021-05-17 08:52:08 +0000 UTC
2, sentiment-api, https://github.com/m3o/sentiment-api, "The API backend for the sentiment blog", "", 2021-05-17 10:04:46 +0000 UTC
2, cupboard, https://github.com/anthhub/cupboard, "A package controlling container programmatically.", "", 2021-05-16 06:30:01 +0000 UTC
2, Genius, https://github.com/jiangxiaosheng/Genius, "Genius is a coarse-grained scheduler extension for kubernetes cluster, supporting scheduling policies based on GPU metrics.", "", 2021-05-17 16:50:03 +0000 UTC
2, walki-talki, https://github.com/probabilty/walki-talki, "", "", 2021-05-14 16:34:11 +0000 UTC
2, session, https://github.com/flamego/session, "Package session is a middleware that provides the session management for Flamego", "go,middleware,session,lsif-enabled,flamego", 2021-05-15 15:25:17 +0000 UTC
2, facce, https://github.com/Miguel-Dorta/facce, "Firebase Auth Custom-Claims Editor", "", 2021-05-16 21:50:06 +0000 UTC
2, makin5dvolumesoftware, https://github.com/makindotcc/makin5dvolumesoftware, "Add computer volume control accessory to your homekit home.", "", 2021-05-13 03:51:19 +0000 UTC
2, instl, https://github.com/instl-sh/instl, "ğŸ’» A single command for your users to install your GitHub projects!", "github,deployment,service,installer", 2021-05-15 22:55:43 +0000 UTC
2, astrald, https://github.com/cryptopunkscc/astrald, "astral daemon", "", 2021-05-16 22:51:06 +0000 UTC
2, images-intercept, https://github.com/ccforevercn/images-intercept, "åœ¨åŸå§‹å›¾ç‰‡ä¸­éšæœºè£å‰ªæŒ‡å®šæ ·å¼å›¾ç‰‡çš„æ–°å›¾ç‰‡å‡ºæ¥ï¼Œå¹¶æ¨¡ç³ŠåŸå§‹å›¾ç‰‡å›¾ç‰‡ä¸­çš„è£å‰ªçš„åŒºåŸŸ", "", 2021-05-13 07:41:42 +0000 UTC
2, djifpvvideoout, https://github.com/s00500/djifpvvideoout, "Port of  fpv-wtf/voc-poc to Golang", "", 2021-05-15 14:18:21 +0000 UTC
2, xls2csv, https://github.com/spiegel-im-spiegel/xls2csv, "Export CSV Text from Excel Data", "csv-export,golang-application,excel-import", 2021-05-16 04:21:53 +0000 UTC
2, logcrash-decoder, https://github.com/codecat/logcrash-decoder, "Decoder for Nadeo's LogCrash files generated by Trackmania and Maniaplanet.", "", 2021-05-16 13:03:39 +0000 UTC
2, biu, https://github.com/EthanChenLi/biu, "golden snitch", "", 2021-05-14 12:37:02 +0000 UTC
2, dotenv, https://github.com/alseiitov/dotenv, "load environment variables from .env file", "", 2021-05-18 10:10:56 +0000 UTC
2, chamberlain, https://github.com/coregiu/chamberlain, "Self website", "", 2021-05-18 02:51:50 +0000 UTC
2, basecode, https://github.com/Sakurasan/basecode, "åˆ»è¿›ä½ çš„DNA", "", 2021-05-15 08:08:22 +0000 UTC
2, Sekura, https://github.com/Cookie04DE/Sekura, "Encryption tool that's heavily inspired by Rubberhose fs.", "", 2021-05-16 12:45:34 +0000 UTC
2, k8s-resourcequota-autoscaler, https://github.com/mrueg/k8s-resourcequota-autoscaler, "A Kubernetes Operator to autoscale resource quota for Kubernetes namespaces", "", 2021-05-13 11:56:44 +0000 UTC
2, Website, https://github.com/WorkTreeOfficial/Website, "Simple, open-source LinkedIn alternative", "", 2021-05-17 17:34:33 +0000 UTC
2, metachain, https://github.com/interchainberlin/metachain, "An experimental chain to explore governance typologies within the cosmos", "", 2021-05-14 09:09:32 +0000 UTC
2, uback, https://github.com/sloonz/uback, "Universal/Uniform Backup Tool", "backups,encrypted-backups,incremental-backups", 2021-05-16 20:02:53 +0000 UTC
2, desktop-app, https://github.com/ivpn/desktop-app, "Official IVPN Desktop app ", "security,openvpn,privacy,vpn,vpn-client,wireguard,ivpn", 2021-05-14 08:03:05 +0000 UTC
2, blog-golang, https://github.com/gabriellopes00/blog-golang, "A blog API made with go lang", "blog,go,golang,clean-architecture", 2021-05-17 18:23:54 +0000 UTC
