95, go-snowflake, https://github.com/godruoyi/go-snowflake, "❄ An Lock Free ID Generator for Golang based on Snowflake Algorithm (Twitter announced).", "go-snowflake,snowflake", 2021-04-15 03:05:28 +0000 UTC
23, kenny, https://github.com/smf8/kenny, "A yet to be voice call application in terminal. with the power of go and webRTC (pion).", "", 2021-04-17 14:44:34 +0000 UTC
22, linkpage, https://github.com/rhnvrm/linkpage, "LinkPage is a FOSS self-hosted alternative to link listing websites such as LinkTree and Campsite.bio", "", 2021-04-16 16:46:53 +0000 UTC
18, thank-you-stars, https://github.com/sanposhiho/thank-you-stars, "Give your dependencies stars on GitHub! 🌟", "go,golang", 2021-04-17 05:57:23 +0000 UTC
16, AccountGeneratorBot, https://github.com/anonyindian/AccountGeneratorBot, "Golang Based Account Generator Telegram Bot", "", 2021-04-18 10:02:18 +0000 UTC
15, dump-hub, https://github.com/x0e1f/dump-hub, "Self hosted search engine for data leaks and password dumps", "docker,elasticsearch,password-dump,search-engine,self-hosted", 2021-04-15 20:03:30 +0000 UTC
14, event-go, https://github.com/itchyny/event-go, "Simple synchronous event pub-sub package for Golang", "", 2021-04-17 06:18:10 +0000 UTC
13, go-gearman, https://github.com/rfyiamcool/go-gearman, "golang job dispatcher", "dispatcher,gearman", 2021-04-15 07:12:57 +0000 UTC
11, goldmark-pdf, https://github.com/stephenafamo/goldmark-pdf, "A PDF renderer for the goldmark markdown parser.", "commonmark,go,golang,goldmark,goldmark-extension,markdown,pdf", 2021-04-20 18:05:22 +0000 UTC
10, iftar-bot, https://github.com/barbarbar338/iftar-bot, "🕌 Iftar Bot, Plays Ezan sound on iftar time (Ramadan special ✨)", "discord,discord-bot,discordgo,ezan,go,golang,iftar,ramadan,ramadan-mubarak", 2021-04-16 11:11:14 +0000 UTC
9, lark, https://github.com/go-lark/lark, "An easy-to-use unofficial SDK for Feishu and Lark Open Platform", "", 2021-04-20 12:09:03 +0000 UTC
9, fonts, https://github.com/go-swiss/fonts, "Fonts is a package that provides helpers to access font details and easily retrive font bytes with ZERO dependencies", "fonts,go,google-fonts", 2021-04-17 16:35:44 +0000 UTC
8, inlets-connect, https://github.com/alexellis/inlets-connect, "inlets-connect is a proxy that supports HTTPS and the CONNECT method", "", 2021-04-15 10:32:31 +0000 UTC
8, backend, https://github.com/hojabri/backend, "A REST web-service sample project written in Golang using go-fiber, GORM and PostgreSQL", "go-fiber,golang,gorm,postgresql,rest-api", 2021-04-16 10:45:40 +0000 UTC
8, element, https://github.com/gennaro-tedesco/element, "periodic table on the command line", "", 2021-04-17 18:21:33 +0000 UTC
7, stew, https://github.com/stewproject/stew, "The real missing package manager for macOS", "", 2021-04-17 16:52:10 +0000 UTC
7, toy-webrtc-mmo, https://github.com/silbinarywolf/toy-webrtc-mmo, "A toy MMO example built using Ebiten and WebRTC DataChannels (UDP)", "", 2021-04-17 06:12:49 +0000 UTC
6, stonks, https://github.com/nerdthatnoonelikes/stonks, "view stonks from the terminal", "", 2021-04-16 14:22:04 +0000 UTC
6, Mercurius, https://github.com/osdc/Mercurius, "Community Newsletter Initiative", "", 2021-04-18 12:26:02 +0000 UTC
6, nomad-droplets-autoscaler, https://github.com/jsiebens/nomad-droplets-autoscaler, "", "", 2021-04-20 06:37:52 +0000 UTC
6, Frog-CertDomain, https://github.com/timwhitez/Frog-CertDomain, "Get CommonName and DNS domains from SSL cert.", "", 2021-04-18 01:53:45 +0000 UTC
6, safebox, https://github.com/xtaci/safebox, "One key to derive all", "", 2021-04-17 15:06:15 +0000 UTC
6, notionbackup, https://github.com/5hay/notionbackup, "A small utility command line application that can recursively download Notion pages", "backup,notion", 2021-04-16 16:36:45 +0000 UTC
6, kube-vip-cloud-provider, https://github.com/kube-vip/kube-vip-cloud-provider, "A general purpose cloud provider for Kube-Vip", "", 2021-04-15 12:53:56 +0000 UTC
6, jobgosh, https://github.com/jumang4423/jobgosh, "a work time management CLI tool for any platform", "", 2021-04-17 15:52:09 +0000 UTC
6, echo-http, https://github.com/umputun/echo-http, "Echo http service", "", 2021-04-15 07:47:27 +0000 UTC
6, bmak-tools, https://github.com/sneakykiwi/bmak-tools, "", "", 2021-04-16 07:17:53 +0000 UTC
5, ssh-tail, https://github.com/yashLadha/ssh-tail, "Concurrent ssh-tail sessions and sink option", "client,golang,ssh-session,tailf,workflow", 2021-04-17 15:05:17 +0000 UTC
5, mark2web, https://github.com/thealamu/mark2web, "Markdown to Webpage app", "", 2021-04-17 11:17:00 +0000 UTC
5, scheduler, https://github.com/morgangallant/scheduler, "A simple job scheduler backed by Postgres.", "", 2021-04-15 17:51:59 +0000 UTC
5, formattag, https://github.com/momaek/formattag, "Golang pretty struct tags", "golang,pretty,structtags", 2021-04-16 07:04:24 +0000 UTC
5, word2text, https://github.com/rthomascloud/word2text, "Cli tool to convert Word documents to Text ", "", 2021-04-15 16:40:52 +0000 UTC
5, norm, https://github.com/lus/norm, "A next-gen developer-oriented Discord bot", "", 2021-04-18 11:01:36 +0000 UTC
4, pulumi-automation-api-experiments, https://github.com/komalali/pulumi-automation-api-experiments, "", "", 2021-04-16 03:57:57 +0000 UTC
4, JMS, https://github.com/JaciBrunning/JMS, "Another alternative field management system for the FIRST Robotics Competition.", "", 2021-04-18 13:10:41 +0000 UTC
4, clipSync, https://github.com/vwh/clipSync, "Cross platform local network clipboard sync.", "", 2021-04-18 12:39:47 +0000 UTC
4, spora, https://github.com/itsdux/spora, "", "", 2021-04-18 09:42:07 +0000 UTC
3, miniflux-indexer, https://github.com/QuantumGhost/miniflux-indexer, "", "", 2021-04-15 15:14:30 +0000 UTC
3, Cryptex, https://github.com/ThatOneTallKid/Cryptex, "A command line Crypto-currency ticker made using golang and WazirX Api", "", 2021-04-17 19:10:14 +0000 UTC
3, VirtualBox-Manager, https://github.com/pwdz/VirtualBox-Manager, "", "", 2021-04-15 19:52:22 +0000 UTC
3, go-sardine, https://github.com/tmsi-io/go-sardine, "go microservice", "", 2021-04-20 02:15:37 +0000 UTC
3, sender-agent, https://github.com/zhshch2002/sender-agent, "信达默认Agent。用微信命令服务器执行指令、脚本。", "", 2021-04-16 01:54:55 +0000 UTC
3, merlin-agent-dll, https://github.com/Ne0nd0g/merlin-agent-dll, "", "", 2021-04-17 16:58:24 +0000 UTC
3, movies, https://github.com/lukekrikorian/movies, "search yts.mx for torrents", "", 2021-04-17 00:19:32 +0000 UTC
3, odile, https://github.com/stormon-force/odile, "GUI utility for croc", "", 2021-04-15 02:17:14 +0000 UTC
3, snowflake, https://github.com/barbarbar338/snowflake, "✨ Generate unique IDs (Port of Node package \"generate-snowflake\" to Golang)", "go,golang,id,random,snowflake,twitter,uid,unique,uuid", 2021-04-17 18:58:48 +0000 UTC
3, axon, https://github.com/CompCogNeuro/axon, "Axon (spiking) version of the sims", "", 2021-04-18 07:51:01 +0000 UTC
3, gidevice-cli, https://github.com/electricbubble/gidevice-cli, "gidevice cli", "cli,golang,idevice,idevicekit,ios,iphone,libimobiledevice,usbmuxd,xctest", 2021-04-16 01:51:11 +0000 UTC
3, dbmap, https://github.com/lochv/dbmap, "Father of RustScan github.com/RustScan/RustScan", "golang,masscan,pcap,portscan", 2021-04-20 10:35:01 +0000 UTC
3, go-study-demo, https://github.com/zmcx16/go-study-demo, "", "", 2021-04-16 13:05:27 +0000 UTC
3, Rocket, https://github.com/quentinguidee/Rocket, "A very very simple CLI tool to know the next and previous SpaceX flights.", "go,spacex", 2021-04-15 19:06:56 +0000 UTC
3, sshp, https://github.com/HirazawaUi/sshp, "", "", 2021-04-15 07:54:26 +0000 UTC
3, catalog_tree_utility, https://github.com/abhutiev/catalog_tree_utility, "🌳 📂 The utility displays a tree of directories and files.", "", 2021-04-16 14:23:32 +0000 UTC
2, dynamic-nfs-provisioner-2, https://github.com/watcher00090/dynamic-nfs-provisioner-2, "", "", 2021-04-17 17:59:44 +0000 UTC
2, foo, https://github.com/kashav/foo, "Dynamically checkout, build, and serve old revisions of static websites", "", 2021-04-18 03:32:59 +0000 UTC
2, go-ivm, https://github.com/Theboys619/go-ivm, "Go implementation of Impala", "", 2021-04-19 04:43:12 +0000 UTC
2, omnom, https://github.com/asciimoo/omnom, "A webpage bookmarking and snapshotting service", "", 2021-04-19 15:50:17 +0000 UTC
2, cordcgi, https://github.com/samuel-hunter/cordcgi, "WebCGI for Discord: What could go wrong?", "", 2021-04-15 22:38:08 +0000 UTC
2, ye, https://github.com/beanboi7/ye, "cli using go or something idk", "", 2021-04-17 16:31:34 +0000 UTC
2, filesystem, https://github.com/go-component/filesystem, "filesystem for golang", "", 2021-04-19 08:10:18 +0000 UTC
2, pulumi-yandex, https://github.com/pulumi/pulumi-yandex, "", "", 2021-04-20 09:05:24 +0000 UTC
2, terraform-kubernetes-provider-eks-exec-plugin, https://github.com/Cajga/terraform-kubernetes-provider-eks-exec-plugin, "A lightweight, single binary, exec plugin for terraform's kubernetes provider", "", 2021-04-18 20:14:47 +0000 UTC
2, json, https://github.com/as/json, "fork of encoding/json that fixes omitempty behavior on structs", "", 2021-04-16 02:32:50 +0000 UTC
2, mbdpay, https://github.com/datewu/mbdpay, "", "", 2021-04-15 01:55:48 +0000 UTC
2, FritzL2LVPN, https://github.com/micneu72/FritzL2LVPN, "Erstell VPN Konfiguration zwischen AVM Fritzbox und Linux/Unix (stongSwan)", "", 2021-04-15 15:40:33 +0000 UTC
2, falco-network-operator, https://github.com/rikatz/falco-network-operator, "Controller that generates falco rules based on Network Policies.", "", 2021-04-15 00:14:19 +0000 UTC
2, duckdb-parquet-bugs, https://github.com/nelhage/duckdb-parquet-bugs, "Parquet files and generators for some DuckDB parquet bugs", "", 2021-04-15 16:44:45 +0000 UTC
2, dfa, https://github.com/bean-du/dfa, "", "", 2021-04-20 02:22:20 +0000 UTC
2, pool, https://github.com/FactoryManagerFeng/pool, "", "", 2021-04-15 06:46:33 +0000 UTC
2, fakes3server, https://github.com/railsware/fakes3server, "Fake AWS S3 server for local development", "", 2021-04-19 19:57:51 +0000 UTC
2, goRevolution, https://github.com/The-Revolution-Network/goRevolution, "The Revolution begins with Go", "", 2021-04-18 21:37:19 +0000 UTC
2, goloz, https://github.com/tmc/goloz, "", "", 2021-04-20 02:17:07 +0000 UTC
2, sockety, https://github.com/lbryio/sockety, "All things websocket related for LBRY App communication services", "", 2021-04-16 18:30:07 +0000 UTC
2, k8ssh, https://github.com/guilhem/k8ssh, "Connect to a kubernetes pod with ssh", "", 2021-04-16 12:35:36 +0000 UTC
2, go-pretty, https://github.com/27149chen/go-pretty, "go-pretty", "", 2021-04-16 03:35:03 +0000 UTC
2, go-idgen, https://github.com/jdleo/go-idgen, "idgen is a cryptographically-secure, URL-safe by default, random ID generator as a Go package.", "cryptography,go,golang,random,secure", 2021-04-16 00:46:23 +0000 UTC
2, snake-many-head, https://github.com/OrielOrielOriel/snake-many-head, "Hydra replacement written in Rust. ", "", 2021-04-16 04:40:59 +0000 UTC
2, go-data-structures-course, https://github.com/TutorialEdge/go-data-structures-course, "This is the course materials for the Go Data Structures Crash Course!", "data-structures,go", 2021-04-15 19:04:54 +0000 UTC
2, i18n, https://github.com/alobaton/i18n, "simple i18n support that relies on standard go libraries", "", 2021-04-15 17:12:39 +0000 UTC
2, tinycast, https://github.com/sholiday/tinycast, "Automatically compress podcasts to tiny file sizes for bandwidth constrained devices like cellular.", "", 2021-04-18 15:57:18 +0000 UTC
2, agentless-proxy-app, https://github.com/service-mesh-patterns/agentless-proxy-app, "Example of an application that uses a code based proxy rather than an external entity like a sidecar or node agent", "", 2021-04-18 20:42:35 +0000 UTC
2, StarItAll, https://github.com/KaiDevrim/StarItAll, "Star every repo from any user.", "", 2021-04-19 20:47:36 +0000 UTC
2, GOlang-server-for-Zktec-IOT-device, https://github.com/hamzasaeed2029/GOlang-server-for-Zktec-IOT-device, "", "", 2021-04-16 09:42:51 +0000 UTC
2, go-redisson, https://github.com/wbw295/go-redisson, "", "", 2021-04-16 08:43:05 +0000 UTC
1, BBDC-updates, https://github.com/mccubez/BBDC-updates, "", "", 2021-04-16 04:06:15 +0000 UTC
1, gin-swagger-demo, https://github.com/happyphper/gin-swagger-demo, "gin swagger demo", "", 2021-04-16 05:36:04 +0000 UTC
1, go-wc, https://github.com/sthagen/go-wc, "Experimental word counter implemented in go.", "", 2021-04-17 08:51:35 +0000 UTC
1, LoremIpsumBot, https://github.com/DivideProjects/LoremIpsumBot, "", "", 2021-04-19 10:14:11 +0000 UTC
1, go-tinyurl, https://github.com/beanboi7/go-tinyurl, "URL shortner using tinyurl api", "", 2021-04-16 15:26:16 +0000 UTC
1, fediverse-matrix-keygen, https://github.com/freewizard/fediverse-matrix-keygen, "a self-service Matrix account creation and password reset utility for Mastodon or Pleroma users.", "fediverse,mastodon,matrix,pleroma", 2021-04-17 19:56:03 +0000 UTC
1, LetsProxy, https://github.com/dy6324/LetsProxy, "", "", 2021-04-19 11:56:39 +0000 UTC
1, skycoin-modal, https://github.com/the-skycoin-project/skycoin-modal, "", "", 2021-04-15 01:50:59 +0000 UTC
1, timewheel, https://github.com/jhunters/timewheel, "时间轮golang实现", "", 2021-04-16 05:43:13 +0000 UTC
1, easy-command, https://github.com/wangxudong123/easy-command, "", "", 2021-04-17 20:02:43 +0000 UTC
1, gotodo, https://github.com/wmattei/gotodo, "Learning go because why not????", "", 2021-04-15 17:45:02 +0000 UTC
1, altilia, https://github.com/A9u/altilia, "", "", 2021-04-17 14:37:45 +0000 UTC
1, gopaint, https://github.com/shahfarhadreza/gopaint, "GoPaint is a paint program written in Go", "alpha,drawing,gdiplus,go,golang,golang-application,graphics,paint,painting,windows", 2021-04-17 18:19:00 +0000 UTC
1, xdb, https://github.com/senlinmuvs/xdb, "Operate the kv db like a relational db.", "", 2021-04-19 12:16:58 +0000 UTC
1, srpmproc, https://github.com/rocky-linux/srpmproc, "Upstream package importer with auto patching", "", 2021-04-15 03:44:28 +0000 UTC
1, dcache, https://github.com/huaiyuWangh/dcache, "", "", 2021-04-19 11:57:55 +0000 UTC
