117, mango, https://github.com/muesli/mango, "mango is a man-page generator for the Go flag, pflag, and cobra packages", "", 2022-01-12 15:34:12 +0000 UTC
35, bfile, https://github.com/tidwall/bfile, "A buffer pool file I/O library for Go", "", 2022-01-16 15:29:08 +0000 UTC
28, shallow-explore, https://github.com/tmickleydoyle/shallow-explore, "From the command line, quickly explore data from a CSV file.", "", 2022-01-12 19:46:07 +0000 UTC
21, underpass, https://github.com/cjdenio/underpass, "self-hosted ngrok alternative", "", 2022-01-14 04:53:45 +0000 UTC
20, valse-kubernetes-exporter, https://github.com/ayetkin/valse-kubernetes-exporter, "", "", 2022-01-13 17:04:22 +0000 UTC
16, secretsmanager, https://github.com/titpetric/secretsmanager, "Secrets management that allows you to store your secrets encrypted in git", "", 2022-01-16 21:25:26 +0000 UTC
14, GobypassAv, https://github.com/linshaoSec/GobypassAv, "cs免杀上线", "", 2022-01-12 13:26:24 +0000 UTC
10, gherkingen, https://github.com/hedhyw/gherkingen, "Behaviour Driven Development tests generator for Golang", "bdd,bdd-framework,bdd-style,bdd-style-testing-framework,bdd-tests,behavior-driven-development,boilerplate,generator,go,golang,golang-library,golang-package,test", 2022-01-15 16:10:11 +0000 UTC
9, pat-app, https://github.com/cloudflare/pat-app, "", "", 2022-01-12 16:39:18 +0000 UTC
9, tabouli, https://github.com/Ovyl/tabouli, "", "", 2022-01-13 17:47:32 +0000 UTC
8, gordle, https://github.com/TheDonDope/gordle, "A golang TUI implementation of the popular word quiz wordle!", "go,golang,wordle", 2022-01-15 00:15:47 +0000 UTC
8, boosted-rpc, https://github.com/alii/boosted-rpc, "Show when you're out and about on a Boosted board on your Discord RPC", "board,boosted,discord,rpc,status", 2022-01-17 20:00:59 +0000 UTC
8, crud, https://github.com/hongshengjie/crud, "a mysql crud code generate tool from table DDL sql file", "mariadb,mysql,orm", 2022-01-12 09:39:13 +0000 UTC
8, quota-operator, https://github.com/snapp-incubator/quota-operator, "Enforcing per team quota (sum of used resources across all their namespaces) and delegating the per namespace quota to users.", "golang,k8s-operator,k8s-webhook,kubernetes,policy,snappcloud", 2022-01-14 16:57:54 +0000 UTC
7, gigawallet, https://github.com/dogecoinfoundation/gigawallet, "Dogecoin GigaWallet is a backend service for creating payment platforms, tipping bots, dogecoin exchanges and more.", "", 2022-01-13 12:56:40 +0000 UTC
7, pooli, https://github.com/tooghi/pooli, "Golang goroutine pool with dynamic size", "", 2022-01-13 10:45:36 +0000 UTC
7, GoChat, https://github.com/MukulManni/GoChat, "GoChat is a real time chatting web app written in Go and Gin.", "", 2022-01-12 13:40:12 +0000 UTC
7, gofork, https://github.com/Syycorax/gofork, "", "", 2022-01-17 18:04:49 +0000 UTC
6, git-sum, https://github.com/suadev/git-sum, "Experimental go cli tool to track your open issues and PRs.", "cli,cobra,go,golang", 2022-01-15 18:45:23 +0000 UTC
6, Go-API-Tutorial, https://github.com/techwithtim/Go-API-Tutorial, "Create an API in Go using the Gin framework.", "", 2022-01-15 21:31:58 +0000 UTC
6, evropat, https://github.com/kachvame/evropat, "", "", 2022-01-12 18:06:45 +0000 UTC
6, sabathe, https://github.com/sairson/sabathe, "一个服务端-客户端-植入物的三端式RAT，不完整，仅仅作为学习开源（仅可以命令执行）", "", 2022-01-17 02:28:42 +0000 UTC
5, zscan-poc-check, https://github.com/zyylhn/zscan-poc-check, "zscan的poc扫描模块，独立出来是为了方便以后升级xray poc格式的v2版本", "", 2022-01-12 06:38:30 +0000 UTC
5, fsnotify, https://github.com/lestrrat-go/fsnotify, "fsnotify for Go", "", 2022-01-14 11:41:30 +0000 UTC
5, Scheduler, https://github.com/Ja7ad/Scheduler, "Scheduler package is a zero-dependency scheduling library for Go", "", 2022-01-13 14:38:16 +0000 UTC
5, SHU-autoSelection, https://github.com/Chasing1020/SHU-autoSelection, "上海大学本硕博一体化选课系统自动选课脚本", "", 2022-01-13 14:34:58 +0000 UTC
5, dto-mapper, https://github.com/dranikpg/dto-mapper, "go library for complex struct mapping", "", 2022-01-17 13:45:19 +0000 UTC
5, goutil, https://github.com/zhan3333/goutil, "golang generics util function / golang 泛型工具方法", "", 2022-01-12 07:52:42 +0000 UTC
5, kline, https://github.com/jon4hz/kline, "render klines in the terminal", "", 2022-01-15 05:58:27 +0000 UTC
5, criprof, https://github.com/christianvozar/criprof, "Container Runtime Interface profile", "container,docker,kuber,profil", 2022-01-14 18:17:04 +0000 UTC
5, 2048-terminal, https://github.com/Bios-Marcel/2048-terminal, "2048, but for the terminal", "", 2022-01-15 15:29:00 +0000 UTC
4, sigstore-scaffolding, https://github.com/vaikas/sigstore-scaffolding, "Stuff to make standing up sigstore (esp. for testing) easier for e2e/integration testing.", "", 2022-01-12 17:02:20 +0000 UTC
4, manaita, https://github.com/igtm/manaita, "Simple Markdown-Driven Scaffolding tool written by Go", "code-generation,codegenerator,golang,markdown", 2022-01-13 16:48:14 +0000 UTC
4, DEXbot_Client, https://github.com/DEXbotLLC/DEXbot_Client, "Official codebase and releases for the DEXbot Client application", "automation,command-line-tool,cryptocurrency,decentralized-applications,innovation,security", 2022-01-15 04:48:42 +0000 UTC
4, showcase, https://github.com/zackzhangkai/showcase, "", "", 2022-01-13 04:23:27 +0000 UTC
4, generative, https://github.com/tomarrell/generative, "Generative art experiments", "", 2022-01-13 20:50:36 +0000 UTC
4, buildkit-nofrontend, https://github.com/crazy-max/buildkit-nofrontend, "", "", 2022-01-16 10:08:37 +0000 UTC
4, Aliucord-Patcher, https://github.com/NotZoeyDev/Aliucord-Patcher, "Script to inject Aliucord into a Discord ipa.", "", 2022-01-14 03:39:39 +0000 UTC
4, CreateHiddenAccount, https://github.com/wgpsec/CreateHiddenAccount, "A tool for creating hidden accounts using the registry.", "", 2022-01-16 10:18:50 +0000 UTC
4, slash-milujipraci, https://github.com/FUSAKLA/slash-milujipraci, "Slash command for Slack/Mattermost to post punch lines from http://milujipraci.cz ", "czech-language,lakatos,mattermost,slack,slash-commands", 2022-01-12 22:34:07 +0000 UTC
4, retry, https://github.com/rogpeppe/retry, "Efficient for-loop retries in Go", "", 2022-01-14 18:49:17 +0000 UTC
3, mcc, https://github.com/staex-mcc/mcc, "", "", 2022-01-13 12:07:42 +0000 UTC
3, snippit, https://github.com/juliusmh/snippit, "Generate beautiful syntax highlighted code snippets!", "", 2022-01-13 01:50:21 +0000 UTC
3, KNoC, https://github.com/CARV-ICS-FORTH/KNoC, "KNoC is a Kubernetes Virtual Kubelet that uses an HPC cluster as the container execution environment", "", 2022-01-14 18:33:13 +0000 UTC
3, cvm-blaster, https://github.com/Azure99/cvm-blaster, "Automatically create/destroy/backup/restore tencent cvm instance.", "", 2022-01-14 17:26:40 +0000 UTC
3, originmap, https://github.com/svennergr/originmap, "", "", 2022-01-13 17:00:32 +0000 UTC
3, Opera, https://github.com/TorchedSammy/Opera, "💃 MPRIS implementation for osu!", "dbus,linux,mpris,osu", 2022-01-15 17:07:10 +0000 UTC
3, invaentory, https://github.com/pojntfx/invaentory, "Quickly find all IPv6 and IPv4 hosts in a LAN.", "discovery,ipv6,lan,multicast,network-scanner,ping", 2022-01-14 22:59:53 +0000 UTC
3, Pusher, https://github.com/BaizeSec/Pusher, "Puser 酱是一个的安全推送机器人", "", 2022-01-14 09:03:53 +0000 UTC
3, imperials, https://github.com/hemildesai/imperials, "Strategy games...", "", 2022-01-14 23:10:20 +0000 UTC
3, fet, https://github.com/ahmetcanozcan/fet, "a dynamic way to build mongo queries", "", 2022-01-15 14:42:24 +0000 UTC
3, kplayer-go, https://github.com/bytelang/kplayer-go, "", "", 2022-01-13 08:25:24 +0000 UTC
3, ssentr, https://github.com/tomberek/ssentr, "Send SSE when files change", "", 2022-01-15 21:36:16 +0000 UTC
3, wasmcloud-go, https://github.com/jordan-rash/wasmcloud-go, "", "", 2022-01-12 01:42:29 +0000 UTC
3, blockchain_hello_world, https://github.com/ralvescosta/blockchain_hello_world, "", "", 2022-01-12 09:16:33 +0000 UTC
3, errorfmt, https://github.com/kr/errorfmt, "Go error formatting", "", 2022-01-16 00:42:06 +0000 UTC
3, gosocket, https://github.com/golangpros/gosocket, "A Socket Framework Built Using Golang", "go,golang,linux,macos,socket,windows", 2022-01-16 06:10:43 +0000 UTC
3, go-api-template, https://github.com/OnlyTunesRadio/go-api-template, "", "", 2022-01-12 22:15:56 +0000 UTC
3, cfg, https://github.com/infiniteloopcloud/cfg, "Yet another config package", "", 2022-01-12 12:13:34 +0000 UTC
3, branch, https://github.com/MaikelVeen/branch, "Branch is a small CLI tool to automatically create git branches based on tickets", "cli,git,golang", 2022-01-12 17:05:59 +0000 UTC
3, rosetta-ergo, https://github.com/ross-weir/rosetta-ergo, "", "", 2022-01-13 09:49:40 +0000 UTC
3, SecShell, https://github.com/sairson/SecShell, "一个两端式的RAT工具，用来学习（它并不完善）", "", 2022-01-14 09:17:34 +0000 UTC
2, ffa, https://github.com/df-plus/ffa, "", "", 2022-01-14 02:34:09 +0000 UTC
2, swagger-go-chi, https://github.com/cugu/swagger-go-chi, "Generate a go-chi server from swagger", "go,go-chi,openapi,swagger", 2022-01-12 00:10:32 +0000 UTC
2, parallel_world, https://github.com/argb/parallel_world, "Try to build a p2p network ecosystem", "", 2022-01-15 09:22:08 +0000 UTC
2, RandomWordsPicker, https://github.com/RegularRabbit05/RandomWordsPicker, "dunno, just for fun", "", 2022-01-15 22:06:27 +0000 UTC
2, orchestrator-service, https://github.com/MayankPandey01/orchestrator-service, "A Simple Orchestrator Service implemented using gRPC in Golang", "", 2022-01-14 10:39:21 +0000 UTC
2, tlog, https://github.com/t43Wiu6/tlog, "基于pterm封装而成的log库", "", 2022-01-17 05:50:57 +0000 UTC
2, Golang-Web3, https://github.com/smaster0517/Golang-Web3, "", "", 2022-01-14 09:38:17 +0000 UTC
2, azure-nuke, https://github.com/hrittikhere/azure-nuke, "", "", 2022-01-16 20:27:11 +0000 UTC
2, mantil-template-form-to-dynamodb, https://github.com/christophberger/mantil-template-form-to-dynamodb, "Receive form data and write it to a DynamoDB table", "", 2022-01-12 13:11:53 +0000 UTC
2, GorineeWeb, https://github.com/tae2089/GorineeWeb, "나만의 고 웹프레임워크 만들기", "", 2022-01-14 11:50:30 +0000 UTC
2, clip, https://github.com/saucesteals/clip, "A simple and robust clipboard manager", "", 2022-01-12 11:49:55 +0000 UTC
2, slack-wh, https://github.com/vinshop/slack-wh, "", "", 2022-01-13 08:35:58 +0000 UTC
2, ssh-lxd, https://github.com/hdahlheim/ssh-lxd, "ssh into lxd container POC", "poc,wip,wip-do-not-use", 2022-01-14 01:34:13 +0000 UTC
2, gh-environments, https://github.com/chelnak/gh-environments, "A gh-cli extension for managing environments.", "gh-extension", 2022-01-14 16:05:24 +0000 UTC
2, newsletter_awesome_articles, https://github.com/codingpot/newsletter_awesome_articles, "The aim of this project is to publish and archive newsletters to a target email address. ", "", 2022-01-14 13:46:19 +0000 UTC
2, sshBruteforcer, https://github.com/cli-ish/sshBruteforcer, "golang sshBruteforcer", "bruteforce,ctf-tools,go,golang,proxy,socket5,ssh", 2022-01-14 22:33:48 +0000 UTC
2, herd, https://github.com/ibuildthecloud/herd, "Cute Fluffy Portable Apps", "", 2022-01-16 05:22:04 +0000 UTC
2, go-web-scaffold, https://github.com/Statrue/go-web-scaffold, "This is a simple scaffold for building web app quickly", "", 2022-01-17 09:23:14 +0000 UTC
2, hilo, https://github.com/mmatongo/hilo, "It's a news thing for the terminal.", "", 2022-01-12 16:23:24 +0000 UTC
2, LAN-Share, https://github.com/jinliming2/LAN-Share, "Share plain text, images and files in Local area network.", "", 2022-01-12 13:33:03 +0000 UTC
2, LaMetricMatrixBridge, https://github.com/wwhtrbbtt/LaMetricMatrixBridge, "Notifies you about new matrix messages on your LaMetric Time (https://lametric.com/en-US)", "lametric,lametric-time,matrix-bridge,matrix-org", 2022-01-15 14:38:09 +0000 UTC
2, genv, https://github.com/Vdgonc/genv, "A Golang library to manage your environment variables using structs.", "", 2022-01-12 23:31:00 +0000 UTC
2, wotoplatform, https://github.com/AnimeKaizoku/wotoplatform, "", "", 2022-01-13 08:23:23 +0000 UTC
2, accept-interfaces-return-structs, https://github.com/sakiib/accept-interfaces-return-structs, "", "", 2022-01-14 08:43:47 +0000 UTC
2, golanjs, https://github.com/NastyPigz/golanjs, "Trying to make a framework with Golang", "", 2022-01-16 04:00:49 +0000 UTC
2, HyperKit, https://github.com/carterpeel/HyperKit, "", "", 2022-01-14 17:47:41 +0000 UTC
2, gover, https://github.com/IlayBokobza/gover, "A small library for go, that make create web server easier.", "", 2022-01-14 10:42:15 +0000 UTC
2, gologger, https://github.com/anthonydroberts/gologger, "A cross-platform productivity tool that enables quick & easy logging for terminal commands", "", 2022-01-12 18:37:51 +0000 UTC
2, TeleBeam, https://github.com/dierk-bentpiening/TeleBeam, "TeleBeam ist an Telegram Bot to Upload, Store and Share you Files on Telegram without local Storage", "", 2022-01-15 13:12:01 +0000 UTC
2, monorepo, https://github.com/kamolhasan/monorepo, "", "", 2022-01-16 15:07:46 +0000 UTC
2, golang-course, https://github.com/vagnerwentz/golang-course, "The repository intent is store some Go Lang codes.", "", 2022-01-16 02:26:28 +0000 UTC
2, go-rkvendorstorage, https://github.com/Jamesits/go-rkvendorstorage, "A pure Golang implementation of Rockchip rknand vendor storage interface.", "rockchip", 2022-01-15 15:08:35 +0000 UTC
2, go-type-tools, https://github.com/eloonstra/go-type-tools, "A library containing useful functions for working with Go types like filters, union, intersection and more!", "filter,filters,go,golang,intersection,lib,library,union,utilities,utility", 2022-01-12 13:24:47 +0000 UTC
2, rzap, https://github.com/winking324/rzap, "easy rotatable zap", "golang,log,lumberjack,rotate,zap", 2022-01-12 03:59:15 +0000 UTC
2, SberZvuk-Downloader, https://github.com/Sorrow446/SberZvuk-Downloader, "SberZvuk (СберЗвук) downloader written in Go.", "", 2022-01-14 14:32:37 +0000 UTC
2, intra-atelier, https://github.com/Atelier-Epita/intra-atelier, "", "", 2022-01-13 02:31:57 +0000 UTC
2, goblog, https://github.com/Onurhan1337/goblog, "", "", 2022-01-15 20:27:43 +0000 UTC
2, salmon, https://github.com/actualdankcoder/salmon, "Salmon is a music tracking web server", "", 2022-01-16 12:35:13 +0000 UTC
