67, confused, https://github.com/visma-prodsec/confused, "Tool to check for dependency confusion vulnerabilities in multiple package management systems", "", 2021-02-10 09:06:56 +0000 UTC
41, gengine, https://github.com/bilibili/gengine, "", "", 2021-02-07 09:15:00 +0000 UTC
22, qlite, https://github.com/culion-bear/qlite, "NewSQL distributed storage database based on micro service framework", "", 2021-02-05 08:40:09 +0000 UTC
21, bramble, https://github.com/movio/bramble, "The Movio GraphQL Gateway", "", 2021-02-05 02:23:02 +0000 UTC
15, go-kenall, https://github.com/osamingo/go-kenall, "Unofficially kenall (ケンオール) client written by Go", "client,go,kenall,postalcode", 2021-02-08 08:01:08 +0000 UTC
14, getistio, https://github.com/tetratelabs/getistio, "", "", 2021-02-10 05:32:00 +0000 UTC
13, ccv, https://github.com/smlx/ccv, "Conventional Commits Versioner", "continuous-delivery,go,golang", 2021-02-07 15:51:29 +0000 UTC
13, godal, https://github.com/airbusgeo/godal, "golang wrapper for github.com/OSGEO/gdal", "", 2021-02-05 17:27:05 +0000 UTC
12, reminder, https://github.com/KrishanBhalla/reminder, "Reminder is a Golang package to allow users to schedule alerts.", "", 2021-02-08 21:41:00 +0000 UTC
9, ptree, https://github.com/tidwall/ptree, "A data structure for storing points.", "", 2021-02-08 19:41:42 +0000 UTC
7, binnacle, https://github.com/whereswaldon/binnacle, "Explore Prometheus data from a fast, lightweight, desktop GUI", "", 2021-02-05 21:06:10 +0000 UTC
7, 115sha1, https://github.com/user1121114685/115sha1, "115sha1是一款免费，高效的115网盘SHA1导入导出软件。简单免费且开源。", "", 2021-02-06 06:06:16 +0000 UTC
7, image-scanning-using-trivy-as-go-library, https://github.com/developer-guy/image-scanning-using-trivy-as-go-library, "Demonstrate how you can use image scanner called Trivy as a golang library", "", 2021-02-07 11:02:19 +0000 UTC
6, CVE-2021-3156, https://github.com/jm33-m0/CVE-2021-3156, "sudo heap overflow to LPE, in Go", "", 2021-02-09 07:55:47 +0000 UTC
6, flounder, https://github.com/alexwennerberg/flounder, "A small site builder for the Gemini protocol", "", 2021-02-10 05:05:41 +0000 UTC
6, prtree, https://github.com/tidwall/prtree, "hybrid spatial data structure", "", 2021-02-08 20:41:23 +0000 UTC
6, go-react, https://github.com/bmurray/go-react, "", "", 2021-02-10 17:10:07 +0000 UTC
6, shieldwall, https://github.com/evilsocket/shieldwall, "shieldwall.me agent and api service", "firewall,firewall-manager,hide,security,server", 2021-02-09 01:42:41 +0000 UTC
5, go_container, https://github.com/liusuxian/go_container, "golang container", "", 2021-02-05 06:14:54 +0000 UTC
5, goAlarmClock, https://github.com/yakutozcan/goAlarmClock, "", "", 2021-02-06 21:00:33 +0000 UTC
5, gee, https://github.com/hahwul/gee, "🏵 Standard input to each files and stdout. similar to tee, But there's a little bit more and Write in go", "bugbounty-tool,command-line-tool,golang,pipelines,security-tools,tee,utility", 2021-02-08 13:18:59 +0000 UTC
4, go-redoc, https://github.com/mvrilo/go-redoc, "go-redoc is an embedded OpenAPI/Swagger documentation ui for Go using ReDoc", "documentation,go,openapi,redoc,swagger", 2021-02-07 20:10:45 +0000 UTC
4, marauder, https://github.com/AlexanderBrevig/marauder, "I solemnly swear I am up to no good", "golang,offsec,oscp,osint,pentest,report", 2021-02-05 23:59:04 +0000 UTC
4, thumbnail-server, https://github.com/anilmisirlioglu/thumbnail-server, "Website Thumbnail & Screenshot Generator", "chromedp,screenshot,thumbnail", 2021-02-05 18:06:07 +0000 UTC
4, phoenix, https://github.com/hoomanist/phoenix, "a simple music player ", "", 2021-02-08 19:37:13 +0000 UTC
4, Path-Of-Gamepad, https://github.com/Steven-Ireland/Path-Of-Gamepad, "Controller adapter for path of exile", "", 2021-02-06 21:04:14 +0000 UTC
4, dothill-csi, https://github.com/enix/dothill-csi, "Dothill (Seagate) AssuredSAN dynamic provisioner for Kubernetes (CSI plugin).", "", 2021-02-08 11:21:13 +0000 UTC
4, go-controller-request-mapping, https://github.com/johnpili/go-controller-request-mapping, "My attempt in implementing RequestMapping equivalent per controller in Golang. Organize the controllers like in Spring Framework", "golang,spring-framework", 2021-02-06 16:30:43 +0000 UTC
4, gorillavim-16-livecoding, https://github.com/mattn/gorillavim-16-livecoding, "", "", 2021-02-10 15:39:20 +0000 UTC
4, zero-examples, https://github.com/zeromicro/zero-examples, "go-zero examples", "", 2021-02-08 13:59:29 +0000 UTC
4, Gimic, https://github.com/TerminalJockey/Gimic, "Gimic is a go based webshell that will interpret and execute arbitrary go code in memory transmitted via http/tcp connection", "", 2021-02-06 15:46:00 +0000 UTC
4, gocommit, https://github.com/po1yb1ank/gocommit, "Auto git commit generator and pusher", "", 2021-02-09 14:21:52 +0000 UTC
3, emptty, https://github.com/mitranim/emptty, "Clears the terminal, for real. (But probably only on my system.)", "golang,terminal", 2021-02-07 13:22:28 +0000 UTC
3, ssrf-tool, https://github.com/R0X4R/ssrf-tool, "An SSRF detector tool written in golang. I have fixed some errors and added some more payloads to it. But the tool credits go to z0idsec.", "bugbounty,bugbounty-tool,bugbountytips,go,ssrf,ssrf-tool,tools", 2021-02-09 14:45:51 +0000 UTC
3, url-shortener, https://github.com/royalbhati/url-shortener, "[WIP] URL Shortener", "", 2021-02-07 11:34:45 +0000 UTC
3, brokerc, https://github.com/godaner/brokerc, "brokerc is a cross platform publish subscribe client, including mqtt client, amqp client, kafka client, http client.", "amqp,amqp-client,http,http-client,https,kafka,kafka-client,kafka-connect,kafka-consumer,kafka-producer,mqtt,mqtt-broker,mqtt-client,mqtt-protocol,rabbit,rabbitmq,rabbitmq-client,rabbitmq-consumer,rabbitmq-producer", 2021-02-07 09:14:33 +0000 UTC
3, options-codegen, https://github.com/Feresey/options-codegen, "", "", 2021-02-09 11:08:39 +0000 UTC
3, walle, https://github.com/Germiniku/walle, "go实现的弹幕消息推送系统", "", 2021-02-05 09:50:01 +0000 UTC
3, minicni, https://github.com/morvencao/minicni, "", "", 2021-02-05 14:06:19 +0000 UTC
3, go-cli-template, https://github.com/kkdai/go-cli-template, "Golang CLI Template with GoReleaser github action", "", 2021-02-09 07:38:37 +0000 UTC
3, mtls-proxy, https://github.com/moonrhythm/mtls-proxy, "", "", 2021-02-08 15:35:29 +0000 UTC
3, strap, https://github.com/hadenpf/strap, "🔫 stay (boot)strapped", "", 2021-02-06 05:57:31 +0000 UTC
3, chaos-agent, https://github.com/chaosblade-io/chaos-agent, "chaos-agent", "", 2021-02-08 10:14:37 +0000 UTC
3, concurrency, https://github.com/johanbrandhorst/concurrency, "Concurrency example", "", 2021-02-06 10:59:12 +0000 UTC
3, xor-cracker, https://github.com/AICDEV/xor-cracker, "xor cracker written in golang", "", 2021-02-09 12:30:13 +0000 UTC
3, brograb, https://github.com/Sho0pi/brograb, "", "", 2021-02-05 15:11:01 +0000 UTC
3, leetcode, https://github.com/luoyunhe/leetcode, "", "", 2021-02-08 07:01:26 +0000 UTC
2, gitee-image-hosting, https://github.com/hezhizheng/gitee-image-hosting, "gitee 图床", "gitee,gitee-api,image-hosting", 2021-02-07 09:05:24 +0000 UTC
2, why, https://github.com/zorchenhimer/why, "", "", 2021-02-08 01:58:33 +0000 UTC
2, alarmserver, https://github.com/toxuin/alarmserver, "IP Camera Alarm Server to MQTT", "", 2021-02-05 07:17:54 +0000 UTC
2, fanyi, https://github.com/monaco-io/fanyi, "", "", 2021-02-06 08:10:10 +0000 UTC
2, WebDriver, https://github.com/dreygur/WebDriver, "Selenium is often used in my many projects. So when I have learned Golang, I searched for a module that acts like selenium or the selenium official module for golang. But all I found was not the thing I always wanted. And so I'm trying to do the thing of browser automation by myself.", "", 2021-02-07 19:19:09 +0000 UTC
2, clearweb, https://github.com/gl00my/clearweb, "", "", 2021-02-06 14:47:52 +0000 UTC
2, eopkg-graph, https://github.com/guillotjulien/eopkg-graph, "A CLI utility to generate the runtime dependency graph of a package from its eopkg metadata.", "", 2021-02-05 09:40:16 +0000 UTC
2, faketime, https://github.com/gowins/faketime, "A faketime tool by Go", "", 2021-02-07 02:20:39 +0000 UTC
2, aws-s3-stream, https://github.com/gogama/aws-s3-stream, "Read S3 objects in parallel into a stream", "", 2021-02-09 06:09:51 +0000 UTC
2, cert-manager-webhook-domeneshop, https://github.com/domeneshop/cert-manager-webhook-domeneshop, "A cert-manager DNS01 webhook for the Domeneshop DNS provider", "", 2021-02-08 10:52:42 +0000 UTC
2, monerorpc, https://github.com/MarinX/monerorpc, "Full Monero RPC client(Wallet AND Daemon) written in go", "monero,monero-api,monero-daemon,monero-integrations,monero-library,monero-wallet-rpc", 2021-02-05 10:55:53 +0000 UTC
2, eve_auth_cloud_functions, https://github.com/mogeta/eve_auth_cloud_functions, "EVEOnlineの認証をcloud functionでやる。", "", 2021-02-07 07:41:58 +0000 UTC
2, client-go, https://github.com/shahincsejnu/client-go, "", "", 2021-02-08 06:31:37 +0000 UTC
2, md-tools, https://github.com/mknyszek/md-tools, "", "", 2021-02-08 19:34:35 +0000 UTC
2, pacer-model, https://github.com/mknyszek/pacer-model, "Simulation of various Go GC pacer models", "", 2021-02-06 01:28:22 +0000 UTC
2, messagebus-golang-kafka, https://github.com/kata-ai/messagebus-golang-kafka, "Message Bus for Golang Kafka", "", 2021-02-09 02:38:18 +0000 UTC
2, GoDrive, https://github.com/raifpy/GoDrive, "Google Drive Client like workers", "google-drive,workers", 2021-02-06 22:25:09 +0000 UTC
2, cni_macvlan, https://github.com/ppdaicorp/cni_macvlan, "信也科技改造过的支持静态IP的macvlan", "", 2021-02-07 07:44:04 +0000 UTC
2, ssh-web-auth, https://github.com/Jipok/ssh-web-auth, "", "", 2021-02-07 17:18:57 +0000 UTC
2, bippy, https://github.com/jlogelin/bippy, "Golang implementation of the BIP32/BIP39/BIP43/BIP44/SLIP44/BIP49/BIP84/BIP173 for creating and recoverying keys, mnemonic seeds and Hierarchical Deterministic (HD) addresses.", "bip39,bitcoin,ethereum,ledger", 2021-02-06 18:06:46 +0000 UTC
2, dev, https://github.com/cockroachdb/dev, "A utility for performing common CockroachDB development tasks", "", 2021-02-08 21:26:51 +0000 UTC
2, vole, https://github.com/aschmahmann/vole, "a collection of tools for digging around IPFS nodes", "", 2021-02-10 06:00:55 +0000 UTC
2, polx, https://github.com/phoban01/polx, "Generate IAM Policies from AWS CloudTrail Events", "aws,aws-iam,devops,golang,terraform,utilities", 2021-02-05 23:42:18 +0000 UTC
2, numfmt, https://github.com/jackc/numfmt, "Number formatting in Go", "", 2021-02-06 21:40:03 +0000 UTC
2, clubhouseapi, https://github.com/lafin/clubhouseapi, "clubhouse api", "clubhouse-api,clubhouseapi", 2021-02-07 22:22:12 +0000 UTC
2, go-grpc-microservices, https://github.com/EricLau1/go-grpc-microservices, "Go GRPC With Kubernetes on Minikube", "", 2021-02-09 16:33:10 +0000 UTC
2, go-listener, https://github.com/viknesh-nm/go-listener, "Build go projects automatically when files get modified.", "", 2021-02-05 20:06:47 +0000 UTC
2, traefik-opa-plugin, https://github.com/team-carepay/traefik-opa-plugin, "Traefik plugin which connects to Open Policy Agent", "traefik-plugin", 2021-02-05 22:46:36 +0000 UTC
2, terraform-provider-cloudtamerio, https://github.com/cloudtamer-io/terraform-provider-cloudtamerio, "Terraform Provider for cloudtamer.io", "terraform,terraform-provider", 2021-02-08 21:44:06 +0000 UTC
2, turbo-go, https://github.com/akmittal/turbo-go, "Build hotwire apps using go", "go-template,golang,hotwire,hotwire-turbo", 2021-02-05 11:04:48 +0000 UTC
2, multireader, https://github.com/mcpherrinm/multireader, "multireader.Buffer", "", 2021-02-09 02:12:40 +0000 UTC
2, unihtml, https://github.com/unidoc/unihtml, "UniHTML client for UniHTML", "", 2021-02-08 12:47:10 +0000 UTC
2, go-starter-project, https://github.com/aldyrifaldi/go-starter-project, "Starter Project include library echo, gorm, godotenv.", "", 2021-02-09 05:03:06 +0000 UTC
2, maybe, https://github.com/chermehdi/maybe, "A probabilistic data structures library written in Go", "", 2021-02-06 15:25:14 +0000 UTC
2, Gate, https://github.com/mrNobody95/Gate, "The Golang Algo Trading Engine ", "", 2021-02-07 20:37:52 +0000 UTC
2, go-embed, https://github.com/embedas/go-embed, "Embed.as API client written in Go (golang).", "", 2021-02-08 19:03:24 +0000 UTC
2, mssql-always-encrypted, https://github.com/swisscom/mssql-always-encrypted, "An utils library to work with MSSQL Always Encrypted features", "", 2021-02-09 15:50:03 +0000 UTC
2, cli, https://github.com/x0tf/cli, "", "", 2021-02-07 14:33:28 +0000 UTC
2, go_boilerplate, https://github.com/saidamir98/go_boilerplate, "Go Boilerplate for medium sized projects", "", 2021-02-05 07:13:36 +0000 UTC
2, tgTwitterBridge, https://github.com/raifpy/tgTwitterBridge, "Telegram Channel - Twitter Tweet Bridge ", "telegram,telegram-bot,twitter", 2021-02-10 13:40:13 +0000 UTC
2, bintly, https://github.com/viant/bintly, "super fast binary serialization for go", "", 2021-02-09 21:09:56 +0000 UTC
2, heartbeat, https://github.com/l1ving/heartbeat, "Living's Digital Heartbeat", "fasthttp,go,golang,webserver", 2021-02-08 18:41:26 +0000 UTC
2, storage, https://github.com/buraksekili/storage, "storage provides gRPC server and client for image uploading and storage.", "", 2021-02-08 18:33:50 +0000 UTC
1, cors-proxy, https://github.com/derat/cors-proxy, "Trivial HTTP proxy that adds Access-Control-Allow-Origin: *", "", 2021-02-06 22:21:44 +0000 UTC
1, hugo-g2plot, https://github.com/Euraxluo/hugo-g2plot, "", "", 2021-02-07 14:06:16 +0000 UTC
1, agen, https://github.com/gavrilaf/agen, "", "", 2021-02-05 09:50:08 +0000 UTC
1, codingame-go-template, https://github.com/hanabi1224/codingame-go-template, "Codingame template for golang to allow multi-file local repo and non-std libraries", "", 2021-02-07 22:18:33 +0000 UTC
1, Turrium, https://github.com/Reclyptor/Turrium, "Media Management Portal", "", 2021-02-08 03:24:09 +0000 UTC
1, go-beans, https://github.com/hsjsjsj009/go-beans, "This repository contains a Golang Dependency Injector that inspired by Spring Boot Bean System", "", 2021-02-06 11:24:56 +0000 UTC
1, gpshr, https://github.com/jumang4423/gpshr, "y not adding ugly sounds when u git push", "darwin,git,golang,linux", 2021-02-10 12:53:01 +0000 UTC
1, vpsman, https://github.com/linuxing3/vpsman, "", "", 2021-02-08 16:56:02 +0000 UTC
1, webbed, https://github.com/kilobit/webbed, "Simple utilities for building Web Applications in Golang.", "", 2021-02-09 22:19:38 +0000 UTC
1, IOTA-SmartContracts, https://github.com/brunoamancio/IOTA-SmartContracts, "", "", 2021-02-09 03:16:03 +0000 UTC
