371, topaz, https://github.com/aserto-dev/topaz, "Cloud-native authorization for modern applications and APIs", "abac,access-control,api,authorization,cloud-native,opa,rbac,rebac,zanzibar", 2022-10-23 15:54:10 +0000 UTC
152, cdebug, https://github.com/iximiuz/cdebug, "cdebug - experimental container debugger (WIP)", "containerd,containers,debug,distroless,docker,kubernetes", 2022-10-22 15:22:44 +0000 UTC
120, MediaUnlockTest, https://github.com/nkeonkeo/MediaUnlockTest, "MediaUnlockTest in golang", "", 2022-10-14 14:04:18 +0000 UTC
99, webpty, https://github.com/mickael-kerjean/webpty, "A secure webshell", "bash,terminal-app,webshell,webterminal", 2022-10-13 07:50:09 +0000 UTC
66, Darksteel, https://github.com/wjlab/Darksteel, "Attack Domain Kerberos LDAP", "", 2022-10-13 03:33:32 +0000 UTC
62, mpeg, https://github.com/gen2brain/mpeg, "MPEG-1 Video decoder, MP2 Audio decoder and MPEG-PS Demuxer in pure Go", "", 2022-10-23 14:39:16 +0000 UTC
53, detek, https://github.com/kakao/detek, "Extensible problem-detecting CLI tool for reliable Kubernetes cluster operations and rapid problem detections.", "", 2022-10-18 07:27:28 +0000 UTC
30, oidc-ssrf, https://github.com/doyensec/oidc-ssrf, "An Evil OIDC Server", "", 2022-10-19 15:25:07 +0000 UTC
27, tart, https://github.com/nanmu42/tart, "A Toy Gitlab CI Runner backed by Firecracker MicroVM | åŸºäºFirecracker MicroVMçš„ç©å…·Gitlab CI Runner", "firecracker,firecracker-microvms,gitlab,gitlab-ci,gitlab-runner,go,golang", 2022-10-24 15:38:57 +0000 UTC
24, debug-ctr, https://github.com/felipecruz91/debug-ctr, "Commandline tool for interactive container troubleshooting.", "", 2022-10-22 17:44:18 +0000 UTC
23, GTT, https://github.com/eeeXun/GTT, "Google Translate TUI", "", 2022-10-24 15:41:41 +0000 UTC
22, og, https://github.com/sheepla/og, "A typo correcting tool for Go programmers", "go,go-cli,go-command,gopher,joke,joke-cli,joke-command,typo,typo-correction", 2022-10-13 11:34:42 +0000 UTC
22, Dirscan, https://github.com/corunb/Dirscan, "Dirscanæ˜¯ä¸€æ¬¾ç”±goç¼–å†™çš„é«˜å¹¶å‘çš„ç›®å½•æ‰«æå™¨ï¼Œç°åœ¨å·²ç»æ”¯æŒGETã€HEADã€é€’å½’æ‰«æç­‰åŠŸèƒ½åŠŸèƒ½,åç»­åŠªåŠ›å®ç°æ›´å¤šåŠŸèƒ½ã€‚", "", 2022-10-13 06:30:38 +0000 UTC
21, vAdmin, https://github.com/sftfjugg/vAdmin, "", "", 2022-10-15 12:05:05 +0000 UTC
21, pgq, https://github.com/henvic/pgq, "pgq is a query builder for PostgreSQL written in Go.", "go,golang,postgres,postgresql", 2022-10-16 18:40:42 +0000 UTC
20, SMGo, https://github.com/bilibili/SMGo, "SM cipher library. Constant-time implementation of SM2 and SM4.", "constant-time,elliptic-curve,gcm,gfni,neon,sm2,sm4", 2022-10-17 03:44:34 +0000 UTC
20, genjector, https://github.com/Ompluscator/genjector, "Reflection-free Run-Time Dependency Injection framework for Go 1.18+", "", 2022-10-14 15:12:09 +0000 UTC
20, cloak, https://github.com/mr-karan/cloak, "Securely share sensitive text with others", "encryption,secrets", 2022-10-13 17:12:54 +0000 UTC
19, ClickonceHunter, https://github.com/zyn3rgy/ClickonceHunter, "Golang search engine scraper intended for identification of published ClickOnce deployments", "", 2022-10-14 04:02:57 +0000 UTC
18, gorox, https://github.com/hexinfra/gorox, "Gorox is an HTTP server, application server, microservice server, and proxy server.", "", 2022-10-21 01:59:33 +0000 UTC
16, siphon, https://github.com/liamg/siphon, ":alembic: Intercept stdin/stdout/stderr for any process", "input-output,intercept,ptrace,spy,syscalls", 2022-10-26 18:46:18 +0000 UTC
16, sato, https://github.com/JamesWoolfenden/sato, "Sato converts CFN into Terraform", "cfn,cloudformation,terraform", 2022-10-14 13:22:43 +0000 UTC
15, howto, https://github.com/Guitaricet/howto, "How to do bash commands you always forget. OpenAI-powered.", "", 2022-10-22 18:33:58 +0000 UTC
15, sync-proxy, https://github.com/flashbots/sync-proxy, "Proxy from consensus client to block builders ", "", 2022-10-13 10:53:31 +0000 UTC
14, stegosecrets, https://github.com/enrichman/stegosecrets, "Encrypt and share secrets among trusted peers with AES-256, SSS and steganography", "aes,aes-encryption,go,golang,hacktoberfest,shamir-secret-sharing,sss,steganography", 2022-10-18 22:58:49 +0000 UTC
14, gol, https://github.com/yakuter/gol, "Go implementation of Linux commands", "", 2022-10-20 12:36:48 +0000 UTC
13, nasp, https://github.com/cisco-open/nasp, "Nasp, can be used to expand Istio to services where the proxy model is not applicable.", "", 2022-10-20 17:56:42 +0000 UTC
13, runzmd, https://github.com/openziti/runzmd, "Runnable Markdown for Tutorials and Demos", "golang,markdown", 2022-10-20 19:37:58 +0000 UTC
13, GoGen, https://github.com/YABOIpy/GoGen, "Discord Token Generator / Member Booster WORKING - 10/25/2022", "", 2022-10-26 11:06:08 +0000 UTC
12, octopus, https://github.com/octopus-foundation/octopus, "", "", 2022-10-18 02:37:02 +0000 UTC
12, mysql-args-anonymizer, https://github.com/rakyll/mysql-args-anonymizer, "", "", 2022-10-19 00:05:15 +0000 UTC
11, upload-assets-to-release-with-go, https://github.com/ahsand97/upload-assets-to-release-with-go, "Cross platform GitHub action to upload multiple assets to a release using Golang", "ci,golang", 2022-10-19 00:02:54 +0000 UTC
10, Kyuubi, https://github.com/Linuxinet/Kyuubi, "Kyuubi is a Telegram bot written in Golang. a multipurpose telegram bot to use in recon process. Don't you have access to terminal to do recon while hacking, you can use this bot to do recon with Telegram.", "bugbounty-tool,golang,hacking,recon,telegram-bot", 2022-10-13 09:36:21 +0000 UTC
10, rest-api-starter, https://github.com/xceejay/rest-api-starter, "Blazingly fast RESTful API starter in Golang for small to medium scale projects. ", "", 2022-10-19 12:18:50 +0000 UTC
9, alibaba-load-balancer-controller, https://github.com/alibaba/alibaba-load-balancer-controller, "", "", 2022-10-18 06:41:50 +0000 UTC
9, bonk, https://github.com/DeterminateSystems/bonk, "Erase macOS machines over Tailscale.", "", 2022-10-14 23:33:38 +0000 UTC
9, chin, https://github.com/adhocore/chin, "A GO lang library to show a spinner as user waits for any long running jobs to finish.", "cli,golang,spin,spinner,terminal", 2022-10-24 04:05:46 +0000 UTC
9, cloudenv, https://github.com/aidansteele/cloudenv, "", "", 2022-10-20 08:17:42 +0000 UTC
8, table_data_compare, https://github.com/joshua0x/table_data_compare, "", "", 2022-10-23 04:01:35 +0000 UTC
8, token-factory, https://github.com/CosmWasm/token-factory, "Pulling out Osmosis token factory module and the custom CosmWasm bindings into it's own repo for easier reuse", "", 2022-10-20 20:03:36 +0000 UTC
8, rvld, https://github.com/ksco/rvld, "A minimum RV64GC linker for educational purposes.", "", 2022-10-24 05:41:21 +0000 UTC
8, cronplan, https://github.com/winebarrel/cronplan, "Cron expression parser for Amazon EventBridge.", "aws,cloudwatch-events,cron,eventbridge,golang,parser", 2022-10-16 12:44:36 +0000 UTC
8, blockscan, https://github.com/twiny/blockscan, "a mini blockchain scanner", "blockchain,blockchain-explorer,golang,microservices,sqlite", 2022-10-13 08:26:24 +0000 UTC
8, redis-lock, https://github.com/gotomicro/redis-lock, "åŸºäº Redis å®ç°çš„åˆ†å¸ƒå¼é”", "", 2022-10-13 03:11:27 +0000 UTC
7, noop, https://github.com/traefik-contrib/noop, "A plugin that always answer the same status code without calling a service/server.", "traefik-plugin", 2022-10-17 07:36:29 +0000 UTC
7, discord-applemusic-rich-presence, https://github.com/caarlos0/discord-applemusic-rich-presence, "Discord's Rich Presence from Apple Music", "apple-music,applemusic,discord,discord-rich-presence,discord-rpc,itunes-search-api,osascript", 2022-10-25 02:11:25 +0000 UTC
7, learnGo, https://github.com/Schutz3/learnGo, "learn golang 4 rep owner", "go,golang,learning-exercise", 2022-10-17 11:27:39 +0000 UTC
7, socks5d, https://github.com/lcvvvv/socks5d, "ä¸€ä¸ªç®€å•çš„socks5æœåŠ¡å™¨ï¼Œå®ç°ä¸€é”®å¯åŠ¨æœ¬æœºsocks5ä»£ç†æœåŠ¡ï¼ŒåŒæ—¶æ”¯æŒè®¾ç½®ç®€å•çš„é‰´æƒã€‚", "", 2022-10-25 06:10:49 +0000 UTC
7, r10edocker, https://github.com/syncom/r10edocker, "Make minimum, reproducible Docker container for Go application", "distroless-docker,docker-container,docker-image,golang,nix,reproducible-builds", 2022-10-16 01:01:13 +0000 UTC
7, joy-typing, https://github.com/aj3423/joy-typing, "Use computer with Voice Typing and Joy-Con controller", "", 2022-10-18 05:18:39 +0000 UTC
6, Web-API-Server, https://github.com/opencsd/Web-API-Server, "", "", 2022-10-24 07:56:28 +0000 UTC
6, databend-go, https://github.com/databendcloud/databend-go, "Golang driver for databend cloud", "", 2022-10-20 03:28:16 +0000 UTC
6, interruptible-websocket-proxy, https://github.com/krishnakumar4a4/interruptible-websocket-proxy, "A web socket proxy tolerant of backend service interruptions occur due to scaling, load balancing, deployments, quick restarts, minor network interruptions etc", "", 2022-10-13 15:55:14 +0000 UTC
6, option-go, https://github.com/joetifa2003/option-go, "A generic optional type library for golang like the rust option enum", "", 2022-10-16 03:22:44 +0000 UTC
6, go-base-backend, https://github.com/geshtng/go-base-backend, "Example implementation go backend architecture.", "backend,gin,go,golang,gorm,postgresql,rest,rest-api", 2022-10-13 10:33:20 +0000 UTC
6, dq, https://github.com/bitbears-dev/dq, "ğŸ“… jq for date / time â²", "", 2022-10-23 13:09:14 +0000 UTC
6, pyramid, https://github.com/amirhnajafiz/pyramid, "Fast generic Heap data structure in Golang", "go,golang,heap,heapsort-algorithm,max-heap,min-heap,priority-queue", 2022-10-15 17:07:09 +0000 UTC
6, lagran, https://github.com/lagran007/lagran, "æœ¬å°ç¨‹åºä¸»è¦ç”¨æ¥å®ç°Genevaçš„ä»¥ä¸‹å››æ¡è§„åˆ™ï¼Œè¿˜å¯ä»¥è‡ªå®šä¹‰ç«¯å£ã€éœ€è¦ä¿®æ”¹çš„window sizeçš„å€¼ã€‚", "", 2022-10-20 08:37:58 +0000 UTC
6, httperror, https://github.com/johnwarden/httperror, "Golang package for returning errors instead of handling them directly", "", 2022-10-17 19:47:51 +0000 UTC
6, md2sql, https://github.com/shibukawa/md2sql, "", "erd,erdiagram,sql", 2022-10-17 08:03:45 +0000 UTC
6, event-sourcing-with-go, https://github.com/suzushin54/event-sourcing-with-go, "Go Conference mini 2022 Autumn IN SENDAI ã®ãƒˆãƒ¼ã‚¯ã€ŒèªçŸ¥çš„è¤‡é›‘åº¦ã‹ã‚‰è¦‹ã‚‹Goè¨€èªã®ã‚¤ãƒ™ãƒ³ãƒˆã‚½ãƒ¼ã‚·ãƒ³ã‚°å®Ÿè£…ã€ã®ã‚µãƒ³ãƒ—ãƒ«ã‚³ãƒ¼ãƒ‰ã§ã™ã€‚", "", 2022-10-15 03:32:08 +0000 UTC
5, gdict, https://github.com/Lodobo/gdict, "An offline CLI dictionary written in go, using data from wiktionary.", "cli,dictionary,go,wiktionary", 2022-10-13 14:31:44 +0000 UTC
5, gone, https://github.com/gone-io/gone, "A dependency injection framework which java spring programmers can quickly get started with.", "dependency-injection,di,gone,gone-io", 2022-10-16 03:27:08 +0000 UTC
5, VencordInstaller, https://github.com/Vendicated/VencordInstaller, "A cross platform gui app for installing Vencord", "", 2022-10-24 13:37:10 +0000 UTC
5, zeroeventhub, https://github.com/vippsas/zeroeventhub, "", "", 2022-10-21 13:31:55 +0000 UTC
5, DevnotAtomic, https://github.com/borakasmer/DevnotAtomic, "Fix Race Condition by Mutex and Atomic.Pointer. And Write Benchmark test.", "", 2022-10-16 13:58:16 +0000 UTC
5, wecome-ipad, https://github.com/aiwzhonghua/wecome-ipad, "ä¼ä¸šå¾®ä¿¡ipadåè®®ï¼Œå¾®ä¿¡ipadåè®®ï¼Œå¾®ä¿¡æœºå™¨äººæ¥å£ï¼ŒæŠ€æœ¯äº¤æµ", "", 2022-10-21 17:33:37 +0000 UTC
5, gosb, https://github.com/wereii/gosb, "Minimal, Read-Only SponsorBlock API Server ", "adblock,adblocker,api,go,golang,server,sponsorblock", 2022-10-24 18:13:10 +0000 UTC
5, slack-exporter, https://github.com/mrmoneyc/slack-exporter, "The tool for exporting Slack conversation histories (with replies) and files written in Go.", "", 2022-10-15 20:48:10 +0000 UTC
5, wb, https://github.com/riza/wb, "ğŸª„ A wizard who goes back and brings old files!", "bugbounty,waybackmachine", 2022-10-26 17:43:43 +0000 UTC
5, cb-advance-go-materials, https://github.com/mattyhall/cb-advance-go-materials, "", "", 2022-10-13 14:32:57 +0000 UTC
5, kubectl-glogs, https://github.com/kitagry/kubectl-glogs, "Cloud logging CLI", "", 2022-10-15 02:57:21 +0000 UTC
5, ZuiOJ, https://github.com/DaZuiZui/ZuiOJ, "åŸºäºSpring Cloudä¸Vueå‰åç«¯ç«¯ç²’å¼€å‘å®ç°çš„ä»£ç è¯„æµ‹é¡¹ç›®OJç³»ç»Ÿ", "", 2022-10-13 17:36:25 +0000 UTC
5, sqlite-jq, https://github.com/mgdm/sqlite-jq, "An extension for SQLite that adds functions for querying JSON data using JQ syntax.", "", 2022-10-16 20:15:57 +0000 UTC
5, kvm, https://github.com/mhkarimi1383/kvm, "kubectl Version Manager", "", 2022-10-25 22:06:21 +0000 UTC
5, parallel, https://github.com/sysean/parallel, "some commonly used go concurrency models", "go,parallel-processing", 2022-10-14 08:33:42 +0000 UTC
5, pprof-breakdown, https://github.com/felixge/pprof-breakdown, "", "", 2022-10-21 06:27:04 +0000 UTC
5, PixivChan, https://github.com/Yiwen-Chan/PixivChan, "More fast to connect Pixiv", "github,pixiv", 2022-10-23 13:29:34 +0000 UTC
5, json-parser-benchmark, https://github.com/smallnest/json-parser-benchmark, "json parser benchmark ", "", 2022-10-22 09:42:06 +0000 UTC
5, zarf-controller, https://github.com/defenseunicorns/zarf-controller, "", "", 2022-10-13 19:46:58 +0000 UTC
5, golang-rest-api, https://github.com/ehsanghaffar/golang-rest-api, "A minimal rest API written with Go programming language.", "", 2022-10-21 02:07:02 +0000 UTC
4, sneeffer, https://github.com/kubescape/sneeffer, "Sneefer is a PoC project showing how to filter out irrelevent vulnerabilities from container image vulnerability scan results. It is based on application monitoring using eBPF and Falco base libraries and writes results in Kubernetes CRDs", "", 2022-10-20 20:09:55 +0000 UTC
4, amazon-cloudwatch-agent-test, https://github.com/aws/amazon-cloudwatch-agent-test, "", "", 2022-10-20 20:28:11 +0000 UTC
4, go-bypass, https://github.com/aqiao-jashell/go-bypass, "goå…æ€é¡¹ç›®", "", 2022-10-17 08:01:35 +0000 UTC
4, go-emoji-func, https://github.com/raymond-design/go-emoji-func, "use emojis in go function declarations (work in progress)", "emoji,go", 2022-10-15 19:43:42 +0000 UTC
4, sico, https://github.com/andygrunwald/sico, "A Sitemap Comparison that helps you to not fuck up your website migration.", "sitemap,sitemap-comparison,website-migration", 2022-10-21 18:21:58 +0000 UTC
4, Atlas, https://github.com/R2Northstar/Atlas, "The next-gen master server for Northstar.", "api,northstar,server,titanfall,titanfall-2", 2022-10-15 19:05:53 +0000 UTC
4, scheduler, https://github.com/maxoov1/scheduler, "A tool for scheduling the execution of a function at a given interval.", "", 2022-10-15 17:25:46 +0000 UTC
4, cui, https://github.com/mfinelli/cui, "http request/response tui", "curl,http-client,terminal,tui", 2022-10-19 21:57:50 +0000 UTC
4, goHTTP, https://github.com/KagamigawaMeguri/goHTTP, "ç”¨äºå†…ç½‘ä¸­å¿«é€Ÿå¼€å¯HTTPæ–‡ä»¶æµè§ˆæœåŠ¡çš„å°å·¥å…·", "", 2022-10-13 09:28:46 +0000 UTC
4, blog, https://github.com/kidlj/blog, "Simple static blog written in Go, packaged in one binary.", "blog,embedded,golang,markdown,static,template", 2022-10-25 07:57:31 +0000 UTC
4, akscreds, https://github.com/johnvanhienen/akscreds, "Get all your AKS creds with a single command", "", 2022-10-14 17:20:13 +0000 UTC
4, prosanity, https://github.com/SmithUnity/prosanity, "", "", 2022-10-26 17:59:33 +0000 UTC
4, discord-mass-DM-GO, https://github.com/Diavonir/discord-mass-DM-GO, "The most powerful Discord selfbot written in GO allowing users to automate their campaigns & send low-cost mass messages to Discord users!", "bot,discord,discord-spam-bot,discord-spammer,dm-tool,dm-tools,mass-dm,token", 2022-10-19 11:12:44 +0000 UTC
4, convoy-paystack, https://github.com/frain-dev/convoy-paystack, "Artifacts for Paystack Webinar on Webhooks.", "", 2022-10-24 00:17:27 +0000 UTC
4, RedisGO, https://github.com/innovationb1ue/RedisGO, "A Go implementation of Redis server", "golang,learning,redis,server", 2022-10-13 13:07:42 +0000 UTC
4, threads, https://github.com/BlackpointCyber/threads, "A helper library for handling groups of threads easily", "", 2022-10-14 16:31:33 +0000 UTC
4, fluent-bit-pgsql-go, https://github.com/mattn/fluent-bit-pgsql-go, "", "", 2022-10-13 06:15:19 +0000 UTC
4, GraduationProject-HTTP, https://github.com/Wh0rigin/GraduationProject-HTTP, "ä¸€ä¸ªä¸“ç§‘å¤§äºŒç”Ÿçš„æ¯•è®¾ï¼ŒGoæœåŠ¡å™¨ç«¯é¡¹ç›®", "", 2022-10-14 05:29:40 +0000 UTC
4, arbiter-plugins, https://github.com/kube-arbiter/arbiter-plugins, "Various plugins for Arbiter", "", 2022-10-15 03:17:29 +0000 UTC
