292, docuowl, https://github.com/docuowl/docuowl, "🦉 A documentation generator", "documentation,documentation-generator,documentation-site,documentation-template,documentation-website", 2021-03-27 16:35:47 +0000 UTC
253, netmaker, https://github.com/gravitl/netmaker, "Netmaker makes networks. Netmaker makes networking easy, fast, and secure across all environments.", "", 2021-03-25 15:33:08 +0000 UTC
177, spaghetti, https://github.com/adonovan/spaghetti, "Spaghetti: a dependency analysis tool for Go packages", "", 2021-03-30 16:34:34 +0000 UTC
172, cve-2021-3449, https://github.com/terorie/cve-2021-3449, "CVE-2021-3449 OpenSSL denial-of-service exploit 👨🏻\u200d💻", "cve-2021-3449,denial-of-service,exploit,openssl,tls", 2021-03-26 01:09:25 +0000 UTC
107, teller, https://github.com/SpectralOps/teller, "A secrets management tool for developers built in Go - never leave your command line for secrets.", "aws,gce,go,golang,hashicorp,heroku,secret-management,secrets,vault", 2021-03-24 10:49:44 +0000 UTC
68, fdlr, https://github.com/Imputes/fdlr, "A command line tool for file downloads", "concurrency,concurrent-programming,downloader,file,go,golang,golang-application,http,http-client,https,https-client,parallel-computing,resume", 2021-04-01 07:50:32 +0000 UTC
66, dsf, https://github.com/nanmu42/dsf, "DSF - Dead Simple Fileserver / 极简HTTP文件服务", "", 2021-03-29 10:35:54 +0000 UTC
65, tssh, https://github.com/luanruisong/tssh, "SSH Lightweight management tools", "", 2021-03-29 11:38:21 +0000 UTC
44, TXPortMap, https://github.com/4dogs-cn/TXPortMap, "Port Scanner & Banner Identify From TianXiang", "", 2021-03-29 02:43:30 +0000 UTC
39, cliProxy, https://github.com/djhohnstein/cliProxy, "Proxy Unix applications in the terminal", "", 2021-03-28 17:46:12 +0000 UTC
39, dns-exfil, https://github.com/62726164/dns-exfil, "A program to exfiltrate files from a computer using the DNS", "", 2021-03-31 21:21:08 +0000 UTC
38, OneDriveUploader, https://github.com/gaowanliang/OneDriveUploader, "A lightweight, universal OneDrive upload tool for all platforms", "downloadbot,onedrive,telegram,upload", 2021-03-26 14:14:47 +0000 UTC
34, hakcron, https://github.com/hakluke/hakcron, "Easily schedule commands to run multiple times at set intervals (like a cronjob, but with one command)", "", 2021-04-05 10:09:29 +0000 UTC
33, perfessor, https://github.com/conprof/perfessor, "Continuous profiling with perf", "", 2021-03-28 13:56:35 +0000 UTC
32, fast, https://github.com/adhocore/fast, "Check your internet speed right from your terminal. Built on GOlang using chromedp", "chrome-headless,chromedp,fast,go,golang,internet-speed,internet-speed-checker", 2021-04-03 10:46:17 +0000 UTC
31, gitaligned, https://github.com/soypat/gitaligned, "Find out where you fall on the Open-Source Character Alignment Chart", "alignment-chart,git,open-source-community", 2021-04-03 15:10:30 +0000 UTC
31, slicegraph, https://github.com/jbszczepaniak/slicegraph, "Slice graph uses graphviz in order to pretty print slices for you.", "", 2021-03-26 06:45:07 +0000 UTC
30, caddy-ratelimit, https://github.com/mholt/caddy-ratelimit, "HTTP rate limiting module for Caddy 2", "caddy,caddy-module,rate-limiting", 2021-03-30 00:02:13 +0000 UTC
26, vatcalculator, https://github.com/Mahmud139/vatcalculator, "", "", 2021-04-02 18:10:25 +0000 UTC
26, gosane, https://github.com/sno6/gosane, "A sane and simple Go REST API template.", "api,backend,golang,production,template", 2021-04-04 06:48:36 +0000 UTC
26, enter, https://github.com/a8m/enter, "A CLI for generating ER diagrams for Ent schema", "", 2021-04-01 14:11:35 +0000 UTC
25, kpng, https://github.com/kubernetes-sigs/kpng, "Reworking kube-proxy's architecture", "k8s-sig-network", 2021-03-24 15:58:36 +0000 UTC
21, Doge-sRDI, https://github.com/timwhitez/Doge-sRDI, "Shellcode implementation of Reflective DLL Injection by Golang. Convert DLLs to position independent shellcode", "", 2021-03-30 01:24:35 +0000 UTC
21, wappalyzergo, https://github.com/projectdiscovery/wappalyzergo, "A high performance go implementation of Wappalyzer Technology Detection Library", "", 2021-04-06 09:54:00 +0000 UTC
19, uri, https://github.com/lucasepe/uri, "A commandline tool to resolve URI Templates expressions as specified in RFC 6570.", "commandline-tool,cross-platform,golang,uri-templates", 2021-03-26 11:28:29 +0000 UTC
18, alternativeto, https://github.com/brentadamson/alternativeto, "A comprehensive list of alternatives to your favorite software", "alternative,alternativeto,software", 2021-03-29 00:41:39 +0000 UTC
18, go-rest-api-clean-architecture, https://github.com/suadev/go-rest-api-clean-architecture, "Go Rest API Clean Architecture.", "clean-architecture,go,golang,rest,rest-api", 2021-04-03 22:00:04 +0000 UTC
17, log, https://github.com/go-kit/log, "A minimal and extensible structured logger", "", 2021-04-03 03:37:55 +0000 UTC
16, mtorrent, https://github.com/nektro/mtorrent, "A totally configurable terminal torrent client.", "", 2021-04-04 02:05:16 +0000 UTC
16, fpdns, https://github.com/QLeelulu/fpdns, "Fast Private DNS，提供自定义的DNS记录配置和DNS解析缓存。", "", 2021-04-03 08:46:45 +0000 UTC
16, imperson8, https://github.com/willbtlr/imperson8, "A CLI tool for leveraging IDP signing keys to impersonate users and groups ", "", 2021-04-01 03:15:20 +0000 UTC
15, hayabusa, https://github.com/hayabusa-cloud/hayabusa, "A game server side framework with both web API and real-time communication.", "game,realtime,server,socket", 2021-03-29 18:13:34 +0000 UTC
14, HuanZhen, https://github.com/leavky/HuanZhen, "", "", 2021-03-31 02:05:33 +0000 UTC
14, devchat, https://github.com/quackduck/devchat, "Chat over SSH", "", 2021-04-04 10:30:21 +0000 UTC
13, novavim, https://github.com/solidiquis/novavim, "Vim made in Go that you shouldn't use.", "go,golang,neovim,terminal,vi,vim", 2021-03-28 23:21:38 +0000 UTC
13, tmux-wormhole, https://github.com/gcla/tmux-wormhole, "tmux-wormhole - download files and directories with tmux!", "", 2021-04-04 23:50:57 +0000 UTC
12, skywalking-banyandb, https://github.com/apache/skywalking-banyandb, "Apache SkyWalking APM Database", "", 2021-03-26 02:26:42 +0000 UTC
12, glink, https://github.com/Baiyuetribe/glink, "Short video direct link acquisition 短视频直连获取工具", "go,golang,watermarking", 2021-03-30 02:22:50 +0000 UTC
12, adguardhome-sync, https://github.com/bakito/adguardhome-sync, "🛡️ Synchronize AdGuard Home config to replicas", "adguardhome,replication,sync", 2021-03-27 22:32:10 +0000 UTC
12, kcores-link, https://github.com/KCORES/kcores-link, "Client for KCORES CSPS to ATX Converter ", "", 2021-03-29 09:50:53 +0000 UTC
11, crack-slide-captcha, https://github.com/omigo/crack-slide-captcha, "使用 Golang+Chrome+OpenCV 破解腾讯滑块验证码", "", 2021-03-26 07:08:11 +0000 UTC
11, autoarr, https://github.com/mrcruz/autoarr, "", "", 2021-03-29 07:36:02 +0000 UTC
11, resolve, https://github.com/caffix/resolve, "Designed to support DNS brute-forcing with a minimal number of network connections", "brute-force,dns,golang-package,high-performance,nsec-walking,zone-transfers", 2021-03-24 00:18:59 +0000 UTC
10, TubeCheck, https://github.com/sjlleo/TubeCheck, "一个用于检测/诊断Youtube地域信息的脚本", "", 2021-03-28 09:25:07 +0000 UTC
9, spotinfo, https://github.com/alexei-led/spotinfo, "CLI for AWS Spot Advisor: inspect AWS Spot instance types, saving and interruption frequency", "aws,aws-spot,aws-spot-cli,ec2-spot,spot-advisor,spot-instances", 2021-03-31 09:35:20 +0000 UTC
9, go-nyaa, https://github.com/irevenko/go-nyaa, "🐈📦 nyaa.si client library for Go. Fetch Anime, Manga, Music and more torrents", "", 2021-03-31 12:03:12 +0000 UTC
8, revinest, https://github.com/MycoinTool/revinest, "", "", 2021-03-28 04:54:11 +0000 UTC
8, fluentassert, https://github.com/pellared/fluentassert, "Extensible fluent API for assertions.", "golang,testing", 2021-03-28 08:56:56 +0000 UTC
8, goalive, https://github.com/Stef2k16/goalive, "A simple tool to monitor health endpoints of your services", "", 2021-03-31 09:54:44 +0000 UTC
8, lightning-go, https://github.com/zhengyansheng/lightning-go, "以 `Go` 语言为主，采用 斗鱼 微服务框架Jupiter 实现后端 API 模块开发", "", 2021-03-30 12:21:27 +0000 UTC
8, speedtest-exporter, https://github.com/caarlos0/speedtest-exporter, "Exports speedtest-cli metrics in the prometheus format", "", 2021-04-05 21:56:36 +0000 UTC
7, envoy-viz, https://github.com/twosigma/envoy-viz, "", "", 2021-03-29 16:12:11 +0000 UTC
7, gurl, https://github.com/smf8/gurl, "A simple http client written in go (actually an academic curl rip off)", "", 2021-03-27 09:35:23 +0000 UTC
7, siber-server, https://github.com/Laiye-Tech/siber-server, "", "", 2021-03-31 11:49:08 +0000 UTC
7, talk-12ja3, https://github.com/alexrios/talk-12ja3, "Talk sobre sincronização e orquestração de código concorrente em Go", "", 2021-04-05 12:02:21 +0000 UTC
7, nipo, https://github.com/NipoDB/nipo, "Nipo server", "", 2021-03-31 10:59:05 +0000 UTC
7, vindr-lab-id-generator, https://github.com/vinbigdata-medical/vindr-lab-id-generator, "A part of the VinDr Lab project. For each study or task of a project, this service generates a new integer value which based on the key as string. ", "", 2021-03-26 04:35:56 +0000 UTC
6, hydra, https://github.com/Shravan-1908/hydra, "A command line utility for generating language-specific project structure.", "cli,command-line-tool,go,golang,project-structure", 2021-03-24 11:08:12 +0000 UTC
6, cosigned, https://github.com/dlorenc/cosigned, "", "", 2021-04-04 23:53:20 +0000 UTC
6, hybs-server, https://github.com/hayabusa-cloud/hybs-server, "Web API/リアルタイム通信を統合したゲームサーバサイドアーキテクチャです。", "game,realtime,server", 2021-03-29 19:11:11 +0000 UTC
6, snowball, https://github.com/rootklt/snowball, "fofa+xray vul scan golang", "", 2021-03-29 14:23:41 +0000 UTC
6, cloudbuild-optimizer, https://github.com/viglesiasce/cloudbuild-optimizer, "Run builds across all machine types in Cloud Build to find the optimal price/performance tradeoff", "", 2021-03-31 19:04:42 +0000 UTC
6, vindr-lab-api, https://github.com/vinbigdata-medical/vindr-lab-api, "A part of the VinDr Lab project. Which performs as the middleware layer between user interface and backend systems.", "", 2021-03-26 04:35:44 +0000 UTC
6, go-curl, https://github.com/saman2000hoseini/go-curl, "simple url client written in golang", "", 2021-03-29 10:45:39 +0000 UTC
6, idgenerator-go, https://github.com/yitter/idgenerator-go, "idgenerator 的 Go 专项引用库。", "golang,idgenerator,snowflake", 2021-03-29 03:18:22 +0000 UTC
6, go-mysql, https://github.com/atercattus/go-mysql, "A pure go library to handle MySQL network protocol and replication", "", 2021-03-28 18:21:17 +0000 UTC
5, pancors, https://github.com/michaljanocko/pancors, "📡 Fast CORS-anywhere proxy", "cors-anywhere,cors-proxy,golang", 2021-03-31 22:26:56 +0000 UTC
5, kubesecret, https://github.com/charmitro/kubesecret, "Kubesecret is a command-line tool that prints secrets and configmaps data of a kubernetes cluster.", "kubernetes,kubernetes-configmaps,kubernetes-secrets", 2021-04-05 22:38:33 +0000 UTC
5, recap, https://github.com/1cbf94bc-bc47-42b9-9197-244437fad1e6/recap, "RECAP is a tool that generates JARM hashes for all known Tor relays", "", 2021-03-29 20:53:26 +0000 UTC
5, netmap, https://github.com/caffix/netmap, "Graphing package for mapping and visualizing the Internet", "", 2021-03-30 03:36:39 +0000 UTC
5, skywalking-kubernetes-event-exporter, https://github.com/apache/skywalking-kubernetes-event-exporter, "Export Kubernetes events to Apache SkyWalking OAP.", "kubernetes,skywalking", 2021-03-27 02:57:44 +0000 UTC
5, ascheck, https://github.com/harryzcy/ascheck, "A command-line app that bulk-checks your apps for the Apple Silicon support", "apple-silicon-support,applesilicon,cli,golang,macos", 2021-03-27 18:07:54 +0000 UTC
5, gomelody, https://github.com/gomelody-bot/gomelody, "", "", 2021-03-27 22:43:35 +0000 UTC
5, raspberry-pi-camera-ascii, https://github.com/ranon-rat/raspberry-pi-camera-ascii, "", "", 2021-03-31 20:27:32 +0000 UTC
5, Doge-Persist, https://github.com/timwhitez/Doge-Persist, "Windows Persistence Collection", "", 2021-03-26 03:38:30 +0000 UTC
5, macbridge, https://github.com/progrium/macbridge, "", "", 2021-03-30 22:22:25 +0000 UTC
5, tcp-tunnel-reverse-proxy, https://github.com/moonrhythm/tcp-tunnel-reverse-proxy, "TCP Reverse Proxy that register service via tunnel", "", 2021-03-29 06:47:48 +0000 UTC
5, toolkit.net.cn.github.turbo, https://github.com/rd-zhaoxin/toolkit.net.cn.github.turbo, "github加速", "", 2021-04-01 06:12:00 +0000 UTC
4, singleopen, https://github.com/dwlnetnl/singleopen, "A fs.FS that reuses file handles across file opens.", "", 2021-03-25 21:43:23 +0000 UTC
4, 2-codependent-api-working-in-docker-env-project, https://github.com/nishant-aka-nik/2-codependent-api-working-in-docker-env-project, "2 co-dependent web scrapping API based on Colly Framework working mutually using MongoDB as a database  in Docker environment implemented using Docker Compose ", "", 2021-03-29 04:11:52 +0000 UTC
4, gf-casbin, https://github.com/dobyte/gf-casbin, "GoFrame Permission Plugin", "abac,acl,gdb-casbin,gf-casbin,go-libary,gogf,rbac", 2021-04-02 08:10:09 +0000 UTC
4, xcclear, https://github.com/lajosdeme/xcclear, "Simple and easy to use command line application written in Go for cleaning unnecessary XCode files.", "", 2021-03-30 14:06:12 +0000 UTC
4, footlocker-monitor, https://github.com/skateboard/footlocker-monitor, "a Footlocker product monitor", "", 2021-04-04 06:57:02 +0000 UTC
4, TrustFi-BSC, https://github.com/TrustFiNetwork/TrustFi-BSC, "Yet another Binance Smart Chain client based on TrustFi Network", "", 2021-03-27 18:29:30 +0000 UTC
4, ONPChain, https://github.com/oracleNetworkProtocol/ONPChain, "", "", 2021-03-26 03:44:25 +0000 UTC
4, ImageServer, https://github.com/jinyu121/ImageServer, "A simple image server", "", 2021-04-05 15:55:45 +0000 UTC
4, GoCentral, https://github.com/ihatecompvir/GoCentral, "Rock Band 3 server re-implementation in Golang", "", 2021-04-01 03:18:16 +0000 UTC
4, gomphotherium, https://github.com/mrusme/gomphotherium, "Gomphotherium (/ˌɡɒmfəˈθɪəriəm/; \"welded beast\"), a command line Mastodon  client.", "activitypub,cli,cobra,command-line,command-line-tool,commandline,mastodon,mastodon-api,mastodon-app,mastodon-client,rice,tcell,text-user-interface,tui,tview", 2021-04-04 05:11:19 +0000 UTC
4, jsonmerge, https://github.com/lens-vm/jsonmerge, "A TinyGo supported implementation of the JSON Merge spec based on json-patch & fastjson.", "json,json-merge-patch,tinygo,wasm", 2021-03-28 12:49:50 +0000 UTC
4, cir, https://github.com/michal-franc/cir, "Can I Reach - cloud network diagnostic tool", "", 2021-03-29 17:22:36 +0000 UTC
4, sherlock, https://github.com/Schmenn/sherlock, "searches social media sites for usernames", "", 2021-04-04 20:43:04 +0000 UTC
4, retag, https://github.com/ariarijp/retag, "", "", 2021-03-31 13:12:35 +0000 UTC
4, vsphere-alarm-server, https://github.com/embano1/vsphere-alarm-server, "Kubernetes application which enriches vSphere Alarm Events with AlarmInfo details", "", 2021-03-25 13:27:17 +0000 UTC
4, mad, https://github.com/txthinking/mad, "Generate root CA and derivative certificate for any domains and any IPs. 为任何域名和IP生成证书", "", 2021-03-25 11:34:48 +0000 UTC
4, geekday, https://github.com/yakuter/geekday, "", "", 2021-04-04 13:14:13 +0000 UTC
4, eth-faucet, https://github.com/chainflag/eth-faucet, "a testnet ether faucet server implemente in Go", "faucet", 2021-03-27 14:39:04 +0000 UTC
4, go-mod-tidy-broken, https://github.com/tailscale/go-mod-tidy-broken, "demo showing a go mod tidy bug", "", 2021-03-24 22:40:22 +0000 UTC
4, ebiten-macos-menu, https://github.com/ishmulyan/ebiten-macos-menu, "An example of using macOS menu alongside ebiten", "ebiten,game-development,go,golang,macos", 2021-03-29 14:36:13 +0000 UTC
4, hello-go-cdk, https://github.com/eladb/hello-go-cdk, "Hello, CDK for Go", "", 2021-03-25 13:18:46 +0000 UTC
4, scago, https://github.com/myriolang/scago, "Go-based sound change applier for diachronic linguistics and conlanging", "", 2021-03-28 21:00:05 +0000 UTC
