1958, MangoDB, https://github.com/MangoDB-io/MangoDB, "A truly Open Source MongoDB alternative", "golang,mongo,mongo-db,mongodb,mongodb-database", 2021-10-30 08:06:36 +0000 UTC
217, cookiemonster, https://github.com/iangcarroll/cookiemonster, "🍪 CookieMonster helps you detect and abuse vulnerable implementations of stateless sessions.", "", 2021-11-02 06:11:34 +0000 UTC
116, embedded-struct-visualizer, https://github.com/davidschlachter/embedded-struct-visualizer, "Tool to visualize the graph of embedded structs in Go projects", "", 2021-10-30 00:24:15 +0000 UTC
99, depp, https://github.com/CryogenicPlanet/depp, "⚡ Check your npm modules for unused and duplicate dependencies fast", "dependency,duplicate-detection,modules,monorepo,npm,unused", 2021-11-01 23:56:56 +0000 UTC
97, zipcreater, https://github.com/Rvn0xsy/zipcreater, "ZipCreater主要应用于跨目录的文件上传漏洞的利用，它能够快速进行压缩包生成。", "", 2021-11-01 09:59:58 +0000 UTC
94, ugo-compiler-book, https://github.com/chai2010/ugo-compiler-book, ":books: 从头开发一个迷你Go语言编译器(开发中)", "assembly,compiler,golang,llvm,wasm", 2021-11-03 15:50:30 +0000 UTC
66, pi_pi_net, https://github.com/pi-pi-miao/pi_pi_net, "linux下使用epoll的网络库", "", 2021-11-04 09:55:20 +0000 UTC
59, gh-grep, https://github.com/k1LoW/gh-grep, ":octocat: Print lines matching a pattern in repositories using GitHub API", "gh-extension", 2021-10-30 16:35:25 +0000 UTC
53, scaninfo, https://github.com/redtoolskobe/scaninfo, "", "", 2021-11-05 04:59:07 +0000 UTC
42, cnosdb, https://github.com/cnosdatabase/cnosdb, "A high performance, high compression ratio, high usability open-source time-series database.", "database,golang,time-series", 2021-10-25 09:47:14 +0000 UTC
34, cloudkey, https://github.com/aidansteele/cloudkey, "No need for IAM users when we have Yubikeys", "", 2021-10-27 06:26:55 +0000 UTC
32, ChizBroker, https://github.com/sinamna/ChizBroker, "grpc based message broker in go", "broker,docker,golang,grpc,kubernetes,postgresql", 2021-10-29 06:06:30 +0000 UTC
31, dl, https://github.com/thedevsaddam/dl, "Command-line file downloader tool", "download-manager,downloader,downloadmanager,file-downloader", 2021-10-29 16:07:56 +0000 UTC
25, mdconv, https://github.com/kevwan/mdconv, "A tool to convert markdown to html.", "converter,html,markdown", 2021-11-01 09:23:15 +0000 UTC
24, longurl, https://github.com/long2ice/longurl, "A self-hosted short url service", "entgo,fiber,go,short-url,url-shortener", 2021-10-30 02:24:18 +0000 UTC
23, crawley, https://github.com/s0rg/crawley, "The unix-way web crawler", "cli,crawler,data-mining,golang,golang-application,osint,pentest-tool,unix-way,web-crawler,web-scraping,web-spider", 2021-10-27 18:48:51 +0000 UTC
22, goweb, https://github.com/vincentbin/goweb, "A gin-like simple golang web framework.", "golang,http,webframework", 2021-10-27 02:50:54 +0000 UTC
22, tfa, https://github.com/TheYkk/tfa, "tfa is a 2fa cli tool that aims to help you to generate 2fa code on CI/CD pipelines.", "2fa,cli,golang,pipeline,tool", 2021-10-26 16:51:15 +0000 UTC
18, errchkjson, https://github.com/breml/errchkjson, "Go linter that checks types that are json encoded - reports unsupported types and unnecessary error checks", "go,json,linter", 2021-11-06 07:54:07 +0000 UTC
18, xhttp, https://github.com/jweny/xhttp, "应用于扫描器场景下的http基础库。", "basepackage,http,httpclient,scanner", 2021-11-06 08:13:33 +0000 UTC
17, endlessh-go, https://github.com/shizunge/endlessh-go, "A golang implementation of endlessh exporting Prometheus metrics, visualized by a Grafana dashboard.", "", 2021-10-27 02:46:13 +0000 UTC
17, acmd, https://github.com/cristalhq/acmd, "Simple, useful and opinionated CLI package in Go.", "cli,command-line,go,golang", 2021-10-27 15:13:31 +0000 UTC
16, ocistow, https://github.com/martinbaillie/ocistow, "Stream, Mutate and Sign Images with AWS Lambda and ECR", "aws,aws-lambda,cosign,docker,ecr,oci,sigstore,slsa,supplychain", 2021-10-28 11:26:32 +0000 UTC
15, discord-mass-DM-GO, https://github.com/V4NSH4J/discord-mass-DM-GO, "A tool written in GO to demonstrate how bad actors utilize requests to spam Discord Users and launch large unsolicited DM Advertisement Campaigns", "discord,discord-massdm,discord-spam,discord-spam-bot,discord-spam-bots,discord-spammer,discordapp,discordbot,golang", 2021-11-01 13:01:02 +0000 UTC
15, golang-pos, https://github.com/restuwahyu13/golang-pos, "Example golang point of sale.", "gin,golang,pos,restful-api", 2021-10-26 17:38:17 +0000 UTC
14, gSigFlip, https://github.com/akkuman/gSigFlip, "A SigFlip implement in golang", "", 2021-11-04 03:27:46 +0000 UTC
14, rsyncprom, https://github.com/stapelberg/rsyncprom, "rsync wrapper (or output parser) that pushes metrics to prometheus", "", 2021-10-30 09:21:34 +0000 UTC
14, vals-operator, https://github.com/digitalis-io/vals-operator, "Kubernetes Operator to sync secrets between different secret backends and Kubernetes", "devops,devsecops,kubernetes,kubernetes-operator,secrets,secrets-management,security,vals", 2021-11-01 18:37:13 +0000 UTC
14, neartalk, https://github.com/makeworld-the-better-one/neartalk, "NearTalk is chat platform to talk to people nearby.", "", 2021-10-31 18:31:49 +0000 UTC
14, go-alive, https://github.com/TibebeJS/go-alive, "Robust services healthiness probing written in Go. (with notification support of slack, telegram, email and more)", "cli,ethiopia,go,golang,hacktoberfest,hacktoberfest-accepted,hacktoberfest2021,health-check,healthcheck,liveness,liveness-probe,livenessprobe", 2021-10-26 08:06:28 +0000 UTC
13, cloudprober, https://github.com/cloudprober/cloudprober, "An active monitoring software to detect failures before your customers do.", "blackbox,cloud,cloud-monitoring,cloudwatch,datadog,devops,gcp,golang,google,grafana,k8s,kubernetes,monitoring,observability,prober,prometheus,sre,stackdriver", 2021-10-28 18:41:39 +0000 UTC
12, tsk, https://github.com/adamgoose/tsk, "Quickly connect to your Kubernetes Cluster with Tailscale", "kubernetes,pulumi,tailscale,wireguard", 2021-10-30 07:41:27 +0000 UTC
12, fiable, https://github.com/gofiable/fiable, "lightweight and reliable backend framework for Go HTTP services with 0 dependencies", "", 2021-10-29 15:44:31 +0000 UTC
12, goapi-gen, https://github.com/discord-gophers/goapi-gen, "This package contains a set of utilities for generating Go boilerplate code for services based on OpenAPI 3.0 API definitions", "go,hacktoberfest,openapi,swagger", 2021-10-25 16:46:18 +0000 UTC
11, distMergeSort, https://github.com/el10savio/distMergeSort, "Distributed merge sort for large sets across nodes in a network", "", 2021-10-26 12:13:22 +0000 UTC
11, bidichk, https://github.com/breml/bidichk, "Go linter which checks for dangerous unicode character sequences", "go,linter,security,unicode-characters", 2021-11-01 21:01:38 +0000 UTC
11, bashcord, https://github.com/deletescape/bashcord, "discord rich status for bash", "", 2021-11-06 18:50:03 +0000 UTC
10, zmemif, https://github.com/zartbot/zmemif, "golang based memory interface implementation", "", 2021-10-30 12:50:00 +0000 UTC
10, idnt, https://github.com/r-darwish/idnt, "Remove unwanted applications", "", 2021-10-30 18:24:41 +0000 UTC
10, dropspy, https://github.com/superfly/dropspy, "Go implementation of the venerable dropwatch utility", "", 2021-10-29 01:03:28 +0000 UTC
10, corona-decoder, https://github.com/denysvitali/corona-decoder, "A COVID-19 Certificate Decoder based on @stapelberg's coronaqr library / CLI", "", 2021-10-27 23:32:07 +0000 UTC
9, vuln, https://github.com/golang/vuln, "[mirror] the database client and tools for the Go vulnerability database", "", 2021-11-02 15:53:16 +0000 UTC
9, go-lsp, https://github.com/TobiasYin/go-lsp, "language server protocol sdk implement for go", "", 2021-11-01 13:49:20 +0000 UTC
9, afscan, https://github.com/AuFeng111/afscan, "go写的afscan，主要方便在webshell入口下的快速ssh、smb的弱口令探测。", "", 2021-10-31 14:08:46 +0000 UTC
9, eth-event-tracker, https://github.com/umbracle/eth-event-tracker, "Ethereum event tracker", "ethereum,ethereum-etl,events,tracker", 2021-11-02 07:51:28 +0000 UTC
9, dashboard-linter, https://github.com/grafana/dashboard-linter, "A tool to lint Grafana dashboards", "", 2021-11-04 13:49:06 +0000 UTC
8, qssh, https://github.com/ad-on-is/qssh, "A simple wrapper for ssh to select profiles.", "", 2021-10-26 17:56:12 +0000 UTC
8, container-layer-sizes, https://github.com/dcermak/container-layer-sizes, "Visualizer of container layer sizes", "", 2021-11-05 16:47:42 +0000 UTC
8, ng-monitoring, https://github.com/pingcap/ng-monitoring, "", "", 2021-10-29 05:47:41 +0000 UTC
7, inlets-on-fly, https://github.com/jsiebens/inlets-on-fly, "Create inlets servers on fly.io", "inlets,inlets-pro", 2021-11-04 12:41:08 +0000 UTC
7, configo, https://github.com/UltiRequiem/configo, "⚙️ Dead Simple Config Management, load and persist config without having to think about where and how.", "configuration,go,golang,persistent-storage", 2021-10-25 15:26:51 +0000 UTC
7, ListenRain, https://github.com/threadfly/ListenRain, "Go network programming framework, supports multiplexing, synchronous and asynchronous IO mode, modular design, and provides flexible custom interfaces。The key is the transport layer, application layer protocol has nothing to do", "event-driven,event-loop,go,network,non-blocking,protocol-independent,reactor", 2021-11-01 07:03:26 +0000 UTC
7, goli, https://github.com/arthurvdiniz/goli, "A CLI tool for running Go commands with colorized output", "cli,command-line,go,golang,terminal,tui", 2021-10-31 15:48:29 +0000 UTC
7, ass-load, https://github.com/ellenkorbes/ass-load, "", "", 2021-11-03 01:38:33 +0000 UTC
7, go-hubspot, https://github.com/clarkmcc/go-hubspot, "A fully-featured OpenAPI generated HubSpot client for Go", "api,go,hubspot,sdk", 2021-11-02 22:36:41 +0000 UTC
6, morse, https://github.com/esin/morse, "Morse code API with AWS Lambda", "", 2021-11-01 21:00:56 +0000 UTC
6, wxcwwz, https://github.com/iiiuwioajdks/wxcwwz, "西电微信晨午晚检", "", 2021-10-28 08:10:35 +0000 UTC
6, wcut, https://github.com/koron/wcut, "width cut command", "", 2021-11-05 07:16:55 +0000 UTC
6, nft-sale-proxy, https://github.com/alephao/nft-sale-proxy, "A proxy to hide NFT metadata during the sale and prevent people from sniping specific NFTs.", "nft,nft-sale,proxy,security", 2021-11-04 15:32:07 +0000 UTC
5, vk-message-counter, https://github.com/pavel-trbv/vk-message-counter, "", "golang,vk", 2021-10-27 20:56:49 +0000 UTC
5, awsd, https://github.com/pjaudiomv/awsd, "AWS Profile Switcher in Go", "", 2021-10-28 19:40:20 +0000 UTC
5, zenvia-go-sdk, https://github.com/booscaaa/zenvia-go-sdk, "SDK to provide access to Zenvia API (2.0)", "bot,message,sms,zenvia", 2021-11-05 18:00:46 +0000 UTC
5, micro-go, https://github.com/micro/micro-go, "", "", 2021-10-28 18:27:44 +0000 UTC
5, go-genial, https://github.com/Karitham/go-genial, "A golang code-generator helper.", "codegen,golang", 2021-11-02 21:40:14 +0000 UTC
5, nats-kv-leader-elect, https://github.com/ripienaar/nats-kv-leader-elect, "NATS Key-Value Store based Leader Election", "", 2021-10-26 09:48:12 +0000 UTC
5, expiringlink, https://github.com/williammoran/expiringlink, "A Go library to create hashes with a builtin expiration", "", 2021-10-29 17:28:38 +0000 UTC
5, go_ssh, https://github.com/xhatt/go_ssh, "go语言开发的，能够快速使用命令行连接服务器的工具。也可管理ssh配置，支持服务器分组。", "", 2021-11-01 05:56:43 +0000 UTC
5, ks-releaser, https://github.com/kubesphere-sigs/ks-releaser, "This project aims to help to release a project which especially has multiple git repositories.", "kubernetes,releaser", 2021-10-26 02:03:49 +0000 UTC
5, Clematis, https://github.com/TorchedSammy/Clematis, "Discord rich presence for MPRIS music players.", "discord-rich-presence,mpris,rich-presence", 2021-10-26 19:07:55 +0000 UTC
5, ribbit-backend, https://github.com/alpacahq/ribbit-backend, "Backend for Ribbit, Broker API Reference App ", "", 2021-10-28 16:25:36 +0000 UTC
5, Siga-Professor, https://github.com/DantasB/Siga-Professor, "A Hepful API that helps the students to find a chair in the Federal University of Rio de Janeiro according the professor name", "", 2021-11-02 14:30:07 +0000 UTC
5, Password-Manager-GO, https://github.com/good-times-ahead/Password-Manager-GO, "Simple password manager app in GO", "", 2021-10-27 06:23:05 +0000 UTC
5, Atlassium, https://github.com/MarkusChu/Atlassium, "", "", 2021-10-27 21:29:51 +0000 UTC
5, FAST-discord-token-checker, https://github.com/V4NSH4J/FAST-discord-token-checker, "✨ Fastest Feature-packed Discord Token Checker written in GO ✨", "discord,discord-api,discord-bot,discord-selfbot,discordtokenchecker,discordtokens,tokens", 2021-10-30 17:36:40 +0000 UTC
5, jx, https://github.com/go-faster/jx, "json encoding and decoding", "decoder,decoding,encoder,encoding,faster,go,golang,golang-library,iteration,json,rfc4627,rfc7159,streaming", 2021-10-29 22:07:06 +0000 UTC
5, dns, https://github.com/mobocrat/dns, "Bare-minimum DNS Query", "", 2021-11-05 19:23:06 +0000 UTC
5, go-tools, https://github.com/qingolang/go-tools, "Go tools", "golang,mysql-table-to-markdown,tools", 2021-10-28 07:20:43 +0000 UTC
5, gojwt, https://github.com/tobyguelly/gojwt, "A simple and lightweight library for creating, formatting, manipulating, signing, and validating JSON Web Tokens in Go.", "go,golang,json,jwt,token", 2021-11-01 19:39:04 +0000 UTC
5, go_leakfinder, https://github.com/branoodle/go_leakfinder, "GoLang script that checks for password leaks by sending email address to the BreachDirectory API", "", 2021-11-03 17:40:49 +0000 UTC
5, wg-pod, https://github.com/b-m-f/wg-pod, "Mount your podman container into WireGuard networks on spawn", "", 2021-11-05 18:20:03 +0000 UTC
4, gotwtxt, https://github.com/wheresalice/gotwtxt, "A Go implementation of twtxt - decentralised, minimalist microblogging service for hackers", "", 2021-10-31 15:09:55 +0000 UTC
4, go-build-hijacking, https://github.com/0x2E/go-build-hijacking, "Insert payload through the program set by -toolexec. It's just a toy now.", "", 2021-11-02 09:34:08 +0000 UTC
4, grpcmock, https://github.com/nhatthm/grpcmock, "gRPC Test Utilities for Golang", "go,golang,grpc,mock,test", 2021-10-28 21:52:51 +0000 UTC
4, crypto-discord-bot, https://github.com/asiantbd/crypto-discord-bot, "Easy way to power your crypto discord server!", "bot,discord,discord-bot,go,golang", 2021-10-28 17:32:41 +0000 UTC
4, go-cbook, https://github.com/vorishirne/go-cbook, "A vitamin C rich, book, pdf & documentation brewing library for e-readers/e-ink readers. Now take privileges of (eye-safe) e-readers to read the documentations and blogs in an e-reader optimized book.", "", 2021-10-29 17:47:31 +0000 UTC
4, wg-ovpn, https://github.com/ptrcnull/wg-ovpn, "Magic util that \"bridges\" Wireguard with OpenVPN without a TUN/TAP interface", "", 2021-11-04 20:32:13 +0000 UTC
4, oddments, https://github.com/Ne0nd0g/oddments, "", "", 2021-10-31 22:09:06 +0000 UTC
4, Functional-Virtual-OS, https://github.com/Sachwin-Kohli/Functional-Virtual-OS, "A functional virtual OS with a digital calculator, text editor, weather app, image viewer and a home button to turn it off", "", 2021-10-30 10:58:48 +0000 UTC
4, ng-template-parser, https://github.com/irustm/ng-template-parser, "", "", 2021-10-31 20:51:58 +0000 UTC
4, GopherConUK2021, https://github.com/banked/GopherConUK2021, "Code Demos / Examples for our GopherConUK 2021 talk on Open Telemetry.", "", 2021-10-25 12:14:43 +0000 UTC
4, go-daemon, https://github.com/qingolang/go-daemon, "Go daemon", "daemon,golang", 2021-10-26 13:45:49 +0000 UTC
4, github-actions-merger, https://github.com/abema/github-actions-merger, "Github actions that merge pull requests with custome ways", "", 2021-10-27 07:46:50 +0000 UTC
4, bluephish, https://github.com/bluestoneag/bluephish, "Open-Source Phishing Toolkit directly forked of the GoPhish Version 0.11.0", "", 2021-10-29 09:12:11 +0000 UTC
4, fibo, https://github.com/toandp/fibo, ":zap: A smart Fiber API Boilerplate", "", 2021-10-28 10:02:30 +0000 UTC
4, fl, https://github.com/wbbradley/fl, "A tool to filter text-based streams in real time", "", 2021-10-31 05:08:27 +0000 UTC
4, beer, https://github.com/tsirysndr/beer, "", "", 2021-11-04 20:52:29 +0000 UTC
4, paragueroreloaded, https://github.com/narvikd/paragueroreloaded, "", "", 2021-11-05 17:12:54 +0000 UTC
4, go-db-proxy, https://github.com/qingolang/go-db-proxy, "MySQL proxy backups check recovery", "backups,check,golang,mysql,proxy,recovery", 2021-10-27 03:27:29 +0000 UTC
4, projector, https://github.com/ThePrimeagen/projector, "Project my config into your prebuild", "", 2021-11-05 16:41:25 +0000 UTC
4, goreader, https://github.com/vorishirne/goreader, "GO lib for files/io/bytes processing/parsing in file-system/network.", "", 2021-10-30 04:08:17 +0000 UTC
