79, VcenterKiller, https://github.com/Schira4396/VcenterKiller, "ä¸€æ¬¾é’ˆå¯¹Vcenterçš„ç»¼åˆåˆ©ç”¨å·¥å…·ï¼ŒåŒ…å«ç›®å‰æœ€ä¸»æµçš„CVE-2021-21972ã€CVE-2021-21985ä»¥åŠCVE-2021-22005ä»¥åŠlog4jï¼Œæä¾›ä¸€é”®ä¸Šä¼ webshellï¼Œå‘½ä»¤æ‰§è¡Œæˆ–è€…ä¸Šä¼ å…¬é’¥ä½¿ç”¨SSHå…å¯†è¿æ¥", "go,golang,log4j,log4shell,scan,vcenter", 2022-10-04 03:39:27 +0000 UTC
37, spk, https://github.com/dhn/spk, "spk aka spritzgebaeck: A small OSINT/Recon tool to find CIDRs that belong to a specific organization.", "asn,bugbounty,cidr,enumeration,golang,osint,recon,reconnaissance", 2022-10-02 10:20:01 +0000 UTC
24, anvil-persistence, https://github.com/0xTomoyo/anvil-persistence, "Create persistent Anvil instances", "", 2022-10-02 08:36:50 +0000 UTC
24, tacquito, https://github.com/facebookincubator/tacquito, "Tacquito is an open source TACACs+ server written in Go that implements RFC8907", "", 2022-10-03 20:52:11 +0000 UTC
17, blocksort, https://github.com/tomnomnom/blocksort, "A tool for sorting blocks of lines", "", 2022-10-04 20:54:03 +0000 UTC
16, caddy-fs-s3, https://github.com/sagikazarmark/caddy-fs-s3, "Caddy FS module for AWS S3", "caddy,caddy-fs,caddy-module", 2022-10-01 14:16:09 +0000 UTC
14, GoOpenDrop, https://github.com/bodaay/GoOpenDrop, "a Go Implementation and Enhancement of the Awesome Open Source AirDrop implementation work of seemoo-lab: https://github.com/seemoo-lab/opendrop", "airdrop,goopendrop,macos,opendrop", 2022-10-03 15:05:41 +0000 UTC
14, isbot, https://github.com/stephenafamo/isbot, "Detect bots/crawlers/spiders using the user agent string.", "bot-detection,bot-detector,crawler-detection,golang,oktoberfest,user-agent", 2022-10-01 10:47:13 +0000 UTC
14, pvtop, https://github.com/blockpane/pvtop, "top-like tui for watching validator pre-votes on Tendermint chains", "", 2022-10-02 17:32:03 +0000 UTC
13, shiro_check, https://github.com/Ggasdfg321/shiro_check, "æ‰¹é‡å¯¹å­˜åœ¨Shiroæ¡†æ¶çš„ç›®æ ‡çˆ†ç ´Key", "", 2022-10-01 16:41:29 +0000 UTC
12, goexpert, https://github.com/devfullcycle/goexpert, "", "", 2022-10-02 22:40:56 +0000 UTC
11, GoHN, https://github.com/alexferrari88/GoHN, "Hacker News API wrapper for Go", "api,go,golang,golang-library,hacker-news,hacktoberfest,hacktoberfest2022", 2022-10-01 06:29:08 +0000 UTC
9, Go-Filter-Bot, https://github.com/Jisin0/Go-Filter-Bot, "A Superfast Filter Bot Written in Go with Global Filter Support.", "", 2022-10-02 09:59:08 +0000 UTC
8, i3tree, https://github.com/Ajnasz/i3tree, "view the i3wm window tree", "i3,i3wm", 2022-10-02 08:40:45 +0000 UTC
8, internet-speed-monitor, https://github.com/beykansen/internet-speed-monitor, "Internet Speed Monitor With Prometheus Metrics", "internet-speed,internet-speed-checker,internet-speed-meter,internet-speed-monitor,internet-speed-test,internet-speed-tester,internetspeed,internetspeedtest,netspeed,netspeedtest", 2022-10-01 22:32:57 +0000 UTC
7, oz-cnc, https://github.com/wolfy-j/oz-cnc, "OZ CNC machine source files and source code.", "", 2022-10-04 11:48:55 +0000 UTC
7, Cronus, https://github.com/exploitees/Cronus, "NEW 0 DAY // GoLang Discord Gen // NO CAPTCHA + FULLY REQUESTS", "", 2022-10-05 15:22:27 +0000 UTC
6, tendermint-practice, https://github.com/ssuchichen/tendermint-practice, "tendermintå®è·µ", "", 2022-10-04 14:33:22 +0000 UTC
6, weiroll-go, https://github.com/umbracle/weiroll-go, "Go SDK for the Weiroll virtual machine", "blockchain,go,sdk,smart-contract,weiroll", 2022-10-05 19:48:53 +0000 UTC
6, client-go, https://github.com/jina-ai/client-go, "Golang Client for Jina (https://github.com/jina-ai/jina)", "", 2022-10-01 15:20:16 +0000 UTC
6, abis, https://github.com/outcaste-io/abis, "Ethereum ABIs in JSON format", "", 2022-10-02 03:56:51 +0000 UTC
6, live-codings-golang, https://github.com/nictes1/live-codings-golang, "Ejemplos de codigo de las clases en vivo Bootcamp Go", "", 2022-10-03 19:16:27 +0000 UTC
5, waitgroup, https://github.com/alecthomas/waitgroup, "Like sync.WaitGroup and ergroup.Group had a baby.", "", 2022-10-06 01:27:08 +0000 UTC
5, qmsg-unpacker, https://github.com/Akegarasu/qmsg-unpacker, "unpack msgcontent in qq msg3.0.db", "", 2022-10-03 02:58:23 +0000 UTC
4, beeldeploy, https://github.com/lafusew/beeldeploy, "A simple cli tool that allow to deploy a google cloud function from a .yaml config file. ", "cli-tool,configuration-files,google-cloud-f,google-cloud-platform,yaml-configuration", 2022-10-01 17:47:44 +0000 UTC
4, telegram-random-quotes, https://github.com/lexuanquynh/telegram-random-quotes, "Telegram bot chat with random quotes.", "golang,quotes,telegram-bot", 2022-10-05 06:05:07 +0000 UTC
4, whysync, https://github.com/whyrusleeping/whysync, "a hopefully fast file syncing tool", "", 2022-10-03 20:40:38 +0000 UTC
4, SenderBot, https://github.com/Again51/SenderBot, "", "", 2022-10-01 23:43:03 +0000 UTC
4, mule, https://github.com/bpowers/mule, "fast proxy: eBPF data plane, Go control plane", "", 2022-10-02 18:09:20 +0000 UTC
4, unshort, https://github.com/devdrops/unshort, "Ferramenta de linha de comando para observar o destino de uma URL encurtada sem a necessidade de abrir em um browser.", "", 2022-10-02 18:36:23 +0000 UTC
3, tf-import, https://github.com/nammotd/tf-import, "", "", 2022-10-02 05:40:47 +0000 UTC
3, gh-mirror, https://github.com/ntns/gh-mirror, "Tool to mirror Github repositories locally", "backups,github,mirror", 2022-10-02 12:30:43 +0000 UTC
3, download-manager, https://github.com/tanujd11/download-manager, "A concurrent download-manager in golang", "", 2022-10-02 04:47:53 +0000 UTC
3, requestfy, https://github.com/RafaelYon/requestfy, "A library to facilitate creation of HTTP requests in GO", "hacktoberfest", 2022-10-01 19:53:32 +0000 UTC
3, gophercon-2022, https://github.com/hybridgroup/gophercon-2022, "", "", 2022-10-01 20:21:37 +0000 UTC
3, go-expohisto, https://github.com/lightstep/go-expohisto, "Golang implementation of the OpenTelemetry auto-scaling base-2-exponential histogram", "", 2022-10-05 21:14:08 +0000 UTC
3, schedule, https://github.com/atomicgo/schedule, "â° Easily schedule non-blocking tasks in Go. Supports durations, specific times and intervals.", "atomicgo,go,golang,golang-library,hacktoberfest,schedule,scheduler,ticker,time,timer", 2022-10-04 14:31:31 +0000 UTC
3, RabbitMQDemoApp, https://github.com/hvn2706/RabbitMQDemoApp, "ko bik loi j", "", 2022-10-04 16:29:31 +0000 UTC
3, PunkBuster-Screenshots-to-Discord, https://github.com/the-eduardo/PunkBuster-Screenshots-to-Discord, "Simple tool that send punkbuster screenshots to a Discord channel via WebHook", "", 2022-10-04 02:59:54 +0000 UTC
3, AOP-golang, https://github.com/MicroWiller/AOP-golang, "åŸºäºæ³›å‹å®ç°çš„AOPåº“ï¼Œç®€å•è½»é‡ã€‚A AOP library based on generic implementation, simple and lightweight.", "aop,golang", 2022-10-04 01:23:25 +0000 UTC
2, tan, https://github.com/tanchain/tan, "", "", 2022-10-01 22:04:14 +0000 UTC
2, SiMiddleman, https://github.com/WibuSOS/SiMiddleman, "", "", 2022-10-03 03:53:49 +0000 UTC
2, catalyst-faker, https://github.com/SecurityBrewery/catalyst-faker, "Generate demo or test data for catalyst", "", 2022-10-02 06:44:24 +0000 UTC
2, alfred-hunt-tor, https://github.com/coheff/alfred-hunt-tor, "An Alfred torrent search workflow powered by Go", "", 2022-10-02 09:36:40 +0000 UTC
2, action-s3-cache, https://github.com/try-keep/action-s3-cache, "S3 Cache for GitHub Actions", "", 2022-10-04 12:44:15 +0000 UTC
2, golang-app-ch01, https://github.com/cahyoariawan21/golang-app-ch01, "", "", 2022-10-01 07:46:48 +0000 UTC
2, allfields, https://github.com/subtle-byte/allfields, "Lint that all struct fields are set", "", 2022-10-02 17:47:53 +0000 UTC
2, Custom-Email-Client, https://github.com/DominickDiaz/Custom-Email-Client, "Custom email client ", "", 2022-10-02 20:49:15 +0000 UTC
2, go-mongo-auth, https://github.com/kuckchuck96/go-mongo-auth, "JWT authentication using gin-gonic and MongoDB", "", 2022-10-01 08:35:06 +0000 UTC
2, FluentRequest, https://github.com/VitorEstevam/FluentRequest, "", "hacktoberfest", 2022-10-04 01:32:00 +0000 UTC
2, csv2json, https://github.com/BLACK-BUG-HKRS/csv2json, "CSV to JSON CLI (Command Line Interface) tool", "csv-to-json,csv2json", 2022-10-02 08:48:26 +0000 UTC
2, CLI-Booking-App, https://github.com/mohammad-oghli/CLI-Booking-App, "", "", 2022-10-01 14:18:28 +0000 UTC
2, Equilibrium, https://github.com/amato1oveing/Equilibrium, "goå®ç°ç®€å•è´Ÿè½½å‡è¡¡", "", 2022-10-01 14:24:24 +0000 UTC
2, booking-app, https://github.com/Antonio-Gabriel/booking-app, "An app developed as use case to learn golang, a simple app for safe tickets", "", 2022-10-02 18:05:05 +0000 UTC
2, goctl-rest-discover, https://github.com/mengdj/goctl-rest-discover, "gozero plugin for rest discover client", "discover,goctl,gozero,microservice,rest-api", 2022-10-03 05:29:41 +0000 UTC
2, go-firebase-remote-config, https://github.com/NilPointer-Software/go-firebase-remote-config, "", "", 2022-10-02 10:41:39 +0000 UTC
2, Go_mailinglist, https://github.com/senior-web-dev0807/Go_mailinglist, "", "", 2022-10-01 15:29:33 +0000 UTC
2, Go_mgrep, https://github.com/senior-web-dev0807/Go_mgrep, "", "", 2022-10-01 15:39:41 +0000 UTC
2, steampipe-plugin-gitguardian, https://github.com/francois2metz/steampipe-plugin-gitguardian, "Use SQL to query incidents from Gitguardian.", "gitguardian,steampipe,steampipe-plugin", 2022-10-03 14:37:57 +0000 UTC
2, simpmailserv, https://github.com/littlefish12345/simpmailserv, "ä¸€ä¸ªall-in-oneé‚®ä»¶æœåŠ¡å™¨(åŒ…æ‹¬smtpå’Œpop3)", "", 2022-10-05 11:58:43 +0000 UTC
2, qhav, https://github.com/iwpnd/qhav, "quick haversine distance in the terminal", "", 2022-10-01 12:19:44 +0000 UTC
2, goraft, https://github.com/eatonphil/goraft, "Can I create a working raft implementation? No idea", "", 2022-10-02 01:06:24 +0000 UTC
2, Go_pixl, https://github.com/senior-web-dev0807/Go_pixl, "", "", 2022-10-01 15:41:11 +0000 UTC
2, simple-todo, https://github.com/oSethoum/simple-todo, "", "", 2022-10-05 16:59:00 +0000 UTC
2, sqext, https://github.com/bedakb/sqext, "A set of useful functions that are currently not supported by Squirrel - fluent query builder for Go.", "", 2022-10-02 18:31:08 +0000 UTC
2, go-phigros-b19, https://github.com/Jiang-Red/go-phigros-b19, "goå®ç°çš„phigros b19æˆç»©å›¾ç”Ÿæˆ", "", 2022-10-02 08:55:57 +0000 UTC
2, Exercism, https://github.com/pjonatansr/Exercism, "", "", 2022-10-04 12:29:45 +0000 UTC
2, stancli, https://github.com/electrofocus/stancli, "CLI for STAN messaging", "", 2022-10-04 07:42:01 +0000 UTC
2, Go_Practises, https://github.com/senior-web-dev0807/Go_Practises, "", "", 2022-10-01 15:43:50 +0000 UTC
2, better-dev-containers, https://github.com/JRichlen/better-dev-containers, "Better dev containers that are IDE agnostic and work on anything with Docker.", "", 2022-10-04 01:31:12 +0000 UTC
2, httpclient, https://github.com/globocom/httpclient, "A HTTP client in Golang.", "golang,http-client,resilent,retry-strategies", 2022-10-06 19:16:42 +0000 UTC
2, go-ejdb2, https://github.com/memmaker/go-ejdb2, "A simple wrapper around EJDB2 for go", "", 2022-10-02 14:28:13 +0000 UTC
2, apirunner, https://github.com/warrant-dev/apirunner, "", "", 2022-10-04 01:15:25 +0000 UTC
2, GoLang-Algoritms, https://github.com/Yorvoration/GoLang-Algoritms, "", "", 2022-10-05 10:14:46 +0000 UTC
2, waybackd, https://github.com/gregdel/waybackd, "Find your way back", "hacktoberfest", 2022-10-06 07:13:12 +0000 UTC
2, golang-app-ch02, https://github.com/cahyoariawan21/golang-app-ch02, "A basic demo example for creating Crud API with golangğŸ’™", "hacktoberfest", 2022-10-01 12:07:59 +0000 UTC
2, openzoo-go, https://github.com/OpenZoo/openzoo-go, "To be fair, I just wanted to find out where the caveats are.", "", 2022-10-02 21:23:38 +0000 UTC
2, pillow, https://github.com/eatmoreapple/pillow, "", "", 2022-10-06 16:53:04 +0000 UTC
1, McTokenTools, https://github.com/noormi/McTokenTools, "Terminal based tool for Minecraft", "", 2022-10-02 12:40:18 +0000 UTC
1, sql-api, https://github.com/espeletia/sql-api, "", "", 2022-10-01 06:18:31 +0000 UTC
1, chat_tcp, https://github.com/NikitaPopov123/chat_tcp, "", "", 2022-10-04 19:02:51 +0000 UTC
1, zkCache, https://github.com/Zhangzk6666/zkCache, "zkCache Written in golang", "", 2022-10-02 08:41:23 +0000 UTC
1, pgjobs, https://github.com/rverton/pgjobs, "Go and PostgreSQL job queue blueprint", "", 2022-10-06 07:15:10 +0000 UTC
1, golang-samples, https://github.com/ashwinpnr/golang-samples, "", "", 2022-10-04 05:06:41 +0000 UTC
1, scaffold, https://github.com/cupogo/scaffold, "Go project scaffolding, including code generators and examples", "", 2022-10-02 16:30:09 +0000 UTC
1, server, https://github.com/BytePass/server, "The core server infrastructure", "", 2022-10-03 19:08:18 +0000 UTC
1, wgproxy, https://github.com/mrjosh/wgproxy, "wgproxy is a ProxyServer for wireguard", "", 2022-10-06 17:53:02 +0000 UTC
1, dictGenerate, https://github.com/chinaDL/dictGenerate, "", "", 2022-10-01 18:32:41 +0000 UTC
1, carwash-pollution, https://github.com/marleyakins/carwash-pollution, "A simulation to simulte pollution from car washes over a given number of years.", "", 2022-10-02 18:44:20 +0000 UTC
1, gee, https://github.com/guanhui07/gee, "", "", 2022-10-03 12:26:01 +0000 UTC
1, steampipe-plugin-ndo, https://github.com/justlikeef/steampipe-plugin-ndo, "", "", 2022-10-03 19:35:16 +0000 UTC
1, machine-learning-with-golang, https://github.com/toul-codes/machine-learning-with-golang, "Inspired by machine learning with python. In this repo my TikTok data is analyzed with the attempt to build a few models for predicting things...", "", 2022-10-01 01:46:10 +0000 UTC
1, go-challenge, https://github.com/nikitakoselev/go-challenge, "", "", 2022-10-01 06:21:03 +0000 UTC
1, gotils, https://github.com/lucky0229/gotils, "golang utilities", "", 2022-10-05 14:09:22 +0000 UTC
1, EyeshieldTime, https://github.com/hfdxiaoyu/EyeshieldTime, "ä¸€ä¸ªåŸºäºgo fyneçš„æŠ¤çœ¼åŠ©æ‰‹", "", 2022-10-05 08:52:15 +0000 UTC
1, myleetcode, https://github.com/xmh1011/myleetcode, "è®°å½•ä¸€ä¸‹åŠ›æ‰£åˆ·é¢˜", "golang,leetcode,leetcode-golang,leetcode-practice", 2022-10-04 06:30:38 +0000 UTC
1, crossplane-provider-vault, https://github.com/topfreegames/crossplane-provider-vault, "", "", 2022-10-03 20:18:57 +0000 UTC
1, tinylb, https://github.com/ductnn/tinylb, "TinyLB is a simple Load Balancer written in Go", "docker,golang,load-balancer,round-robin,simple", 2022-10-02 09:14:23 +0000 UTC
1, k8s-client-go-practice-deployment, https://github.com/googs1025/k8s-client-go-practice-deployment, "åŸºäºgolang+client-go+k8sï¼Œå®ç°ç®€æ˜“ç‰ˆdeploymentç®¡ç†ç³»ç»Ÿ", "", 2022-10-03 15:56:43 +0000 UTC
1, simple-MQ-using-go-redis, https://github.com/charles-chenzz/simple-MQ-using-go-redis, "using go and redis to build a simple mq", "", 2022-10-01 08:31:07 +0000 UTC
