1483, m3o, https://github.com/m3o/m3o, "The open source public cloud platform. An AWS alternative for the next generation of developers.", "api,aws,cloud,m3o,micro", 2021-10-08 20:45:40 +0000 UTC
81, terraform-provider-multispace, https://github.com/mitchellh/terraform-provider-multispace, "Terraform Provider for cascading runs across multiple workspaces.", "", 2021-10-16 17:25:39 +0000 UTC
53, broadcast, https://github.com/teivah/broadcast, "Notifications broadcaster in Go", "channels,concurrency,go,golang,goroutine,goroutines,notifications,parallelism,publish-subscribe", 2021-10-14 19:55:37 +0000 UTC
50, Lazytainer, https://github.com/vmorganp/Lazytainer, "Docker container lazy loading ", "container,container-image,docker,docker-compose,docker-container,dockerfile,hacktoberfest,hacktoberfest2021,lazy,lazy-loading,lazyload,self-hosted", 2021-10-13 04:08:32 +0000 UTC
48, gojtp, https://github.com/ankur-anand/gojtp, "A high-performance, zero allocation, dynamic JSON Threat  Protection in  pure Go (golang)", "go,golang,high-performance,josnthreatprotection,json-threat-protection", 2021-10-11 16:03:13 +0000 UTC
46, limner, https://github.com/SignorMercurio/limner, "Limner colorizes and transforms CLI outputs.", "cli,colorization,go,golang,hacktoberfest,terminal", 2021-10-12 19:38:01 +0000 UTC
38, gorilla, https://github.com/kei6u/gorilla, "An effective time-series data compression/decompression method based on Facebook's Gorilla.", "compression,decompression,go,golang,time-series", 2021-10-07 22:17:33 +0000 UTC
32, chip8, https://github.com/ambertide/chip8, "A Chip8 emulator written in Go", "", 2021-10-08 00:20:42 +0000 UTC
29, go-pong, https://github.com/RedDeadAlice/go-pong, "A Pong clone made from scratch with Go and C using OpenGL 3.3", "c,cgo,game,golang,multiplayer-game,opengl", 2021-10-10 21:38:40 +0000 UTC
29, avbypass, https://github.com/Shu1L/avbypass, "简单go加载器实现免杀360 火绒", "", 2021-10-10 11:51:18 +0000 UTC
28, Frp_modify, https://github.com/NS-Sp4ce/Frp_modify, "修改版FRP", "", 2021-10-08 08:10:21 +0000 UTC
28, tailscale-systray, https://github.com/mattn/tailscale-systray, "Linux port of tailscale system tray menu.", "linux,tailscale", 2021-10-12 16:10:00 +0000 UTC
28, remindme, https://github.com/briandowns/remindme, "", "", 2021-10-06 23:56:48 +0000 UTC
26, go-netflow, https://github.com/rfyiamcool/go-netflow, "go netflow, capture process in/out traffic, similar to c Nethogs.", "nethogs,pcap", 2021-10-13 08:30:30 +0000 UTC
26, keygen-go, https://github.com/keygen-sh/keygen-go, "Keygen SDK for Go. Integrate license activation and automatic updates for Go binaries.", "auto-updater,license-keys,licensing,software-distribution,software-licensing", 2021-10-11 13:25:01 +0000 UTC
26, road-to-secure-kubernetes, https://github.com/nsmith5/road-to-secure-kubernetes, "Hardening a sketchy containerized application one step at a time", "", 2021-10-08 00:43:45 +0000 UTC
25, go-in-3-weeks, https://github.com/jboursiquot/go-in-3-weeks, "", "", 2021-10-11 23:06:13 +0000 UTC
23, gitana, https://github.com/nicolastakashi/gitana, "Gitana is a lightweight dashboard sync", "grafana,grafana-dashboard,grafana-dashboards,kubernetes", 2021-10-06 07:21:16 +0000 UTC
23, galaxykube, https://github.com/ApsaraDB/galaxykube, "PolarDB-X Operator is a Kubernetes extension that aims to create and manage PolarDB-X cluster on Kubernetes.", "cloud-native,database,k8s,kubernetes,operator,polardb-x", 2021-10-16 05:53:07 +0000 UTC
22, whatsmeow, https://github.com/tulir/whatsmeow, "Go library for the WhatsApp web multidevice API", "go,golang,whatsapp,whatsapp-web", 2021-10-06 18:48:01 +0000 UTC
21, iocgo, https://github.com/studyzy/iocgo, "A lightweight  Inversion of Control (IoC) (Dependency Injection) container for Golang", "dependency-injection,go,golang,inversion-of-control,ioc,ioc-container", 2021-10-09 06:30:56 +0000 UTC
19, goic, https://github.com/adhocore/goic, "Golang OpenID Connect Client", "adhocore,claims,go-oidc,golang,google-authentication,hacktoberfest,hacktoberfest2021,jwt,login-with-google,login-with-microsoft,login-with-yahoo,oauth2,oidc,oidc-client,openid,openid-client,openid-connect", 2021-10-11 08:55:25 +0000 UTC
18, lorelai, https://github.com/UltiRequiem/lorelai, "✍ A package and command line tool to generate Lorem Ipsum", "cli,command-line,go,golang,lorem-ipsum,lorem-ipsum-generator,random-generation", 2021-10-06 02:20:31 +0000 UTC
18, ScareCrow-Common, https://github.com/timwhitez/ScareCrow-Common, "ScareCrow loader binary source which easier to read and learn", "", 2021-10-14 05:12:22 +0000 UTC
17, shortcut, https://github.com/dhamith93/shortcut, "A simple way to share files and clipboard  within a local network.", "clipboard-share,file-share,go,golang,local-sharing", 2021-10-10 07:53:51 +0000 UTC
17, go-clean-architecture, https://github.com/restuwahyu13/go-clean-architecture, "Example go clean architecture folder pattern", "clean-architecture,folder-structure,golang,google-api", 2021-10-11 19:07:06 +0000 UTC
15, migp-go, https://github.com/cloudflare/migp-go, "", "", 2021-10-13 18:06:38 +0000 UTC
15, entimport, https://github.com/ariga/entimport, "A tool for generating Ent schema from SQL schema", "", 2021-10-11 15:23:11 +0000 UTC
15, daypaper, https://github.com/MatteoGgl/daypaper, "Daypaper sets your GNOME wallpaper based on the time of day from a random and relevant Unsplash image.", "", 2021-10-13 14:31:44 +0000 UTC
15, grelay, https://github.com/grelay/grelay, "gRelay is an open source project written in Go that provides the circuit break pattern with a relay idea behind.", "circuit,circuit-breaker,circuit-breaker-library,circuit-breaker-pattern,circuit-breakers,golang", 2021-10-07 16:59:40 +0000 UTC
14, reactor-crw, https://github.com/reactor-joy/reactor-crw, "Simple content crawler for joyreactor.cc", "", 2021-10-15 21:26:11 +0000 UTC
14, e7mon, https://github.com/eth-tools/e7mon, "Ethereum clients monitor", "erigon,eth2,ethereum,geth,lighthouse,monitoring,prysm", 2021-10-15 14:23:12 +0000 UTC
14, i_cant_believe_it_can, https://github.com/mattn/i_cant_believe_it_can, "", "", 2021-10-08 03:29:07 +0000 UTC
13, ghodrat, https://github.com/snapp-incubator/ghodrat, " WebRTC media servers stress testing tool (currently only Janus) ", "", 2021-10-11 08:00:26 +0000 UTC
12, macos-totp-cli, https://github.com/simnalamburt/macos-totp-cli, "simple TOTP CLI, powered by keychain of macOS", "", 2021-10-15 00:47:30 +0000 UTC
12, Air-Universe, https://github.com/crossfw/Air-Universe, "开源多功能机场后端， 协议支持 V2Ray(VMess), Trojan, Shadowsocks(单端口多用户)；面板支持 SSPanel, v2board, django-sspanel.", "", 2021-10-11 11:40:11 +0000 UTC
12, bls-crypto, https://github.com/eywa-protocol/bls-crypto, "BLS signature and multi-signature schemas in Go and Solidity", "bls,evm,multisignature", 2021-10-06 09:30:43 +0000 UTC
12, collect, https://github.com/tommsawyer/collect, "collect all pprof profiles with one command", "golang,pprof", 2021-10-15 13:14:17 +0000 UTC
11, pkr, https://github.com/sivers/pkr, "PostgreSQL API Client", "", 2021-10-13 01:58:08 +0000 UTC
11, bilibili_ctl, https://github.com/ZeroDream-CN/bilibili_ctl, "Bilibili 评论控制工具，帮助你自动清理不想要的评论内容，支持关键字、黑名单以及正则表达式匹配", "", 2021-10-18 14:25:29 +0000 UTC
11, terminal-app, https://github.com/thaibui2308/terminal-app, "", "", 2021-10-11 03:32:41 +0000 UTC
10, ansi, https://github.com/muesli/ansi, "Raw ANSI sequence helpers", "", 2021-10-18 07:37:06 +0000 UTC
10, richeck, https://github.com/c1982/richeck, "Freaking simple AWS Reserved Instance and Usage coverage report", "aws,coverage,report,reservedinstances", 2021-10-06 17:03:43 +0000 UTC
9, interchain-security, https://github.com/cosmos/interchain-security, "", "", 2021-10-06 14:27:45 +0000 UTC
9, chanman, https://github.com/yakuter/chanman, "Chanman helps you to create queue channels and manage them gracefully.", "", 2021-10-08 21:10:02 +0000 UTC
9, outback, https://github.com/koala-labs/outback, "A CLI tool to manage and streamline AWS ECS deployments", "aws,docker,ecs,golang", 2021-10-08 18:58:08 +0000 UTC
9, woof-new-contract, https://github.com/fxfactorial/woof-new-contract, "", "", 2021-10-13 22:04:36 +0000 UTC
9, kudruk, https://github.com/yakuter/kudruk, "Kudruk helps you to create queue channels and manage them gracefully.", "", 2021-10-10 18:15:01 +0000 UTC
8, gorestapi, https://github.com/krishpranav/gorestapi, "A Simple REST API Built Using Golang", "backend,css,frontend,gin,gin-framework,gin-gonic,go,go-restapi,go-service,golang,golang-rest,gorest,html,react,reactjs,rest-api,restapi,restapi-backend,restapi-example,vue", 2021-10-14 11:01:57 +0000 UTC
8, vault-converter, https://github.com/vietanhduong/vault-converter, "Support converting Vault Secrets to diffrent formats.", "hashicorp-vault,terraform,vault", 2021-10-10 01:48:51 +0000 UTC
8, minty, https://github.com/alexellis/minty, "Minting OIDC tokens from GitHub Actions for use with OpenFaaS", "", 2021-10-06 08:38:22 +0000 UTC
8, checkpoint, https://github.com/vidhanio/checkpoint, "A simple verification bot for servers in the Peel District School Board.", "discord,discord-bot,discordgo,go,golang", 2021-10-06 23:06:37 +0000 UTC
8, srun-login, https://github.com/vidar-team/srun-login, "⚡ 杭州电子科技大学校园网 Wi-Fi 登录 / 深澜（srun）校园网模拟登录", "", 2021-10-15 14:57:05 +0000 UTC
7, pairat, https://github.com/ELPanaJose/pairat, "A remote access tool & CNC", "cnc,rat", 2021-10-09 04:46:55 +0000 UTC
7, orderedjson, https://github.com/aybabtme/orderedjson, "Type to unmarshal JSON objects while keeping the order of the keys.", "", 2021-10-17 05:57:21 +0000 UTC
7, bug, https://github.com/ent/bug, "Template repository for reporting bugs ", "", 2021-10-18 08:34:18 +0000 UTC
7, golang-testing-fundamental, https://github.com/restuwahyu13/golang-testing-fundamental, "Example basic fundamental testing in golang", "golang,tdd,testing,unit-testing", 2021-10-08 16:42:48 +0000 UTC
7, cuetils, https://github.com/hofstadter-io/cuetils, "Packages and binary for diff, patch, and other manipulations on JSON, Yaml, and CUE", "configuration,cue,cuelang,diff,golang,jq,json,structural-diff,yaml", 2021-10-08 15:07:15 +0000 UTC
7, React_Go_Boiler, https://github.com/Amokstakov/React_Go_Boiler, "", "", 2021-10-07 05:55:06 +0000 UTC
7, contract-eval-web, https://github.com/fxfactorial/contract-eval-web, "", "", 2021-10-16 15:24:30 +0000 UTC
6, intro-to-go, https://github.com/AlvaroSebastian98/intro-to-go, "", "", 2021-10-09 19:45:45 +0000 UTC
6, defaults, https://github.com/meowgorithm/defaults, "Enforce default values on structs in Go", "", 2021-10-18 15:35:24 +0000 UTC
6, igop, https://github.com/goplus/igop, "The Go+ interpreter (still in beta version)", "", 2021-10-12 15:04:18 +0000 UTC
6, bell, https://github.com/NUTtech/bell, "Bell is the simplest event system written in Go (Golang) which is based on the execution of handlers independent of the main channel.", "events,eventsystem,go,golang,hacktoberfest", 2021-10-06 21:09:37 +0000 UTC
6, AdobeCollect, https://github.com/ali-em/AdobeCollect, "Export Adobe Connect videos to Mkv!", "", 2021-10-07 13:32:42 +0000 UTC
6, go-internal-game-mod, https://github.com/makindotcc/go-internal-game-mod, "for fun example game internal (~hack~) mod development using golang with cgo. for educational purposes only.", "", 2021-10-06 17:37:54 +0000 UTC
6, golang, https://github.com/babydevbr/golang, "Golang Monorepo for BabyDev", "", 2021-10-11 17:13:38 +0000 UTC
6, go-libraryofcongress, https://github.com/sfomuseum/go-libraryofcongress, "Go package providing tools for working with Library of Congress data.", "", 2021-10-13 20:03:30 +0000 UTC
6, golang-scanner-app, https://github.com/restuwahyu13/golang-scanner-app, "Example mini project golang scanner application", "golang,golang-application,golang-examples,scanner-app", 2021-10-10 18:00:08 +0000 UTC
6, anime-cli, https://github.com/thaibui2308/anime-cli, "", "", 2021-10-18 23:39:01 +0000 UTC
5, overdub, https://github.com/zalimeni/overdub, "Create new commands from your shell history or terminal.", "", 2021-10-11 05:19:17 +0000 UTC
5, gRPC, https://github.com/spiderxm/gRPC, "", "", 2021-10-09 16:27:32 +0000 UTC
5, uno, https://github.com/Benricheson101/uno, "uno (wip. idk if itll ever get finished tbh)", "", 2021-10-10 05:47:16 +0000 UTC
5, go-cli, https://github.com/xiaoxiunique/go-cli, "一个集万千功能于一身的命令行工具😈😈😈", "cli,gitee,go,goreleaser,juejin,transition,zhihu", 2021-10-08 19:05:41 +0000 UTC
5, PolarDB-Stack-Storage, https://github.com/ApsaraDB/PolarDB-Stack-Storage, "", "", 2021-10-15 08:49:54 +0000 UTC
5, simplest-sort, https://github.com/radiantly/simplest-sort, "The simplest sorting algorithm that sorts in quadratic time", "golang,sorting-algorithms,tui", 2021-10-11 14:56:57 +0000 UTC
5, yawx, https://github.com/cdle/yawx, "", "", 2021-10-09 07:04:07 +0000 UTC
5, tracing-apis, https://github.com/hansmrtn/tracing-apis, "", "", 2021-10-06 21:06:05 +0000 UTC
5, gazer-system, https://github.com/Jannchie/gazer-system, "Gazer system is used to track data.", "", 2021-10-10 09:47:31 +0000 UTC
5, townboard, https://github.com/thiccgod/townboard, "", "", 2021-10-09 03:45:14 +0000 UTC
5, dlfs, https://github.com/seh-msft/dlfs, "Azure Data Lake Storage Account Share 9p File System", "", 2021-10-13 22:58:41 +0000 UTC
5, dbvm, https://github.com/ideadawn/dbvm, "", "", 2021-10-13 05:45:37 +0000 UTC
5, spamwatch-go, https://github.com/SpamWatch/spamwatch-go, "Go wrapper for SpamWatch API", "", 2021-10-09 15:11:14 +0000 UTC
5, PolarDB-Stack-Daemon, https://github.com/ApsaraDB/PolarDB-Stack-Daemon, "PolarStack-Daemon is a daemon process in DBaaS PolarStack. It runs on all hosts and is responsible for port status collection, db log clear, db engine images availability collection, host network status collection.  It provides the basic host information and status for db cluster creating/migrating/state recognition and running.", "dbaas,k8s-kubernetes,polardb,postgresql-polardb", 2021-10-15 08:44:16 +0000 UTC
5, x448, https://github.com/Yawning/x448, "curve448 ECDH (Mirror)", "", 2021-10-11 03:08:52 +0000 UTC
5, wghttp, https://github.com/zhsj/wghttp, "Turn WireGuard to an HTTP proxy", "wireguard", 2021-10-07 08:18:34 +0000 UTC
5, ava-sim, https://github.com/ava-labs/ava-sim, "", "", 2021-10-08 04:30:20 +0000 UTC
5, tch-muzik, https://github.com/dacsang97/tch-muzik, "", "hacktoberfest", 2021-10-15 02:26:33 +0000 UTC
4, goinsta, https://github.com/sanket10305/goinsta, "Instagram API using go and Mongo", "", 2021-10-09 18:04:41 +0000 UTC
4, TikiTokBot, https://github.com/BassMatt/TikiTokBot, "A discord bot that watches for tiktok URL's and automatically uploads the corresponding video to the channel", "", 2021-10-13 05:18:38 +0000 UTC
4, ZeroBot-Plugin-Dynamic, https://github.com/FloatTech/ZeroBot-Plugin-Dynamic, "ZeroBot-Plugin 的模块化，不支持 Windows，需要 CGO", "", 2021-10-14 06:15:09 +0000 UTC
4, spinnerette, https://github.com/rushsteve1/spinnerette, "Simple Janet web development platform in Go, à la PHP", "go,janet,json,rapid-development,sqlite,web", 2021-10-12 19:25:48 +0000 UTC
4, p2ping, https://github.com/rinsuki/p2ping, "WebRTC in piping server", "", 2021-10-09 07:50:12 +0000 UTC
4, HubAdmin, https://github.com/crewdevio/HubAdmin, "Easily manage your github credentials", "", 2021-10-18 19:43:51 +0000 UTC
4, durudex-notif-service, https://github.com/Durudex/durudex-notif-service, "Durudex Notification Service", "go,golang,grpc", 2021-10-17 13:57:57 +0000 UTC
4, typed-http-server-in-go, https://github.com/hypirion/typed-http-server-in-go, "It's a typed HTTP server in Go, using generics that is expected to come out with 1.18", "", 2021-10-07 22:28:19 +0000 UTC
4, leavemealone, https://github.com/diamondburned/leavemealone, "Leave Discord servers using the folder names.", "", 2021-10-11 22:08:33 +0000 UTC
4, PolarDB-Stack-Common, https://github.com/ApsaraDB/PolarDB-Stack-Common, "", "", 2021-10-15 08:55:26 +0000 UTC
4, errors, https://github.com/WAY29/errors, "Just another error handling primitives for golang", "", 2021-10-06 01:51:45 +0000 UTC
4, gotube, https://github.com/jpastorm/gotube, "A youtube library for retrieving metadata, and obtaining direct links to video-only/audio-only/mixed versions of videos on YouTube in Go.", "", 2021-10-17 08:19:27 +0000 UTC
