114, bucketeer, https://github.com/bucketeer-io/bucketeer, "Feature Flag Management and A/B Testing platform", "", 2022-09-28 06:17:37 +0000 UTC
93, asnmap, https://github.com/projectdiscovery/asnmap, "Go CLI and Library for quickly mapping organization network ranges using ASN information.", "asn,asn-lookup,cidr-range,osint,recon", 2022-09-29 01:19:40 +0000 UTC
50, xstd, https://github.com/rsc/xstd, "importable versions of parts of the Go standard library", "", 2022-09-29 12:57:51 +0000 UTC
41, kancli, https://github.com/charmbracelet/kancli, "Command line kanban board", "hacktoberfest,kanban", 2022-09-27 18:31:26 +0000 UTC
33, 0dayex-checker, https://github.com/VNCERT-CC/0dayex-checker, "Zeroday Microsoft Exchange Server checker (Virtual Patching checker)", "", 2022-09-30 08:40:17 +0000 UTC
29, pfa-go, https://github.com/devfullcycle/pfa-go, "", "", 2022-09-27 01:06:22 +0000 UTC
19, broom, https://github.com/berrybyte-net/broom, "A Go program for scanning JAR files to uncover the 29-09-2022 Minecraft malware infections.", "detector,java,malware,minecraft", 2022-09-29 19:44:22 +0000 UTC
15, go-simpex, https://github.com/tobiassjosten/go-simpex, "A simpler and faster alternative to regexp", "", 2022-09-28 17:23:49 +0000 UTC
14, caddy-fs-s3, https://github.com/sagikazarmark/caddy-fs-s3, "Caddy FS module for AWS S3", "caddy,caddy-fs,caddy-module", 2022-10-01 14:16:09 +0000 UTC
14, mockey, https://github.com/bytedance/mockey, "a simple and easy-to-use golang mock library", "", 2022-09-27 11:28:54 +0000 UTC
13, crowdsec-bouncer-traefik-plugin, https://github.com/maxlerebourg/crowdsec-bouncer-traefik-plugin, "Traefik plugin to apply crowdsec decisions from local API", "crowdsec,crowdsec-bouncer,traefik,traefik-middleware,traefik-plugin", 2022-09-27 15:57:26 +0000 UTC
11, geth-data-layer, https://github.com/umbracle/geth-data-layer, "Go library to access the blockchain state of Go-ethereum", "blockchain,data,geth", 2022-09-28 13:50:59 +0000 UTC
10, anvil-persistence, https://github.com/0xTomoyo/anvil-persistence, "Create persistent Anvil instances", "", 2022-10-02 08:36:50 +0000 UTC
8, Freeze-Common, https://github.com/timwhitez/Freeze-Common, "Freeze is a payload toolkit for bypassing EDRs using suspended processes, direct syscalls, and alternative execution methods", "", 2022-09-30 09:35:00 +0000 UTC
8, shiro_check, https://github.com/Ggasdfg321/shiro_check, "批量对存在Shiro框架的目标爆破Key", "", 2022-10-01 16:41:29 +0000 UTC
7, Learn-GoLang, https://github.com/DoniaEsawi/Learn-GoLang, "A list of Golang Tutorials. Learn Golang from Scratch with simple examples.", "", 2022-09-27 15:35:32 +0000 UTC
7, twiyou, https://github.com/disksing/twiyou, "", "", 2022-09-29 16:20:20 +0000 UTC
7, Build-It-Now, https://github.com/Hacktoberfest-SCE/Build-It-Now, "Hacktoberfest 2022", "dsa-algorithm,golang,hacktoberfest,hacktoberfest2022,kotlin,rust,webdev", 2022-09-27 00:51:21 +0000 UTC
7, isbot, https://github.com/stephenafamo/isbot, "Detect bots/crawlers/spiders using the user agent string.", "bot-detection,bot-detector,crawler-detection,golang,oktoberfest,user-agent", 2022-10-01 10:47:13 +0000 UTC
7, pvtop, https://github.com/blockpane/pvtop, "top-like tui for watching validator pre-votes on Tendermint chains", "", 2022-10-02 17:32:03 +0000 UTC
6, territory-of-indonesia, https://github.com/rubichandrap/territory-of-indonesia, "Territory of Indonesia based on OSM Boundaries", "", 2022-09-27 09:44:25 +0000 UTC
6, tic-tac-go, https://github.com/LordOfTrident/tic-tac-go, "A simple Tic Tac Toe game written in Go using SDL2", "", 2022-09-28 14:05:06 +0000 UTC
6, golang-swaggerui-example, https://github.com/soulfriend216/golang-swaggerui-example, "SwaggerUI generation example for Golang", "golang,swagger,swagger-ui", 2022-09-30 16:38:47 +0000 UTC
6, uptick, https://github.com/UptickNetwork/uptick, "", "", 2022-09-27 08:44:26 +0000 UTC
6, golang-for-nodejs-developers, https://github.com/soulfriend216/golang-for-nodejs-developers, "Examples of Golang compared to Node.js for learning", "demo,go,golang,javascript,learning,nodejs,tutorial", 2022-09-30 16:43:43 +0000 UTC
6, post-testes-go, https://github.com/eminetto/post-testes-go, "Repositório com exemplos usados no post do Medium sobre testes automatizados em Go do blog do PicPay", "", 2022-09-28 12:00:49 +0000 UTC
5, kafkacli, https://github.com/vlinux/kafkacli, "A simple Kafka client tool hopes to help you 🔧", "", 2022-09-27 05:50:04 +0000 UTC
5, problem-details, https://github.com/meysamhadeli/problem-details, "ProblemDetails is a Error Handler base on [RFC 7807] standard to map our error to standardized error payload to client. For implement this approach, we use It's a JSON or XML format, when formatted as a JSON document, it uses the \"application/problem+json\" media type and for XML format, it uses the \"application/problem+xml\" media type. This document help us to defines machine-readable details of errors in an HTTP response to avoid the need to define new error response formats for HTTP APIs.", "error,error-handler,error-handling,errorhanders,errorhandler,errors,go,golang,problem,problem-details,problemdetails", 2022-09-28 19:09:59 +0000 UTC
5, basic-cnn, https://github.com/ranon-rat/basic-cnn, "yeii boy", "", 2022-09-28 03:11:26 +0000 UTC
4, Verifier, https://github.com/imAETHER/Verifier, "A Discord web-based verification bot made in Go using Fiber", "discord-bot,discordgo,golang,recaptcha-v3", 2022-09-28 00:10:57 +0000 UTC
4, Go-Filter-Bot, https://github.com/Jisin0/Go-Filter-Bot, "A Superfast Filter Bot Written in Go with Global Filter Support.", "", 2022-10-02 09:59:08 +0000 UTC
4, Leddx, https://github.com/Lexterl33t/Leddx, "Micro Control flow graph flattening obfuscator to learn", "", 2022-09-29 23:33:05 +0000 UTC
4, i3tree, https://github.com/Ajnasz/i3tree, "view the i3wm window tree", "i3,i3wm", 2022-10-02 08:40:45 +0000 UTC
4, Docker-Go-Simple-Microservice, https://github.com/mustafakraizim98/Docker-Go-Simple-Microservice, "", "", 2022-09-28 23:22:17 +0000 UTC
4, abis, https://github.com/outcaste-io/abis, "Ethereum ABIs in JSON format", "", 2022-10-02 03:56:51 +0000 UTC
4, internet-speed-monitor, https://github.com/beykansen/internet-speed-monitor, "Internet Speed Monitor With Prometheus Metrics", "internet-speed,internet-speed-checker,internet-speed-meter,internet-speed-monitor,internet-speed-test,internet-speed-tester,internetspeed,internetspeedtest,netspeed,netspeedtest", 2022-10-01 22:32:57 +0000 UTC
4, grpc-go, https://github.com/lifangjunone/grpc-go, "grpc usage in go", "", 2022-09-27 16:11:37 +0000 UTC
4, speedwagon, https://github.com/timsutton/speedwagon, "Download iOS/tvOS/watchOS simulators without Xcode", "ios,xcode", 2022-09-27 18:21:58 +0000 UTC
4, biliup-go, https://github.com/XiaoMiku01/biliup-go, "B 站命令行投稿工具 Golang 实现", "bilibili", 2022-09-29 16:10:01 +0000 UTC
4, go4hacker-mails, https://github.com/hktalent/go4hacker-mails, "Bulk email collection and retrieval, for hacker tools", "email,email-client,golang,hacker-tools", 2022-09-27 08:03:38 +0000 UTC
3, OcarinaPlayer, https://github.com/samuelyuan/OcarinaPlayer, "Play songs from Legend of Zelda: Ocarina of Time and Majora's Mask", "", 2022-09-28 01:42:14 +0000 UTC
3, LgoPool, https://github.com/L2ncE/LgoPool, "Lightweight goroutine pool / 轻量级Golang协程池", "golang,goroutine-pool", 2022-09-27 08:25:18 +0000 UTC
3, gp, https://github.com/tiancaiamao/gp, "A nano goroutine pool implementation in several lines", "", 2022-09-29 14:06:46 +0000 UTC
3, tl, https://github.com/dgrr/tl, "Generic template library for Golang", "", 2022-09-28 12:43:57 +0000 UTC
3, Open-IM-Server-Call, https://github.com/shoyu666/Open-IM-Server-Call, "openim", "", 2022-09-28 07:37:15 +0000 UTC
3, dasar-golang, https://github.com/mofris/dasar-golang, "Dasar-dasar pemograman Golang", "", 2022-09-30 20:19:51 +0000 UTC
3, mea4_01_habits, https://github.com/bfhmea4/mea4_01_habits, "Habits Journalling Platform", "golang,habit-tracking,nextjs,pocketbase", 2022-09-28 05:12:27 +0000 UTC
3, cau_go, https://github.com/NingYuanLin/cau_go, "cau中国农业大学 校园网认证 cli using golang", "", 2022-09-29 08:03:46 +0000 UTC
3, gondalf, https://github.com/dougmendes/gondalf, "", "", 2022-09-27 21:23:12 +0000 UTC
3, terraform-provider-openvpn-cloud, https://github.com/OpenVPN/terraform-provider-openvpn-cloud, "Terraform OpenVPN Cloud provider", "openvpn-cloud,openvpn-configuration,openvpn-installer,terraform,terraform-provider", 2022-09-29 22:07:45 +0000 UTC
2, go-tutorial-practice, https://github.com/isHuangXin/go-tutorial-practice, "Golang learning for better open-source participation, e.g. tidb.", "", 2022-09-30 01:33:39 +0000 UTC
2, go-sonar-scanner, https://github.com/Razor-Sec/go-sonar-scanner, "This tools for custom quality gate when scanning sast in sonarqube.", "", 2022-09-28 07:13:04 +0000 UTC
2, go-bigqueue, https://github.com/rfyiamcool/go-bigqueue, "golang bigqueue is the same as redis quicklist.", "", 2022-09-29 14:35:45 +0000 UTC
2, tan, https://github.com/tanchain/tan, "", "", 2022-10-01 22:04:14 +0000 UTC
2, cursor, https://github.com/TrueKupo/cursor, "", "", 2022-09-27 13:11:35 +0000 UTC
2, gochat, https://github.com/jarri-abidi/gochat, "", "", 2022-09-29 04:08:46 +0000 UTC
2, catalyst-faker, https://github.com/SecurityBrewery/catalyst-faker, "Generate demo or test data for catalyst", "", 2022-10-02 06:44:24 +0000 UTC
2, docker-kubernetes-101, https://github.com/jayantkatia/docker-kubernetes-101, "🐳🚢 GitHub Action workflows for Kubernetes and Docker", "docker,dockerhub,github-actions,kubernete", 2022-09-28 11:39:53 +0000 UTC
2, download-manager, https://github.com/tanujd11/download-manager, "A concurrent download-manager in golang", "", 2022-10-02 04:47:53 +0000 UTC
2, AndroidRaptor, https://github.com/elieser9001/AndroidRaptor, "Stealth Android Remote Manager", "", 2022-09-28 19:40:22 +0000 UTC
2, go-mongo-auth, https://github.com/kuckchuck96/go-mongo-auth, "JWT authentication using gin-gonic and MongoDB", "", 2022-10-01 08:35:06 +0000 UTC
2, whatsapp-cloud-api, https://github.com/febriliankr/whatsapp-cloud-api, "Whatsapp Cloud API Wrapper for Golang", "go,whatsapp-api", 2022-09-27 03:48:49 +0000 UTC
2, unibase2n, https://github.com/fumiama/unibase2n, "generate base2^n starting from any position in unicode table", "", 2022-09-30 09:27:43 +0000 UTC
2, csv2json, https://github.com/BLACK-BUG-HKRS/csv2json, "CSV to JSON CLI (Command Line Interface) tool", "csv-to-json,csv2json", 2022-10-02 08:48:26 +0000 UTC
2, saga-example, https://github.com/Bogdaan/saga-example, "orchestration saga example with docker, golang and dtm", "docker,golang,saga,saga-pattern,transaction-management", 2022-09-28 16:50:03 +0000 UTC
2, Equilibrium, https://github.com/amato1oveing/Equilibrium, "go实现简单负载均衡", "", 2022-10-01 14:24:24 +0000 UTC
2, CLI-Booking-App, https://github.com/mohammad-oghli/CLI-Booking-App, "", "", 2022-10-01 14:18:28 +0000 UTC
2, spk, https://github.com/dhn/spk, "spk aka spritzgebaeck: A small OSINT/Recon tool to find CIDRs that belong to a specific organization.", "asn,bugbounty,cidr,golang,osint,recon,reconnaissance", 2022-10-02 10:20:01 +0000 UTC
2, hexutils, https://github.com/denysvitali/hexutils, "A small collection of hex / binary analysis utilities", "", 2022-09-27 22:53:33 +0000 UTC
2, natschannel.go, https://github.com/41north/natschannel.go, "An implementation of a Jrpc2 Channel using NATS as the transport", "", 2022-09-29 10:58:43 +0000 UTC
2, json-iterator, https://github.com/nilesh-akhade/json-iterator, "Low level iterator on the records inside large JSON file.", "", 2022-09-27 13:57:01 +0000 UTC
2, go-api-todos, https://github.com/thisWandiPratama/go-api-todos, "unutk kelas lanjutan react native", "", 2022-09-28 23:52:52 +0000 UTC
2, FluidSimASCII, https://github.com/SimonWaldherr/FluidSimASCII, "", "", 2022-09-30 10:55:57 +0000 UTC
2, Manifacturing_Tracking_System, https://github.com/yusufyilmazf/Manifacturing_Tracking_System, "", "", 2022-09-29 07:38:44 +0000 UTC
2, password-generator, https://github.com/Bisns/password-generator, "随机密码生成  Random Password Generator", "fyne,generator,password,password-generator", 2022-09-29 04:05:35 +0000 UTC
2, portto-assignment, https://github.com/std95174/portto-assignment, "Portto Backend 作業題 2022", "", 2022-09-29 09:02:52 +0000 UTC
2, go-phigros-b19, https://github.com/Jiang-Red/go-phigros-b19, "go实现的phigros b19成绩图生成", "", 2022-10-02 08:55:57 +0000 UTC
2, ex-quotation, https://github.com/chienkuochan/ex-quotation, "", "", 2022-09-28 09:45:34 +0000 UTC
2, bluebell, https://github.com/15288455167/bluebell, " Forum blog based on vue+gin+mysql+redis", "", 2022-09-30 08:23:05 +0000 UTC
2, wxclient, https://github.com/yexk/wxclient, "wechat client sdk", "", 2022-09-27 03:40:11 +0000 UTC
2, fswatch-command, https://github.com/BrevyHQ/fswatch-command, "Watches for changes to multiple files and executes bound commands", "", 2022-09-28 13:33:35 +0000 UTC
2, forum, https://github.com/Rshezarr/forum, "Simple Forum where you can create posts, write comments and like or dislike posts", "01-edu,alem-school,golang-application,tailwindcss", 2022-09-27 00:36:20 +0000 UTC
1, little-stars-server, https://github.com/better-world-labs/little-stars-server, "", "", 2022-09-27 11:20:59 +0000 UTC
1, go-timewheel, https://github.com/soulfriend216/go-timewheel, "golang timewheel similar to glang std timer", "", 2022-09-30 16:53:08 +0000 UTC
1, websocket-demo, https://github.com/sniperwzq/websocket-demo, "websocket demo", "", 2022-09-28 07:54:28 +0000 UTC
1, go-ngx-config, https://github.com/adityals/go-ngx-config, "Nginx Configuration with Go", "", 2022-09-27 05:13:07 +0000 UTC
1, protohackers, https://github.com/STollenaar/protohackers, "Repo for the protohackers", "", 2022-09-29 23:31:26 +0000 UTC
1, golang-notificator, https://github.com/arhone/golang-notificator, "Сервис для пересылки событий в мессенджеры", "", 2022-09-30 13:41:51 +0000 UTC
1, queries, https://github.com/user0608/queries, "", "", 2022-09-30 13:31:58 +0000 UTC
1, mom, https://github.com/Alliance-Software-Suite/mom, "Monetary Operation Manager", "", 2022-09-28 15:24:49 +0000 UTC
1, go-wire-core, https://github.com/Becklyn/go-wire-core, "⚙️ Core module shared across our go projects", "", 2022-09-28 14:37:49 +0000 UTC
1, MessageSecure, https://github.com/alexohneander/MessageSecure, "Full OpenSource privnote clone. Messages are encrypted with PGP on the client side and are never stored or transmitted unencrypted.", "golang,messaging,opsec,privacy,security-tools", 2022-09-27 07:06:32 +0000 UTC
1, authlete-echo-prototype, https://github.com/tohshi/authlete-echo-prototype, "", "", 2022-09-29 12:13:48 +0000 UTC
1, sql-api, https://github.com/espeletia/sql-api, "", "", 2022-10-01 06:18:31 +0000 UTC
1, gohn, https://github.com/alexferrari88/gohn, "tiny wrapper for the Hacker News API for Go", "api,go,golang,golang-library,hacker-news", 2022-10-01 06:29:08 +0000 UTC
1, gematriya, https://github.com/hebcal/gematriya, "Simple Go implementation of gematriya, a system of writing numbers as Hebrew letters", "", 2022-09-28 02:38:40 +0000 UTC
1, jsoniterpb, https://github.com/molon/jsoniterpb, "Replacement of Protojson over Jsoniter Extension", "", 2022-09-28 05:58:25 +0000 UTC
1, go-image, https://github.com/thibault-cne/go-image, "", "", 2022-09-27 07:44:34 +0000 UTC
1, logzer, https://github.com/ArvarohFX/logzer, "", "", 2022-09-27 14:23:44 +0000 UTC
1, easyconfig, https://github.com/night-codes/easyconfig, "Multi-source configuration loading library in Go", "", 2022-09-29 07:48:11 +0000 UTC
