1676, gokart, https://github.com/praetorian-inc/gokart, "A static analysis tool for securing Go code", "golang,security,security-tools,static-analysis,static-code-analysis", 2021-08-16 17:50:56 +0000 UTC
1216, exatorrent, https://github.com/varbhat/exatorrent, "Self-hostable , easy-to-use , lightweight and feature-rich torrent client written in Go . It comes with beautiful Web UI and Optional Multi-User Support . Run Locally or Host in Server . Open/Download/Stream Torrents in Browser Right Away! ", "bittorrent,bittorrent-client,cloud,go,golang,qbittorrent,self-hosted,svelte,torrent,transmission,typescript", 2021-08-25 13:02:37 +0000 UTC
1168, api-server, https://github.com/openscrm/api-server, "OpenSCRM是一套基于Go和React的超高质量企业微信私域流量管理系统 。企业微信、私域流量、SCRM、CRM、Golang、React、企业微信SDK", "antd,go,golang,openscrm,react,scrm,wechat,wecom,weixin,wework", 2021-08-24 10:10:28 +0000 UTC
934, viddy, https://github.com/sachaos/viddy, "👀 A modern watch command. Time machine and pager etc.", "cli,golang,terminal,tui,watch", 2021-08-14 06:40:12 +0000 UTC
642, termdbms, https://github.com/mathaou/termdbms, "A TUI for viewing and editing database files.", "database,terminal,tui", 2021-09-02 14:42:17 +0000 UTC
464, dnstake, https://github.com/pwnesia/dnstake, "DNSTake — A fast tool to check missing hosted DNS zones that can lead to subdomain takeover", "dns,go,golang,nameserver,subdomain,takeover,vulnerability", 2021-08-24 11:22:15 +0000 UTC
222, kobowriter, https://github.com/olup/kobowriter, "A simple typewriter written in go for KOBO e-readers", "eink,fbink,kobo,typewriter", 2021-08-22 19:36:03 +0000 UTC
166, gitty, https://github.com/muesli/gitty, "Contextual information about your git projects, right on the command-line", "cli,git,github,terminal,tui", 2021-08-23 21:21:37 +0000 UTC
162, regit-go, https://github.com/WithGJR/regit-go, "ReGit: A Tiny Git-Compatible Git Implementation", "", 2021-08-15 04:06:56 +0000 UTC
151, Gososerial, https://github.com/EmYiQing/Gososerial, "Dynamically Generates Ysoserial's Payload by Golang", "deserialization,gadget,java-deserialization,pentesting,pentesting-tools,vulnerability,ysoserial", 2021-08-27 05:36:44 +0000 UTC
130, base64, https://github.com/cristalhq/base64, "Faster base64 encoding for Go", "base64,base64-decoding,base64-encoding,decoding,encoding,go,golang", 2021-08-15 06:57:09 +0000 UTC
114, carina, https://github.com/carina-io/carina, "Carina: an high performance and ops-free local storage for kubernetes", "autotiering,csi,high-performance,kubernetes,local,lvm,opsfree,storage", 2021-08-18 10:41:10 +0000 UTC
94, xlibp2p, https://github.com/xfs-network/xlibp2p, "A modular is an opinionated, easy-to-use P2P network  stack for decentralized applications written in Go.", "", 2021-09-01 11:26:27 +0000 UTC
92, sillyGirl, https://github.com/cdle/sillyGirl, "傻妞机器人", "", 2021-08-30 10:13:32 +0000 UTC
88, goblin, https://github.com/xiecat/goblin, "一款适用于红蓝对抗中的蜜罐和钓鱼系统", "goblin,honeypots,phishing", 2021-09-06 07:11:53 +0000 UTC
80, rsync, https://github.com/gokrazy/rsync, "gokrazy rsync", "daemon,golang,network,rsync,server", 2021-08-22 16:47:40 +0000 UTC
78, toolkit-for-cardano, https://github.com/SundaeSwap-finance/toolkit-for-cardano, "Tools to help teams develop smart contracts on the Cardano blockchain", "", 2021-08-23 20:56:55 +0000 UTC
77, ZheTian, https://github.com/yqcs/ZheTian, " ZheTian 免杀shellcode执行程序", "", 2021-08-24 09:16:18 +0000 UTC
68, expr, https://github.com/robpike/expr, "A simple evaluator for arithmetic integer expressions.", "", 2021-08-31 04:37:42 +0000 UTC
66, gsql, https://github.com/auula/gsql, "GSQL is a structured query language code builder for golang.", "builder,code,d-s-l,dsl,dsl-sql-go,dsl-syntax,genreate,golang,languages,query-language,sql,structured-data", 2021-09-02 12:22:45 +0000 UTC
64, eget, https://github.com/zyedidia/eget, "Easily install prebuilt binaries from GitHub.", "command-line-tool,go,golang,installer,prebuilt-binaries", 2021-08-17 04:09:38 +0000 UTC
64, zauth, https://github.com/grijul/zauth, "2FA (Two-Factor Authentication) application for CLI terminal with support to import/export andOTP files.", "2fa,2fa-client,2fa-security,cli,golang,golang-application,linux,security,security-tools,zauth", 2021-08-15 19:53:17 +0000 UTC
57, hajimari, https://github.com/toboshii/hajimari, "Hajimari is a beautiful & customizable browser startpage/dashboard with Kubernetes application discovery.", "dashboard,kubernetes,startpage", 2021-08-14 20:35:53 +0000 UTC
57, XiuScan, https://github.com/EmYiQing/XiuScan, "Super Java Vulnerability Scanner", "java-security,pentesting-tools,vulnerability-scanners", 2021-08-23 15:19:24 +0000 UTC
56, ConfigFind, https://github.com/pureqh/ConfigFind, "用于在网站文件中快速查找数据库配置文件", "", 2021-08-26 07:50:00 +0000 UTC
49, simple-matchmaking, https://github.com/fatihkahveci/simple-matchmaking, "Simple rule based matchmaking for your online game with support of Redcon(RESP) protocol.", "gaming,gaming-software,go,golang,matchmaking,resp", 2021-09-02 17:43:25 +0000 UTC
47, Suscan, https://github.com/tangxiaofeng7/Suscan, "外网资产扫描平台", "", 2021-08-16 07:59:38 +0000 UTC
47, lls, https://github.com/catatsuy/lls, "you can get a list of files in a directory that contains a large number of files", "", 2021-08-28 06:27:23 +0000 UTC
45, fss3, https://github.com/aymanbagabas/fss3, "FSS3 is an S3 filesystem abstraction layer for Golang", "aws,aws-s3,go,golang,minio,minio-client,s3", 2021-08-20 20:40:55 +0000 UTC
45, super-dollop, https://github.com/jack5341/super-dollop, "Encrypt your files or notes by your GPG key and save to MinIO or Amazon S3 easily!", "amazon-s3,cobra,golang,gpg,minio-server", 2021-09-01 19:08:07 +0000 UTC
44, pqssh, https://github.com/mattn/pqssh, "", "", 2021-08-16 14:18:47 +0000 UTC
43, httpreq, https://github.com/binalyze/httpreq, "httpreq is an http request library written with golang to make requests easily and handle responses gracefully.", "", 2021-09-02 08:58:40 +0000 UTC
40, dby, https://github.com/ulfox/dby, "Simple Yaml DB", "database,db,go,golang,yaml", 2021-08-23 11:25:39 +0000 UTC
39, vim-treesitter, https://github.com/mattn/vim-treesitter, "", "treesitter", 2021-08-26 05:48:10 +0000 UTC
36, SagerConnect, https://github.com/SagerNet/SagerConnect, "Connect to SagerNet in the LAN", "", 2021-08-17 15:42:33 +0000 UTC
36, jd_cookie, https://github.com/ufuckee/jd_cookie, "Third party extension interface for sillyGirl.", "", 2021-09-09 12:39:49 +0000 UTC
36, helper, https://github.com/golangtoolkit/helper, "golang工具/助手函数包", "go,golang,helper,util", 2021-08-31 09:32:21 +0000 UTC
35, kube-scheduler-simulator, https://github.com/kubernetes-sigs/kube-scheduler-simulator, "A web-based simulator for the Kubernetes scheduler", "k8s-sig-scheduling", 2021-08-17 20:02:46 +0000 UTC
35, greeden-geth, https://github.com/CodeForcer/greeden-geth, "Geth client which picks the most profitable blocks to mine using a greedy algorithm", "", 2021-08-29 18:22:39 +0000 UTC
34, entviz, https://github.com/hedwigz/entviz, "entviz is an ent extension that provides visualization of the schema graph", "ent,entviz,golang", 2021-08-16 08:48:51 +0000 UTC
33, CuiRi, https://github.com/NyDubh3/CuiRi, "一款红队专用免杀木马生成器，基于shellcode生成绕过所有杀软的木马。", "bypass-antivirus,cobaltstrike,golang,metasploit,redteam", 2021-09-07 15:07:36 +0000 UTC
30, percpu, https://github.com/cespare/percpu, "Best-effort CPU-local sharded values for Go", "", 2021-09-04 19:54:06 +0000 UTC
29, riscv-emulator, https://github.com/racerxdl/riscv-emulator, "Golang RISC-V emulator that can play DOOM", "", 2021-09-05 19:51:32 +0000 UTC
29, gosq, https://github.com/sanggonlee/gosq, "Simplicity-focused, template based SQL query builder", "", 2021-08-21 15:14:55 +0000 UTC
29, ddd-go, https://github.com/percybolmer/ddd-go, "", "", 2021-08-30 08:21:09 +0000 UTC
27, verpi, https://github.com/gleich/verpi, "🚥 See the status of your vercel deployments on the pimoroni blinkt!", "", 2021-09-03 17:51:47 +0000 UTC
24, logger, https://github.com/binalyze/logger, "Binalyze logger is an easily customizable wrapper for logrus with log rotation", "golang,golang-library,golang-package,log,logger,logging,logrus", 2021-09-03 11:20:27 +0000 UTC
23, rudolph, https://github.com/airbnb/rudolph, "A serverless sync server for Santa, built on AWS", "", 2021-08-26 20:23:03 +0000 UTC
23, grpctl, https://github.com/joshcarp/grpctl, "Like grpcurl and cobra had a baby", "", 2021-08-29 05:32:01 +0000 UTC
23, ztrace, https://github.com/zartbot/ztrace, "Traceroute in Go", "", 2021-08-16 07:58:39 +0000 UTC
21, ngamux, https://github.com/ngamux/ngamux, "Simple HTTP router for Go", "go,http", 2021-08-22 08:31:40 +0000 UTC
21, ssh-honeypot-go, https://github.com/Ex0dIa-dev/ssh-honeypot-go, "A Simple SSH Honeypot in Go", "", 2021-09-03 13:54:13 +0000 UTC
21, AVBypass, https://github.com/kira2040k/AVBypass, "golang script for bypass AV and work only in windows platform", "", 2021-08-18 20:20:01 +0000 UTC
20, analytics, https://github.com/KetanIP/analytics, "A simple and privacy focused analytics tool written in go. ", "analytics,golang,google-analytics,javascript,metrics,privacy,privacy-friendly", 2021-09-01 12:05:24 +0000 UTC
20, netflix-all-verify, https://github.com/Quzard/netflix-all-verify, "NetFlix批量检测", "", 2021-08-22 03:14:29 +0000 UTC
20, go-steamworks, https://github.com/hajimehoshi/go-steamworks, "A Steamworks SDK binding for Go", "", 2021-08-28 15:25:34 +0000 UTC
20, slotchmod, https://github.com/jiro4989/slotchmod, "slotchmod changes file permission with a slot.", "chmod,cli,go,joke,permissions,tool", 2021-09-05 07:15:18 +0000 UTC
20, sg, https://github.com/sourcegraph/sg, "sg - the Sourcegraph developer tool", "", 2021-09-10 16:00:36 +0000 UTC
20, OK, https://github.com/jesseduffield/OK, "Welcome to the future of programming languages: OK?", "", 2021-08-15 08:20:26 +0000 UTC
19, verlet, https://github.com/polldo/verlet, "build and animate objects according to verlet physics. pure golang library", "animation,games,go,golang,physics", 2021-09-02 16:57:07 +0000 UTC
19, CVE-2021-26084, https://github.com/tangxiaofeng7/CVE-2021-26084, "批量检测", "", 2021-09-01 12:36:52 +0000 UTC
19, goelftools, https://github.com/hnts/goelftools, "Library for parsing ELF files written in pure Go.", "elf,elf-parser,go,go-library,golang,pwn", 2021-08-14 02:38:06 +0000 UTC
19, zach-rock, https://github.com/Zach-Lu/zach-rock, "内网穿透，编译只需 1 秒，部署 1 分钟。", "", 2021-08-21 09:29:27 +0000 UTC
18, superr, https://github.com/goware/superr, "SupErr -- Go stdlib errors with super powers", "", 2021-08-27 11:22:19 +0000 UTC
17, hakcsp, https://github.com/hakluke/hakcsp, "Return domains in CSP headers in http response", "", 2021-08-17 06:39:26 +0000 UTC
17, timea.go, https://github.com/caarlos0/timea.go, "timea.go (did you see what I did there?) is a simple library to print given times in \"time ago\" manner.", "golang,golang-library,time", 2021-08-14 23:22:39 +0000 UTC
17, graphql-parser-bench, https://github.com/StarpTech/graphql-parser-bench, "GraphQL parser comparison in different languages", "", 2021-08-14 16:40:37 +0000 UTC
17, linear_ac, https://github.com/crazybie/linear_ac, "Speed up the memory allocation and improve the garbage collection performance.", "allocator,custom-allocator,gc,memory-allocation", 2021-08-18 09:54:00 +0000 UTC
17, tvgo, https://github.com/mattn/tvgo, "", "", 2021-09-06 07:44:23 +0000 UTC
16, govarnam, https://github.com/varnamproject/govarnam, "Easily Type Indian Languages on computer and mobile. GoVarnam is a cross-platform transliteration library. Manglish -> Malayalam, Thanglish -> Tamil, Hinglish -> Hindi plus another 10 languages. GoVarnam is a near-Go port of libvarnam", "ime,input-method,keyboard,language,malayalam,transliteration", 2021-08-17 18:21:04 +0000 UTC
16, mac-cleanup, https://github.com/mac-cleanup/mac-cleanup, "🗑️ Cleanup script for macOS", "cli,golang,mac-cleanup,macos", 2021-08-17 17:25:07 +0000 UTC
16, pengdu_helper, https://github.com/yihong0618/pengdu_helper, "网易云歌词自动生成《捧读》用的 epub, 帮助学习。（GitHub Actions + shortcuts + telegram）", "", 2021-09-09 08:56:12 +0000 UTC
16, MultipleRarity, https://github.com/onemedicine/MultipleRarity, "After approve this contract, you can use the contract to adventure with multiple characters at the same time", "", 2021-09-08 08:25:37 +0000 UTC
15, ghcri, https://github.com/ghcri/ghcri, "ghcr images - Fetched from docker-library", "", 2021-08-30 04:29:04 +0000 UTC
15, nano-gpu-scheduler, https://github.com/nano-gpu/nano-gpu-scheduler, "nano-gpu-scheduler is a Kubernetes scheduler extender for GPU resources scheduling.", "", 2021-08-24 04:49:13 +0000 UTC
14, go-cloud-native-patterns, https://github.com/zeihanaulia/go-cloud-native-patterns, "Example patterns for distributed service", "", 2021-08-23 03:44:47 +0000 UTC
14, clean-swift-scaffold, https://github.com/GeekTree0101/clean-swift-scaffold, "Clean-Swift source and test code auto-generator. It can save you time typing 500-600 lines of code.", "cleanswift,ios,swift,template", 2021-08-14 13:00:53 +0000 UTC
14, dash, https://github.com/cnych/dash, "", "", 2021-09-06 03:54:27 +0000 UTC
14, linkedlist.go, https://github.com/1995parham/linkedlist.go, "The first generic linked list in go :dancer:", "generics,go,golang", 2021-08-22 20:09:17 +0000 UTC
14, zc_core, https://github.com/zurichat/zc_core, "", "", 2021-08-19 11:29:25 +0000 UTC
13, belajar-golang-restful-api, https://github.com/ProgrammerZamanNow/belajar-golang-restful-api, "Belajar Go-Lang RESTful API", "", 2021-08-19 11:47:09 +0000 UTC
13, tprox, https://github.com/ethicalhackingplayground/tprox, "TProx is a fast reverse proxy path traversal detector and directory bruteforcer.", "hacking,misconfigurations,pentesting,proxy,vulnerabilities", 2021-08-30 03:52:02 +0000 UTC
13, i18n, https://github.com/go-i18n/i18n, "Package i18n provides internationalization and localization for your Go applications", "cldr,go,i18n,internationalization,l10n,localization,lsif-enabled,pluralization", 2021-09-01 16:23:04 +0000 UTC
13, rpcxlite, https://github.com/smallnest/rpcxlite, "a lite version of rpcx", "", 2021-09-06 01:57:04 +0000 UTC
12, depsy, https://github.com/arashrasoulzadeh/depsy, "Deployment made easy", "", 2021-08-14 14:59:25 +0000 UTC
12, opti, https://github.com/protolambda/opti, "Minimalist optimistic rollup tech", "", 2021-08-15 14:38:05 +0000 UTC
12, Rosefintech-RosL2-Bridge, https://github.com/Rosefintech/Rosefintech-RosL2-Bridge, "Zero-knowledge-proof verification bridge", "bridge,rosefintech,rosl2,validation,zero-knowledge-proofs", 2021-08-16 02:03:32 +0000 UTC
12, kunnel, https://github.com/zryfish/kunnel, "Expose kubernetes service publicly without an LoadBalancer ", "", 2021-09-01 10:14:12 +0000 UTC
12, v2ray-go, https://github.com/Shadowsocks-NET/v2ray-go, "An opinionated clean fork of v2fly/v2ray-core", "", 2021-09-03 10:25:55 +0000 UTC
12, Doge-HeapAlloc, https://github.com/timwhitez/Doge-HeapAlloc, "", "", 2021-09-02 08:26:39 +0000 UTC
12, xdd, https://github.com/xiaeroc/xdd, "", "", 2021-09-04 08:52:05 +0000 UTC
11, AddressOfEntryPoint-injection, https://github.com/timwhitez/AddressOfEntryPoint-injection, "x64 version", "", 2021-09-06 02:13:02 +0000 UTC
11, lyric, https://github.com/liamg/lyric, ":musical_note: Song lyrics in your terminal via Genius ", "", 2021-09-03 18:55:24 +0000 UTC
11, parallel, https://github.com/qbhy/parallel, "", "", 2021-08-17 09:05:14 +0000 UTC
11, fbstatus, https://github.com/gokrazy/fbstatus, "fbstatus graphically shows the gokrazy system status on the Linux frame buffer, which is typically available via HDMI when running on a Raspberry Pi or a PC.", "", 2021-08-29 22:05:59 +0000 UTC
11, yamlfmt, https://github.com/UltiRequiem/yamlfmt, "📝  Easily format yaml files on terminal or your editor", "cli,formatter,go,go-formatter,golang,golang-application,yaml", 2021-09-07 01:03:35 +0000 UTC
11, validator, https://github.com/flamego/validator, "💯 Go Struct and Field validation, including Cross Field, Cross Struct, Map, Slice and Array diving", "go,lsif-enabled,validation", 2021-08-20 17:31:07 +0000 UTC
11, webfr, https://github.com/krishpranav/webfr, "A powerful go web framework for highly scalable and resource efficient web application", "cplusplus,cross-platform,framework,go,go-framework,go-library,golang,linux,macos,microservices,unix,webframework,webserver,windows", 2021-08-22 07:10:03 +0000 UTC
11, cloudflare-ip-updater, https://github.com/theaj/cloudflare-ip-updater, "A simple tool to detect WAN IP changes and updates your cloudflare DNS entries.", "", 2021-08-25 01:04:09 +0000 UTC
11, golang-rest-api-with-mysql, https://github.com/Kivanc10/golang-rest-api-with-mysql, "A Go rest API project that is following solid and common principles and is connected to local MySQL database.", "", 2021-08-20 16:34:50 +0000 UTC
