2525, lima, https://github.com/AkihiroSuda/lima, "Linux virtual machines, on macOS (aka \"Linux-on-Mac\", \"macOS subsystem for Linux\", \"containerd for Mac\", unofficially)", "macos,vm,qemu,containerd", 2021-05-14 07:30:56 +0000 UTC
1410, easegress, https://github.com/megaease/easegress, "An all-rounder traffic orchestration system", "go,golang,http,api-gateway,raft,gateway,proxy-server,traffic,load-balancer,etcd,reverse-proxy,mesh,cloud-native,sidecar", 2021-05-28 03:02:42 +0000 UTC
1336, lotus, https://github.com/WorldDbs/lotus, "", "", 2021-05-17 00:58:10 +0000 UTC
936, gotty, https://github.com/sorenisanerd/gotty, "Share your terminal as a web application", "", 2021-04-09 18:50:56 +0000 UTC
932, InScan, https://github.com/inbug-team/InScan, "边界打点后的自动化渗透工具", "", 2021-04-10 09:21:39 +0000 UTC
799, ninjabot, https://github.com/rodrigo-brito/ninjabot, "A fast cryptocurrency trading bot implemented in Go", "go,bot,trading-bot,cryptocurrency,binance", 2021-04-24 14:07:55 +0000 UTC
712, MutiraoDevOps, https://github.com/badtuxx/MutiraoDevOps, "", "", 2021-05-15 20:36:48 +0000 UTC
485, go-sqldb, https://github.com/auxten/go-sqldb, "A pure golang SQL database for database theory research", "", 2021-04-10 12:56:50 +0000 UTC
440, specs-actors, https://github.com/WorldDbs/specs-actors, "", "", 2021-05-17 00:58:33 +0000 UTC
410, mangadesk, https://github.com/darylhjd/mangadesk, "Terminal client for MangaDex 📖", "go,api,cli,golang,client,downloader,terminal,manga,api-client,tui,terminal-based,terminal-app,manga-downloader,mangadownloader,tview,mangadex", 2021-05-09 15:38:31 +0000 UTC
344, pingme, https://github.com/kha7iq/pingme, "PingMe is a CLI tool which provides the ability to send messages or alerts to multiple messaging platforms & email.", "slack,cli,alert,telegram,line,email,discord,messaging,pushover,pushbullet,mastodon,mattermost,rocketchat,microsoft-teams,twillio,twillo,pingme", 2021-04-13 13:49:32 +0000 UTC
329, sealer, https://github.com/alibaba/sealer, "Build share and run your distributed applications.", "docker,kubernetes,golang,installer,cloudimage", 2021-04-29 03:13:48 +0000 UTC
251, timetrace, https://github.com/dominikbraun/timetrace, "Simple time tracking CLI", "cli,time-tracker,timetracker,time-tracking,timetracking", 2021-05-11 19:17:24 +0000 UTC
246, vulndb, https://github.com/golang/vulndb, "[mirror] The Go Vulnerability Database", "", 2021-04-16 11:56:49 +0000 UTC
199, vtprotobuf, https://github.com/planetscale/vtprotobuf, "A Protocol Buffers compiler that generates optimized marshaling & unmarshaling Go code for ProtoBuf APIv2", "go,protobuf,grpc,codegen,vitess", 2021-05-14 17:02:54 +0000 UTC
187, Dent, https://github.com/optiv/Dent, "A framework for creating COM-based bypasses utilizing vulnerabilities in Microsoft's WDAPT sensors.  ", "", 2021-05-03 14:00:29 +0000 UTC
177, iam, https://github.com/marmotedu/iam, "极客时间《Go 语言项目开发实战》教学项目", "", 2021-05-26 05:06:46 +0000 UTC
175, zadig, https://github.com/koderover/zadig, "Zadig is a cloud native, distributed, developer-oriented continuous delivery product.", "devops,continuous-delivery,cloud-native,cicd,zadig,engineering-productivity", 2021-05-12 15:31:02 +0000 UTC
173, page-fetch, https://github.com/detectify/page-fetch, "Fetch web pages using headless Chrome, storing all fetched resources including JavaScript files. Run arbitrary JavaScript on many web pages and see the returned values", "", 2021-06-03 14:51:59 +0000 UTC
171, notionapi, https://github.com/jomei/notionapi, "A Notion API SDK, written in Golang", "go,golang,notion,notion-api", 2021-05-23 13:42:46 +0000 UTC
169, kubegres, https://github.com/reactive-tech/kubegres, "Kubegres is a Kubernetes operator allowing to create a cluster of PostgreSql instances and manage databases replication, failover and backup.", "", 2021-04-12 20:51:59 +0000 UTC
167, go-notion, https://github.com/dstotijn/go-notion, "Go client for the Notion API.", "go,golang,client,notion,notion-api", 2021-05-13 20:09:09 +0000 UTC
161, gronx, https://github.com/adhocore/gronx, "Lightweight, fast and dependency-free Cron expression parser (due checker), task scheduler and/or daemon for Golang (tested on v1.13 and above) and standalone usage", "go,golang,parser,crontab,daemon,scheduler,parser-library,job-scheduler,cron-expression,cronjob,task-manager,task-scheduler,cron-parser,cron-expression-parser,job-manager,cron-pattern,adhocore", 2021-04-21 06:14:03 +0000 UTC
155, core, https://github.com/bitclout/core, "BitClout core node", "bitclout", 2021-05-18 15:12:24 +0000 UTC
141, tstorage, https://github.com/nakabonne/tstorage, "A fast time-series data storage library", "golang,time-series,metrics,golang-library,time-series-database", 2021-05-14 04:40:29 +0000 UTC
141, hammond, https://github.com/akhilrex/hammond, "Self hosted vehicle and expense management system. Like Clarkson, but better", "", 2021-05-29 09:50:08 +0000 UTC
137, pint, https://github.com/cloudflare/pint, "Prometheus rule linter", "prometheus", 2021-04-23 02:02:50 +0000 UTC
133, koala, https://github.com/heiyeluren/koala, "koala通用频率控制系统，一个应对所有频次控制高度配置化的通用反作弊系统（规则引擎），高性能可扩展。 (the require golang >= 1.0)", "", 2021-05-18 17:06:01 +0000 UTC
131, slides, https://github.com/maaslalani/slides, "Terminal based presentation tool", "", 2021-05-05 23:13:42 +0000 UTC
130, authority, https://github.com/harranali/authority, "Role Based Access Control (RBAC) with database persistence ", "", 2021-05-11 17:07:33 +0000 UTC
130, chanx, https://github.com/smallnest/chanx, "unbounded chan", "", 2021-05-10 09:35:20 +0000 UTC
129, cocert, https://github.com/Dentrax/cocert, "Split and distribute your private keys securely amongst untrusted network", "split,secret-management,shamir,shamir-secret-sharing,public-private-key,tuf,supply-chain-attacks", 2021-05-09 20:08:01 +0000 UTC
125, go-snowflake, https://github.com/godruoyi/go-snowflake, "❄ An Lock Free ID Generator for Golang based on Snowflake Algorithm (Twitter announced).", "snowflake,go-snowflake", 2021-04-15 03:05:28 +0000 UTC
125, squirrelbyte, https://github.com/adamlouis/squirrelbyte, "a tool for gathering & exploring data", "", 2021-04-10 20:51:50 +0000 UTC
118, crank4go, https://github.com/torchcc/crank4go, "API Gateway implemented in Golang", "microservice,api-gateway,websockets,reverse-proxy,internal-network,reverse,service-registration,dmz", 2021-05-20 13:34:21 +0000 UTC
118, go-fsimpl, https://github.com/hairyhenderson/go-fsimpl, "Go filesystem implementations for various URL schemes", "", 2021-04-13 16:15:36 +0000 UTC
118, beer-shop, https://github.com/go-kratos/beer-shop, "An online shop application, the complete microservices demo for kratos.", "", 2021-04-11 03:10:46 +0000 UTC
117, terraform-provider-factorio, https://github.com/efokschaner/terraform-provider-factorio, "The Terraform Provider for Factorio", "golang,lua,terraform,rcon,factorio,terraform-provider,rcon-client", 2021-05-09 03:26:21 +0000 UTC
117, plotng, https://github.com/maded2/plotng, "PlotNG - plotting utility for Chia.Net", "", 2021-04-11 03:08:35 +0000 UTC
115, datree, https://github.com/datreeio/datree, "Prevent Kubernetes misconfigurations from reaching production (again 😤 )! Datree is a CLI tool to ensure K8s manifests and Helm charts follow best practices as well as your organization’s policies. See our docs: https://hub.datree.io", "kubernetes,cli,static-code-analysis,best-practices,policy,infrastructure-management,guardrail,datree", 2021-04-14 11:44:56 +0000 UTC
113, echo-admin, https://github.com/RealLiuSha/echo-admin, "基于 Echo + Gorm + Casbin + Uber-FX 实现的 RBAC 权限管理脚手架，致力于提供一套尽可能轻量且优雅的中后台解决方案。", "go,golang,admin,zap,rbac,gorm,fx,echo-framework,casbin,echo-admin", 2021-04-28 08:50:13 +0000 UTC
112, gidevice, https://github.com/electricbubble/gidevice, "communicate with iOS devices implemented with Golang", "golang,ios,xcode,iphone,xctest,golang-library,libimobiledevice,usbmuxd,gomod,gomodule", 2021-04-14 02:01:54 +0000 UTC
111, tmplfunc, https://github.com/rsc/tmplfunc, "Go templates invoked as functions", "", 2021-05-06 13:43:32 +0000 UTC
109, ascii-image-converter, https://github.com/TheZoraiz/ascii-image-converter, "A cross-platform command-line tool to convert and save images into ascii art and print them on the console. Supports JPEG, PNG, BMP, WEBP and TIFF image formats. Available on snap.", "windows,linux,golang,snap,cross-platform,command-line,ascii,image-processing,ascii-art,command-line-tool,terminal-app,image-to-ascii,ascii-image,converts-images,ascii-image-converter", 2021-05-11 13:47:22 +0000 UTC
108, hjem, https://github.com/tpanum/hjem, "Tool to support the estimation for true sales prices for Danish properties.", "", 2021-05-12 13:48:31 +0000 UTC
107, shortlink, https://github.com/go-awesome/shortlink, "High-Performance Shortlink ( Short URL ) app creator in Golang. For privacy reasons, you may prefer to host your own short URL app and this is the one to use.", "golang,golang-library,shortlink,golang-package,golang-examples,shortlinks,golang-application", 2021-05-19 18:27:28 +0000 UTC
107, iamzero, https://github.com/common-fate/iamzero, "Identity & Access Management simplified and secure.", "aws,security,cloud,iam,security-tools,cloud-security", 2021-05-13 07:41:19 +0000 UTC
105, nutshell, https://github.com/hisunwei/nutshell, "", "", 2021-04-27 11:32:08 +0000 UTC
103, OliveTin, https://github.com/jamesread/OliveTin, "OliveTin is a web interface for running Linux shell commands.", "linux,selfhosted,sysadmin,homeautomation,grpc-api", 2021-05-07 16:57:44 +0000 UTC
101, Clash.Mini, https://github.com/Clash-Mini/Clash.Mini, "Clash.Mini", "", 2021-05-18 09:16:37 +0000 UTC
98, rconn, https://github.com/jafarlihi/rconn, "rconn is a multiplatform program for creating generic reverse connections. Lets you consume services that are behind firewall or NAT without opening ports or port-forwarding.", "reverse-shell,reverse-proxy,reverse,port-forwarding,network-address-translation,firewall-bypass,port-forward,reverse-connection", 2021-04-10 20:44:37 +0000 UTC
97, p2ptunnel, https://github.com/chenjia404/p2ptunnel, "一个基于p2p的tcp、udp内网穿透隧道工具", "", 2021-04-14 13:24:37 +0000 UTC
97, go-sqlmap, https://github.com/EmYiQing/go-sqlmap, "Simple Sqlmap Written By Golang", "sql-injection,web-security,sqlmap,pentest-tool", 2021-05-13 13:04:31 +0000 UTC
96, htui, https://github.com/PierreKieffer/htui, "Heroku Terminal User Interface", "heroku,terminal-based", 2021-04-11 09:18:42 +0000 UTC
96, chrono, https://github.com/procyon-projects/chrono, "Chrono is a scheduler library that lets you run your task and code periodically", "go,golang,cron,scheduler,golang-library,schedule-task,scheduler-library,chrono", 2021-05-14 15:27:30 +0000 UTC
92, translator, https://github.com/SpecializedGeneralist/translator, "A simple self-hostable Machine Translation service, powered by spaGO", "", 2021-04-21 16:37:36 +0000 UTC
84, aws-enumerator, https://github.com/shabarkin/aws-enumerator, "The AWS Enumerator was created for service enumeration and info dumping for investigations of penetration testers during Black-Box testing. The tool is intended to speed up the process of Cloud review in case the security researcher compromised AWS Account Credentials.", "aws,security,security-audit,cloud,hacking,security-tools", 2021-04-11 14:49:14 +0000 UTC
83, wiretrustee, https://github.com/wiretrustee/wiretrustee, "Connect your devices into a single private WireGuard®-based mesh network.", "golang,mesh-networks,nat-traversal,vpn,mesh,wireguard,zerotrust,wireguard-vpn,wiretrustee", 2021-04-14 12:27:20 +0000 UTC
83, labor, https://github.com/yisar/labor, "Simple implementation of Web Container", "web-container,stackblitz", 2021-05-24 08:56:53 +0000 UTC
77, sonic, https://github.com/bytedance/sonic, "A blazingly fast JSON serializing & deserializing library", "", 2021-05-25 03:52:51 +0000 UTC
76, go-map-schema, https://github.com/Kangaroux/go-map-schema, "Simple JSON type checking.", "api,golang,json,schema,validation,types", 2021-05-20 04:05:46 +0000 UTC
75, netkat, https://github.com/aojea/netkat, "netcat using netstack userspace library", "", 2021-05-05 19:13:42 +0000 UTC
71, weebsay, https://github.com/irevenko/weebsay, "🎭👄 Like cowsay but it's random anime quote", "go,cli,golang,anime,weeb,cowsay,cli-app,terminal-app,weebdev", 2021-05-07 08:12:18 +0000 UTC
70, go-mod-archiver, https://github.com/tailscale/go-mod-archiver, "go.mod git archiver", "", 2021-05-24 16:43:17 +0000 UTC
69, golang-nextjs-portable, https://github.com/dstotijn/golang-nextjs-portable, "Go program with embedded Next.js app.", "golang,nextjs,embed", 2021-04-26 19:48:36 +0000 UTC
69, k8s-diagrams, https://github.com/Trois-Six/k8s-diagrams, "Create diagrams from the Kubernetes API with go-diagrams.", "kubernetes,diagrams", 2021-04-26 13:44:26 +0000 UTC
68, oslo, https://github.com/OpenSLO/oslo, "CLI tool for the OpenSLO spec", "", 2021-04-30 02:49:54 +0000 UTC
63, goldmark-pdf, https://github.com/stephenafamo/goldmark-pdf, "A PDF renderer for the goldmark markdown parser.", "go,markdown,golang,pdf,commonmark,goldmark,goldmark-extension", 2021-04-20 18:05:22 +0000 UTC
62, awsdtc, https://github.com/c1982/awsdtc, "AWS Data Transfer Cost Explorer", "infrastructure,aws,chart,aws-sdk,cost-optimization,data-transfers", 2021-05-10 23:41:48 +0000 UTC
62, bofied, https://github.com/pojntfx/bofied, "Modern network boot server.", "pxe-boot,ipxe,netboot,network-boot,http-server,dhcp-server,pxe,webdav-server,tftp-server,proxy-dhcp", 2021-04-14 21:43:11 +0000 UTC
62, elcarro-oracle-operator, https://github.com/GoogleCloudPlatform/elcarro-oracle-operator, "El Carro is a new project that offers a way to run Oracle databases in Kubernetes as a portable, open source, community driven, no vendor lock-in container orchestration system. El Carro provides a powerful declarative API for comprehensive and consistent configuration and deployment as well as for real-time operations and monitoring.", "", 2021-05-13 04:46:26 +0000 UTC
62, codename, https://github.com/lucasepe/codename, "Generate random, pronounceable, sometimes even memorable, \"superhero like\" codenames - just like Docker does with container names.", "golang,random,superheroes,names-generator,rfc1178", 2021-05-09 09:15:35 +0000 UTC
62, profile, https://github.com/mmcloughlin/profile, "Simple profiling for Go", "", 2021-04-30 06:22:46 +0000 UTC
60, secrets-store-csi-driver-provider-aws, https://github.com/aws/secrets-store-csi-driver-provider-aws, "", "", 2021-04-14 18:38:10 +0000 UTC
59, covaccine-notifier, https://github.com/PrasadG193/covaccine-notifier, "CoWIN Vaccine availability notifier for India", "notifier,district,india,availability-monitor,email-notification,vaccination,covid-19,vaccine-tracker,vaccine-availability,vaccine-finder,cowin-portal", 2021-05-02 16:49:02 +0000 UTC
58, mk48, https://github.com/SoftbearStudios/mk48, "Mk48.io Ship Combat Game", "game,go,svelte,game-server,ship,boat,combat", 2021-05-08 22:51:27 +0000 UTC
58, didder, https://github.com/makeworld-the-better-one/didder, "An extensive, fast, and accurate command-line image dithering tool.", "command-line,dithering-algorithms,floyd-steinberg,dithering-images,ordered-dithering", 2021-04-29 17:57:07 +0000 UTC
58, templ, https://github.com/a-h/templ, "A language, command line tool and set of IDE extensions that makes it easier to write HTML user interfaces and websites using Go.", "go,language-server,html-elements,ide-support,lsp,templating-languages", 2021-04-10 19:37:28 +0000 UTC
57, protoscan, https://github.com/KathanP19/protoscan, "Prototype Pollution Scanner", "", 2021-04-10 04:11:43 +0000 UTC
55, nats-roundtripper, https://github.com/ripienaar/nats-roundtripper, "", "", 2021-05-15 09:59:14 +0000 UTC
55, limitio, https://github.com/nanmu42/limitio, "Golang io.Reader and io.Writer but with limits", "go,golang,io", 2021-05-25 03:48:22 +0000 UTC
54, fhttp, https://github.com/zMrKrabz/fhttp, "The f stands for flex.", "", 2021-05-15 16:55:42 +0000 UTC
52, lark, https://github.com/go-lark/lark, "An easy-to-use unofficial SDK for Feishu and Lark Open Platform (Messaging API only)", "feishu,larksuite,feishu-sdk,lark-sdk", 2021-04-20 12:09:03 +0000 UTC
52, GodSpeed, https://github.com/redcode-labs/GodSpeed, "Fast and intuitive manager for multiple reverse shells", "golang,reverse-shell,manager", 2021-04-10 20:38:11 +0000 UTC
52, roxy, https://github.com/chronos-tachyon/roxy, "Roxy the Frontend Proxy", "letsencrypt,golang,proxy,grpc,reverse-proxy,autocert,roxy,frontend-proxy,rewrite-headers", 2021-04-11 23:34:46 +0000 UTC
51, mangodl, https://github.com/Gyro7/mangodl, "An easy-to-use cli tool for downloading manga", "go,cli,golang,manga,cli-app,manga-downloader", 2021-05-24 15:48:27 +0000 UTC
47, libbpfgo, https://github.com/aquasecurity/libbpfgo, "eBPF library for Go based on Linux libbpf", "golang,bpf", 2021-05-11 18:25:44 +0000 UTC
47, k8scr, https://github.com/hasheddan/k8scr, "Kubernetes Container Registry", "go,kubernetes,cli,kubectl", 2021-05-29 12:06:43 +0000 UTC
46, goprisma, https://github.com/jensneuse/goprisma, "A Go wrapper for prisma to turn databases into GraphQL APIs using Go.", "graphql,rust,golang,rust-lang,golang-wrapper,rustlang,golang-library,golang-package,prisma,prisma-client,prisma-binding,prisma2", 2021-05-31 08:06:57 +0000 UTC
46, dive-into-chia, https://github.com/chuwt/dive-into-chia, "chia深入研究以及一些工具(WIP)", "blockchain,chia,chia-blockchain", 2021-04-26 03:41:36 +0000 UTC
45, boyermoore, https://github.com/sarpdag/boyermoore, "Implementation of Boyer-Moore fast string search algorithm in Go", "", 2021-04-24 19:29:25 +0000 UTC
43, hotDetect, https://github.com/EarlyZhao/hotDetect, "自动探测热点", "", 2021-04-10 05:39:24 +0000 UTC
42, ecsk, https://github.com/yukiarrr/ecsk, "CLI tool that you can interactively call Amazon ECS APIs (run-task, execute-command, stop-task), copy files between ECS and local, and view logs.", "cli,transfer,amazon-ecs,ecs-exec", 2021-04-22 07:45:34 +0000 UTC
42, Psyduck, https://github.com/SmartKeyerror/Psyduck, "Record CS knowlegement with XMind, version 2.0. 使用 XMind 记录 Linux 操作系统，网络，C++，Golang 以及数据库的一些设计", "linux,golang,database,network,os,xmind", 2021-04-21 09:22:04 +0000 UTC
42, safebox, https://github.com/xtaci/safebox, "One key to derive all", "", 2021-04-17 15:06:15 +0000 UTC
42, gan-go, https://github.com/LdDl/gan-go, "Generative Adversarial Network in Go via Gorgonia", "machine-learning,deep-learning,neural-network,generative-adversarial-network,gan,neural-networks,gorgonia", 2021-04-25 17:23:02 +0000 UTC
41, cider, https://github.com/leyafo/cider, "See example: https://www.leyafo.com", "", 2021-04-21 04:01:36 +0000 UTC
41, Sekura, https://github.com/Cookie04DE/Sekura, "Encryption tool that's heavily inspired by the Rubberhose file system (https://en.wikipedia.org/wiki/Rubberhose_(file_system)).", "filesystem,nbd,deniable-crypto,deniable-encryption", 2021-05-16 12:45:34 +0000 UTC
41, jsonc, https://github.com/tidwall/jsonc, "Parse json with comments and trailing commas.", "", 2021-05-14 01:16:42 +0000 UTC
40, visp, https://github.com/ambientsound/visp, "Visp is a Vi-like Spotify client for terminal users.", "vim,golang,spotify,terminal", 2021-04-13 17:50:03 +0000 UTC
