59, weebsay, https://github.com/irevenko/weebsay, "🎭👄 Like cowsay but it's random anime quote", "go,cli,golang,anime,weeb,cowsay,cli-app,terminal-app,weebdev", 2021-05-07 08:12:18 +0000 UTC
51, codename, https://github.com/lucasepe/codename, "Generate random, pronounceable, sometimes even memorable, \"superhero like\" codenames - just like Docker does with container names.", "golang,random,superheroes,names-generator,rfc1178", 2021-05-09 09:15:35 +0000 UTC
37, chanx, https://github.com/smallnest/chanx, "unbounded chan", "", 2021-05-10 09:35:20 +0000 UTC
28, go-blog-api, https://github.com/anonychun/go-blog-api, "Implementing back-end services for blog application", "", 2021-05-08 14:13:29 +0000 UTC
20, ascii-image-converter, https://github.com/TheZoraiz/ascii-image-converter, "A cross-platform tool to convert images into ascii art and print them on the console", "golang,command-line,ascii,ascii-art,command-line-tool,ascii-image", 2021-05-11 13:47:22 +0000 UTC
14, mk48, https://github.com/SoftbearStudios/mk48, "Mk48.io Ship Combat Game", "game,go,svelte,game-server,ship,boat,combat", 2021-05-08 22:51:27 +0000 UTC
12, Solaris, https://github.com/redcode-labs/Solaris, "A local LKM rootkit loader/dropper that lists available security mechanisms", "golang,rootkit,loader,dropper,lkm", 2021-05-11 19:15:51 +0000 UTC
11, ws-smuggler, https://github.com/hahwul/ws-smuggler, "WebSocket Connection Smuggler", "", 2021-05-09 08:18:30 +0000 UTC
11, secret, https://github.com/tidwall/secret, "A simple utility for encrypting and decrypting data in Go (AES-256-CFB)", "", 2021-05-07 14:53:25 +0000 UTC
10, Doge-AliveCheck, https://github.com/timwhitez/Doge-AliveCheck, "Use ICMP requests to check the alive subnet.", "", 2021-05-08 07:05:08 +0000 UTC
10, raytracing, https://github.com/flashbots/raytracing, "Eth2-MEV project with liquid staking (Flashbots-Lido-Nethermind)", "", 2021-05-08 22:19:54 +0000 UTC
9, rtty, https://github.com/skanehira/rtty, "Terminal on browser via websocket", "", 2021-05-09 14:22:44 +0000 UTC
9, bitcandle, https://github.com/aureleoules/bitcandle, "Store data on Bitcoin for 350 sats/KB up to 185 KB by using P2SH-P2WSH witness scripts", "bitcoin,data-storage,segwit,p2sh-p2wsh", 2021-05-08 16:34:18 +0000 UTC
9, grpcoin, https://github.com/grpcoin/grpcoin, "Educational gRPC app for BTC paper trading", "", 2021-05-10 22:16:25 +0000 UTC
8, Go-backendapi, https://github.com/GodYao1995/Go-backendapi, "意淫的垃圾项目", "", 2021-05-07 10:48:21 +0000 UTC
7, emacs-builds, https://github.com/jimeh/emacs-builds, "Nightly binary builds of Emacs for macOS as a self-contained Emacs.app, with native-compilation.", "macos,emacs,binary,download,nightly,macos-app,nightly-build", 2021-05-08 01:32:04 +0000 UTC
7, emoji, https://github.com/ebiten/emoji, "Emoji images for Ebiten", "", 2021-05-12 14:00:46 +0000 UTC
6, semver-generator, https://github.com/lukaszraczylo/semver-generator, "Semantic version generator using git commit keywords and overrides", "development,programming,semver,cicd", 2021-05-09 01:48:03 +0000 UTC
6, Kat-OH, https://github.com/70xH/Kat-OH, "(WIP) A Huge Fetch", "fetch,cli,golang,lipgloss", 2021-05-07 09:45:01 +0000 UTC
5, hawk-mesh-go, https://github.com/ibadus/hawk-mesh-go, "Wrapper to easily generate \"X-Request-Auth\" header for Mesh sites in golang.", "", 2021-05-09 12:56:20 +0000 UTC
5, BC-NETWORK, https://github.com/BLACKCERTIFIED/BC-NETWORK, "Implementing blockchain using Golang", "", 2021-05-08 06:13:04 +0000 UTC
5, yong, https://github.com/rladyd818/yong, "golang http server wrapper", "", 2021-05-09 11:10:17 +0000 UTC
5, cocert, https://github.com/Dentrax/cocert, "Split and distribute your private keys securely amongst an untrusted network", "secret-management,shamir-secret-sharing,public-private-key,tuf", 2021-05-09 20:08:01 +0000 UTC
5, belajar-golang-web, https://github.com/ProgrammerZamanNow/belajar-golang-web, "Belajar Go-Lang Web", "", 2021-05-07 19:09:56 +0000 UTC
4, WelfareSystem, https://github.com/StupidTAO/WelfareSystem, "公益捐赠系统", "", 2021-05-12 12:30:58 +0000 UTC
4, go-prof-app, https://github.com/felixge/go-prof-app, "WIP", "", 2021-05-10 14:05:52 +0000 UTC
4, xk6-prometheus, https://github.com/szkiba/xk6-prometheus, "k6 prometheus output extension", "prometheus,k6,xk6,k6-extension", 2021-05-07 15:20:18 +0000 UTC
4, setu_api, https://github.com/CodFrm/setu_api, "", "", 2021-05-09 15:41:23 +0000 UTC
4, authority, https://github.com/harranali/authority, "Role Based Access Control (RBAC) with database persistence ", "", 2021-05-11 17:07:33 +0000 UTC
4, generic-project-template, https://github.com/likakuli/generic-project-template, "通用restful api项目模板", "testing,go,mock,health-check,tracing,restful-api,circuit-breaker,pprof,prometheus-metrics,ratelimit", 2021-05-07 06:47:22 +0000 UTC
4, lit-bb-hack-tools, https://github.com/edoardottt/lit-bb-hack-tools, "Little Bug Bounty Hacking Tools", "tools,hacking,bug-bounty,infosec,bugbounty,hacking-tool,ctf-tools,security-tools,hacking-tools,penetration-testing-tools,bug-bounty-recon,infosectools,ctf-tool", 2021-05-07 19:54:44 +0000 UTC
4, DIDIssuer, https://github.com/StupidTAO/DIDIssuer, "", "", 2021-05-12 12:02:32 +0000 UTC
4, dogehousego, https://github.com/dogegarden/dogehousego, "A wrapper for DogeHouse made in Go", "golang,wrapper,dogehouse", 2021-05-08 11:30:47 +0000 UTC
4, Crypto-Trader, https://github.com/ivandonyk/Crypto-Trader, "", "go,golang,coinbase", 2021-05-08 02:43:20 +0000 UTC
4, distributed-api, https://github.com/m3o/distributed-api, "The API backend for distributed", "", 2021-05-12 16:59:26 +0000 UTC
4, discord-bot, https://github.com/loop-lang/discord-bot, "Loop Discord Bot", "", 2021-05-09 07:09:45 +0000 UTC
4, uriproblem-go, https://github.com/codigocompetitivo/uriproblem-go, "", "", 2021-05-08 01:29:01 +0000 UTC
4, DIDWallet, https://github.com/StupidTAO/DIDWallet, "分布式数字身份钱包", "", 2021-05-12 12:24:10 +0000 UTC
3, twitch-acc-gen, https://github.com/post04/twitch-acc-gen, "An account creator/follow bot for twitch.tv", "twitch,generator,twitch-bot,account-generator,account-generation,twitch-bots,twitch-account-creator,twitch-follow", 2021-05-09 05:17:15 +0000 UTC
3, more-ports, https://github.com/ahmetozer/more-ports, "Access more HTTP ports over CDN with this application.", "web,cdn,https,proxy,port,http-server,network-tools", 2021-05-07 02:01:12 +0000 UTC
3, timing-clock-in-dingding, https://github.com/goodking-bq/timing-clock-in-dingding, "钉钉定时打卡", "", 2021-05-11 01:47:41 +0000 UTC
3, go-toolkit, https://github.com/soolaugust/go-toolkit, "Go项目常用脚手架（log,配置等）", "", 2021-05-07 03:34:18 +0000 UTC
3, tcp-multiplexer, https://github.com/XUJiahua/tcp-multiplexer, "Multiplexer over TCP. Useful if target server only allows you to create limited tcp connections concurrently.", "tcp,multiplexer,iso8583", 2021-05-08 10:37:25 +0000 UTC
3, pr-bullet, https://github.com/k1LoW/pr-bullet, "pr-bullet is a tool for copying pull request to multiple repositories.", "pull-request", 2021-05-09 22:10:06 +0000 UTC
3, go-ebpf-trace, https://github.com/nevermosby/go-ebpf-trace, "how to use ebpf for function tracing", "", 2021-05-08 09:54:35 +0000 UTC
3, gh_sugar, https://github.com/nasum/gh_sugar, "A collection of commands for work done on GitHub", "", 2021-05-08 08:26:43 +0000 UTC
3, duckcoin, https://github.com/quackduck/duckcoin, "QUACK MONEY", "", 2021-05-10 14:20:23 +0000 UTC
3, dynamic-ip-controller, https://github.com/k8s-at-home/dynamic-ip-controller, "", "", 2021-05-07 19:46:57 +0000 UTC
3, orbit-cli, https://github.com/ghuntley/orbit-cli, "a command line interface to orbit.love", "", 2021-05-12 11:06:36 +0000 UTC
3, fp, https://github.com/qjpcpu/fp, "functional programming in go", "", 2021-05-11 02:56:57 +0000 UTC
3, smbbrute, https://github.com/Jumbo-WJB/smbbrute, "smb爆破工具", "", 2021-05-07 10:37:43 +0000 UTC
3, recover, https://github.com/fgergo/recover, "recover(4) go rewrite", "", 2021-05-11 06:54:20 +0000 UTC
3, short_url, https://github.com/liqianbro/short_url, "短链接生成器", "", 2021-05-08 03:15:33 +0000 UTC
3, cloudFront-signed-url, https://github.com/minghsu0107/cloudFront-signed-url, "This example shows how to serve private contents on AWS S3 through CloudFront signed URL.", "golang,s3-bucket,signed-url,cloudfront", 2021-05-08 08:56:31 +0000 UTC
2, VMBattleRoyale, https://github.com/SuperMYL1/VMBattleRoyale, "an idea guest1352 (funy monkey) came up with. michaelepica and supermyl are working on this", "", 2021-05-07 18:24:15 +0000 UTC
2, redis-zbench-go, https://github.com/filipecosta90/redis-zbench-go, "Redis Sorted Sets Benchmark", "", 2021-05-11 09:13:03 +0000 UTC
2, awsdtc, https://github.com/c1982/awsdtc, "AWS Data Transfer Cost Explorer", "", 2021-05-10 23:41:48 +0000 UTC
2, notion-offliner, https://github.com/nmcclain/notion-offliner, "A CLI tool that you can use create regular offline backups of your Notion.so Pages.", "", 2021-05-09 03:38:10 +0000 UTC
2, pastemystgo, https://github.com/WaifuShork/pastemystgo, "PasteMyst API wrapper witten in Golang.", "", 2021-05-10 22:41:36 +0000 UTC
2, phabrik, https://github.com/tg123/phabrik, "Native Go Impl of Service Fabric Protocol", "service-fabric", 2021-05-09 13:49:13 +0000 UTC
2, pistats, https://github.com/Dakuon/pistats, "PiStats for i2c-connected SSD1306 display", "", 2021-05-07 20:08:45 +0000 UTC
2, multi, https://github.com/snowlyg/multi, "multi auth", "", 2021-05-07 00:17:19 +0000 UTC
2, elasticsearch-security-operator, https://github.com/aberestyak/elasticsearch-security-operator, "K8s operator for Elasticsearch REST API", "", 2021-05-11 10:05:25 +0000 UTC
2, gommit, https://github.com/augustoliks/gommit, "golang + git commit = gommit | CLI to standardized commits messages", "", 2021-05-11 23:31:05 +0000 UTC
2, npccbase, https://github.com/NPC-Chain/npccbase, "", "", 2021-05-07 02:12:38 +0000 UTC
2, eks-logging-es-cognito, https://github.com/aws-samples/eks-logging-es-cognito, "", "", 2021-05-10 19:24:20 +0000 UTC
2, CLI, https://github.com/Moldy-Community/CLI, "The new moldy CLI ", "", 2021-05-11 21:36:32 +0000 UTC
2, you-dont-know-go, https://github.com/darjun/you-dont-know-go, "go internals", "", 2021-05-09 08:10:15 +0000 UTC
2, source-note, https://github.com/zheng-ji/source-note, "", "", 2021-05-09 07:00:44 +0000 UTC
2, Aprendendo-Go, https://github.com/dev-calaca/Aprendendo-Go, "Uma linguagem que há um bom tempo tenho curiosidade de aprende-la", "", 2021-05-08 20:28:26 +0000 UTC
2, findmyvaccine, https://github.com/t2run/findmyvaccine, "Telegram Bot to find my Vaccine slot from http://cowin.gov.in/", "", 2021-05-09 11:57:56 +0000 UTC
2, policy-reporter-kyverno-plugin, https://github.com/fjogeleit/policy-reporter-kyverno-plugin, "Policy Reporter Kyverno Plugin", "", 2021-05-07 10:19:16 +0000 UTC
2, go-oauth, https://github.com/DarthBenro008/go-oauth, "A Sample Integration of Google and GitHub OAuth2 in Golang (GoFiber) utilising MongoDB", "golang,oauth2,mongodb,clean-architecture,jwt-authentication,fiber", 2021-05-11 10:44:58 +0000 UTC
2, slicehelper, https://github.com/jamsman94/slicehelper, "A simple go tool to convert all nil slices to empty slices in you struct", "", 2021-05-08 05:51:44 +0000 UTC
2, CommunityAPI, https://github.com/CommunityAPI/CommunityAPI, "API To find and create great community's", "go,api,golang,mongo,mongodb,gin,api-rest,gin-gonic", 2021-05-11 02:26:29 +0000 UTC
2, spyun, https://github.com/wzt6418530/spyun, "商鹏云打印机go语言版", "", 2021-05-08 01:09:17 +0000 UTC
2, slack-reminder, https://github.com/skanehira/slack-reminder, "Slack remind generator", "go,slack,golang", 2021-05-12 01:10:05 +0000 UTC
2, npcchub, https://github.com/NPC-Chain/npcchub, "Realizing cross chain interoperability through unified service model -- using cosmos SDK", "", 2021-05-11 02:50:49 +0000 UTC
2, protobuff-comms, https://github.com/nixon1333/protobuff-comms, "Example of communication between different language based server-client using protobuf over http.", "python,golang,http,protobuf,python3,client-server", 2021-05-08 11:26:33 +0000 UTC
2, socket-with-GUI, https://github.com/cannian1/socket-with-GUI, "socket with go(in Windows) and python", "", 2021-05-10 11:04:05 +0000 UTC
2, go-crawler, https://github.com/lifegit/go-crawler, "crawler", "", 2021-05-11 03:16:49 +0000 UTC
2, ks, https://github.com/pavansh/ks, "Kubernetes Secret Reader From Cluster and Local File", "", 2021-05-09 09:04:42 +0000 UTC
2, StayHydrated, https://github.com/Finnbyte/StayHydrated, "Incredibly simple yet lifesaving app with a simple goal: GET YOU TO DRINK THE MOST VALUABLE LIQUID IN THE UNIVERSE.", "", 2021-05-08 11:18:28 +0000 UTC
2, go-sms-sender, https://github.com/casdoor/go-sms-sender, "Provides common interface to send SMS in cloud", "", 2021-05-10 05:28:11 +0000 UTC
2, quant, https://github.com/timerzz/quant, "个人项目，尝试用golang进行数字货币的交易", "", 2021-05-08 01:53:59 +0000 UTC
2, chatw, https://github.com/buraksekili/chatw, "", "", 2021-05-09 19:58:32 +0000 UTC
2, mlxdevm-go, https://github.com/Mellanox/mlxdevm-go, "mlxdevm library for for device management in go language", "", 2021-05-10 10:20:55 +0000 UTC
2, elevate, https://github.com/arindas/elevate, "Barebones HTTP File upload server.", "", 2021-05-09 18:16:30 +0000 UTC
2, xbitman, https://github.com/ucwebos/xbitman, "", "", 2021-05-07 02:05:55 +0000 UTC
2, simple-auth-go, https://github.com/arifamir/simple-auth-go, "Simple authentication api in Go and GoFiber ( Express inspired web framework written in Go )", "go,gofiber", 2021-05-09 12:50:07 +0000 UTC
2, cli-template, https://github.com/pterm/cli-template, "⚗ Template for beautiful cross-platform CLI tools written in Go!", "", 2021-05-09 17:57:54 +0000 UTC
2, certmon, https://github.com/brawer/certmon, "Monitors the expiration date of TLS certificates", "", 2021-05-11 13:10:49 +0000 UTC
2, colorjson, https://github.com/minio/colorjson, "Package json implements encoding and decoding of JSON as defined in RFC 7159. The mapping between JSON and Go values is described in the documentation for the Marshal and Unmarshal functions", "", 2021-05-10 20:20:48 +0000 UTC
2, lolcat, https://github.com/rwxrob/lolcat, "lolcat in Go that's not broken Ruby that doesn't work with figlet", "", 2021-05-12 19:14:46 +0000 UTC
2, pcli, https://github.com/pterm/pcli, "💄 PCLI features drop-in functions to integrate PTerm into popular CLI frameworks for Go.", "cli,color,tui,pretty,cobra,urfave-cli,pterm", 2021-05-10 00:02:41 +0000 UTC
2, rmds, https://github.com/kjellberg/rmds, "Recursively remove .DS_Store files in subdirectories", "", 2021-05-12 20:01:20 +0000 UTC
2, youtube_dl, https://github.com/hi20160616/youtube_dl, "A local one key web server to download youtube", "", 2021-05-11 09:24:36 +0000 UTC
1, QUIC--REPro3-Extended, https://github.com/akborsusom/QUIC--REPro3-Extended, "", "", 2021-05-09 00:41:07 +0000 UTC
1, gtools, https://github.com/hy0kl/gtools, "golang tools", "", 2021-05-08 03:14:20 +0000 UTC
1, gokvs, https://github.com/ZuoFuhong/gokvs, "基于redis协议且支持持久化的key/value存储系统", "", 2021-05-08 07:59:41 +0000 UTC
