1504, gokart, https://github.com/praetorian-inc/gokart, "A static analysis tool for securing Go code", "golang,security,security-tools,static-analysis,static-code-analysis", 2021-08-16 17:50:56 +0000 UTC
900, exatorrent, https://github.com/varbhat/exatorrent, "Self-hostable , easy-to-use , lightweight and feature-rich torrent client written in Go . It comes with beautiful Web UI and Optional Multi-User Support . Run Locally or Host in Server . Open/Download/Stream Torrents in Browser Right Away! ", "bittorrent-client,go,self-hosted,torrent", 2021-08-25 13:02:37 +0000 UTC
209, api-server, https://github.com/openscrm/api-server, "OpenSCRM是一套基于Go和React的超高质量企业微信私域流量管理系统 。企业微信、私域流量、SCRM、CRM、Golang、React、企业微信SDK", "go,golang,react,scrm,wechat,wecom,weixin,wework", 2021-08-24 10:10:28 +0000 UTC
129, regit-go, https://github.com/WithGJR/regit-go, "ReGit: A Tiny Git-Compatible Git Implementation", "", 2021-08-15 04:06:56 +0000 UTC
117, base64, https://github.com/cristalhq/base64, "Faster base64 encoding for Go", "base64,base64-decoding,base64-encoding,decoding,encoding,go,golang", 2021-08-15 06:57:09 +0000 UTC
110, carina, https://github.com/carina-io/carina, "Carina: an high performance and ops-free local storage for kubernetes", "autotiering,csi,high-performance,kubernetes,local,lvm,opsfree,storage", 2021-08-18 10:41:10 +0000 UTC
60, eget, https://github.com/zyedidia/eget, "Easily install prebuilt binaries from GitHub.", "command-line-tool,go,golang,installer,prebuilt-binaries", 2021-08-17 04:09:38 +0000 UTC
59, zauth, https://github.com/grijul/zauth, "2FA (Two-Factor Authentication) application for CLI terminal with support to import/export andOTP files.", "2fa,2fa-client,2fa-security,cli,golang,golang-application,linux,security,security-tools,zauth", 2021-08-15 19:53:17 +0000 UTC
56, dnstake, https://github.com/pwnesia/dnstake, "DNSTake — A fast tool to check missing hosted DNS zones that can lead to subdomain takeover", "dns,go,golang,nameserver,subdomain,takeover,vulnerability", 2021-08-24 11:22:15 +0000 UTC
55, Gososerial, https://github.com/EmYiQing/Gososerial, "Dynamically Generates Ysoserial's Payload by Golang", "deserialization,gadget,java-deserialization,pentesting,pentesting-tools,vulnerability,ysoserial", 2021-08-27 05:36:44 +0000 UTC
53, rsync, https://github.com/gokrazy/rsync, "gokrazy rsync", "daemon,golang,network,rsync,server", 2021-08-22 16:47:40 +0000 UTC
44, pqssh, https://github.com/mattn/pqssh, "", "", 2021-08-16 14:18:47 +0000 UTC
43, fss3, https://github.com/aymanbagabas/fss3, "FSS3 is an S3 filesystem abstraction layer for Golang", "aws,aws-s3,go,golang,minio,minio-client,s3", 2021-08-20 20:40:55 +0000 UTC
35, vim-treesitter, https://github.com/mattn/vim-treesitter, "", "treesitter", 2021-08-26 05:48:10 +0000 UTC
34, SagerConnect, https://github.com/SagerNet/SagerConnect, "Connect to SagerNet in the LAN", "", 2021-08-17 15:42:33 +0000 UTC
33, ConfigFind, https://github.com/pureqh/ConfigFind, "用于在网站文件中快速查找数据库配置文件", "", 2021-08-26 07:50:00 +0000 UTC
20, gosq, https://github.com/sanggonlee/gosq, "Simplicity-focused, template based SQL query builder", "", 2021-08-21 15:14:55 +0000 UTC
18, AVBypass, https://github.com/kira2040k/AVBypass, "golang script for bypass AV and work only in windows platform", "", 2021-08-18 20:20:01 +0000 UTC
17, zach-rock, https://github.com/Zach-Lu/zach-rock, "内网穿透，编译只需 1 秒，部署 1 分钟。", "", 2021-08-21 09:29:27 +0000 UTC
16, hakcsp, https://github.com/hakluke/hakcsp, "Return domains in CSP headers in http response", "", 2021-08-17 06:39:26 +0000 UTC
16, netflix-all-verify, https://github.com/Quzard/netflix-all-verify, "NetFlix批量检测", "", 2021-08-22 03:14:29 +0000 UTC
15, entviz, https://github.com/hedwigz/entviz, "evz is an ent extension that provides visualization of the schema graph", "", 2021-08-16 08:48:51 +0000 UTC
15, Suscan, https://github.com/tangxiaofeng7/Suscan, "外网资产扫描平台", "", 2021-08-16 07:59:38 +0000 UTC
14, OK, https://github.com/jesseduffield/OK, "Welcome to the future of programming languages: OK?", "", 2021-08-15 08:20:26 +0000 UTC
13, govarnam, https://github.com/varnamproject/govarnam, "GoVarnam is a cross-platform transliteration library. Manglish -> Malayalam, Thanglish -> Tamil, Hinglish -> Hindi plus another 10 languages. GoVarnam is a near-Go port of libvarnam", "ime,input-method,keyboard,language,malayalam,transliteration", 2021-08-17 18:21:04 +0000 UTC
12, kube-scheduler-simulator, https://github.com/kubernetes-sigs/kube-scheduler-simulator, "A web-based simulator for the Kubernetes scheduler", "k8s-sig-scheduling", 2021-08-17 20:02:46 +0000 UTC
12, opti, https://github.com/protolambda/opti, "Minimalist optimistic rollup tech", "", 2021-08-15 14:38:05 +0000 UTC
12, Rosefintech-RosL2-Bridge, https://github.com/Rosefintech/Rosefintech-RosL2-Bridge, "Zero-knowledge-proof verification bridge", "bridge,rosefintech,rosl2,validation,zero-knowledge-proofs", 2021-08-16 02:03:32 +0000 UTC
12, superr, https://github.com/goware/superr, "SupErr -- Go stdlib errors with super powers", "", 2021-08-27 11:22:19 +0000 UTC
11, mac-cleanup, https://github.com/mac-cleanup/mac-cleanup, "🗑️ Cleanup script for macOS", "cli,golang,mac-cleanup,macos", 2021-08-17 17:25:07 +0000 UTC
11, webfr, https://github.com/krishpranav/webfr, "A powerful go web framework for highly scalable and resource efficient web application", "cplusplus,cross-platform,framework,go,go-framework,go-library,golang,linux,macos,microservices,unix,webframework,webserver,windows", 2021-08-22 07:10:03 +0000 UTC
10, belajar-golang-restful-api, https://github.com/ProgrammerZamanNow/belajar-golang-restful-api, "Belajar Go-Lang RESTful API", "", 2021-08-19 11:47:09 +0000 UTC
10, validator, https://github.com/flamego/validator, "💯 Go Struct and Field validation, including Cross Field, Cross Struct, Map, Slice and Array diving", "go,lsif-enabled,validation", 2021-08-20 17:31:07 +0000 UTC
10, cloudflare-ip-updater, https://github.com/theaj/cloudflare-ip-updater, "A simple tool to detect WAN IP changes and updates your cloudflare DNS entries.", "", 2021-08-25 01:04:09 +0000 UTC
10, XiuScan, https://github.com/EmYiQing/XiuScan, "Super Java Vulnerability Scanner", "", 2021-08-23 15:19:24 +0000 UTC
10, golang-rest-api-with-mysql, https://github.com/Kivanc10/golang-rest-api-with-mysql, "A Go rest API project that is following solid and common principles and is connected to local MySQL database.", "", 2021-08-20 16:34:50 +0000 UTC
9, parallel, https://github.com/qbhy/parallel, "", "", 2021-08-17 09:05:14 +0000 UTC
9, controllermesh, https://github.com/openkruise/controllermesh, "ControllerMesh is a solution that helps developers manage their controllers/operators better.", "", 2021-08-16 06:32:33 +0000 UTC
8, ngamux, https://github.com/ngamux/ngamux, "Simple HTTP router for Go", "go,http", 2021-08-22 08:31:40 +0000 UTC
8, spiffe-csi, https://github.com/spiffe/spiffe-csi, "Container Storage Interface components for SPIFFE", "", 2021-08-20 20:19:17 +0000 UTC
8, LightningTipBot, https://github.com/LightningTipBot/LightningTipBot, "A tip bot and Lightning wallet on Telegram ⚡️", "bitcoin,lightning-network,microtransactions,telegram-bots", 2021-08-16 10:07:45 +0000 UTC
8, lhmon, https://github.com/krwu/lhmon, "腾讯云轻量服务器流量监控", "", 2021-08-15 16:34:43 +0000 UTC
8, spotter-vector, https://github.com/OhMyVector/spotter-vector, "🤖 This cute and little robot seems to be watching you", "anki,golang,remote-control,robot,robotics,spotter,vector", 2021-08-17 21:21:24 +0000 UTC
8, ztrace, https://github.com/zartbot/ztrace, "Traceroute in Go", "", 2021-08-16 07:58:39 +0000 UTC
7, ZeroBot-Plugin-Gif, https://github.com/tdf1939/ZeroBot-Plugin-Gif, "ZeroBot插件，可以制作各种沙雕gif图", "", 2021-08-18 11:14:25 +0000 UTC
7, protos, https://github.com/v8platform/protos, "Public interface definitions of 1C Enterprise", "", 2021-08-17 11:04:31 +0000 UTC
7, jl, https://github.com/arwn/jl, "jl is a subset of json!", "", 2021-08-19 20:46:14 +0000 UTC
7, nano-gpu-scheduler, https://github.com/nano-gpu/nano-gpu-scheduler, "nano-gpu-scheduler is a Kubernetes scheduler extender for GPU resources scheduling.", "", 2021-08-24 04:49:13 +0000 UTC
7, linkedlist.go, https://github.com/1995parham/linkedlist.go, "The first generic linked list in go :dancer:", "", 2021-08-22 20:09:17 +0000 UTC
7, ArtalkGo, https://github.com/ArtalkJS/ArtalkGo, "🗃 Artalk 评论系统后端程序 [施工中...]", "", 2021-08-24 03:16:06 +0000 UTC
6, spqr, https://github.com/pg-sharding/spqr, "Stateless Postgres Query Router", "", 2021-08-20 08:07:20 +0000 UTC
6, Fuck163MusicTasks, https://github.com/XiaoMengXinX/Fuck163MusicTasks, "Automate all the tasks you can do in NeteaseCloudMusic", "", 2021-08-19 13:40:27 +0000 UTC
6, control, https://github.com/cluckcdn/control, "CDN for Open Source, Non-commercial CDN management", "", 2021-08-16 09:53:28 +0000 UTC
6, gophersay, https://github.com/scraly/gophersay, "GopherSay allow you to display a message said by a cute random Gopher.", "", 2021-08-21 19:10:43 +0000 UTC
6, config-reloader-sidecar, https://github.com/Pluies/config-reloader-sidecar, "Sidecar to watch a config folder and reload a process when it changes", "config,hot-reload,kubernetes,sidecar", 2021-08-20 09:46:46 +0000 UTC
6, ktest, https://github.com/VKCOM/ktest, "Test and benchmark KPHP code", "benchmarking,kphp,php,testing", 2021-08-17 09:11:05 +0000 UTC
6, getsystem, https://github.com/audibleblink/getsystem, "Small utility package for stealing tokens from other processes and using them in current threads, or duplicating them and starting other processes", "pentesting,redteam,winapi", 2021-08-20 22:02:29 +0000 UTC
6, jenkins-client, https://github.com/jenkins-zh/jenkins-client, "The Jenkins client was written by Golang", "", 2021-08-18 01:44:36 +0000 UTC
6, parallel, https://github.com/ridge/parallel, "Go library for structured parallelism", "", 2021-08-20 11:15:30 +0000 UTC
5, gron, https://github.com/Deitar13/gron, "", "", 2021-08-24 20:54:15 +0000 UTC
5, go-cloud-native-patterns, https://github.com/zeihanaulia/go-cloud-native-patterns, "Example patterns for distributed service", "", 2021-08-23 03:44:47 +0000 UTC
5, argoworkflow-pod-reaper, https://github.com/smallcase/argoworkflow-pod-reaper, "Deletes completed pods that are owned by ArgoWorkflow.", "", 2021-08-24 17:08:35 +0000 UTC
5, hydrapp, https://github.com/pojntfx/hydrapp, "Build apps that run everywhere with Go and a browser engine of your choice (Chrome, Firefox, Epiphany or Android WebView).", "", 2021-08-21 18:45:10 +0000 UTC
5, raft-pseudocode, https://github.com/huseyinbabal/raft-pseudocode, "Dummy Golang Implementation of Raft Consensus Algorithm", "", 2021-08-25 19:56:27 +0000 UTC
5, jin, https://github.com/uncle-lv/jin, "The jin is a simplified version of the gin web framework that can help you quickly understand the core principles of a web framework.", "golang,web-framework", 2021-08-20 07:31:55 +0000 UTC
5, go-steamworks, https://github.com/hajimehoshi/go-steamworks, "A Steamworks SDK binding for Go", "", 2021-08-28 15:25:34 +0000 UTC
5, Devops, https://github.com/flystary/Devops, "Devops", "", 2021-08-26 04:11:34 +0000 UTC
5, api-bruh-bot, https://github.com/bruh-boys/api-bruh-bot, "The api that use https://github.com/ELPanaJose/bruh-bot", "", 2021-08-21 19:34:25 +0000 UTC
5, ZheTian, https://github.com/yqcs/ZheTian, " ZheTian Powerful remote load and execute ShellCode tool", "", 2021-08-24 09:16:18 +0000 UTC
5, hakurlencode, https://github.com/hakluke/hakurlencode, "(en|de)code urls from the CLI", "", 2021-08-17 06:02:18 +0000 UTC
5, go-imagecleaner, https://github.com/adriacabeza/go-imagecleaner, "📸 Clean your image folder using perceptual hashing and BK-trees using Go!", "bk-tree,clustering,golang,image-processing,perceptual-hashing", 2021-08-17 18:51:24 +0000 UTC
5, BrokenLinkHijacking, https://github.com/johnssimon007/BrokenLinkHijacking, "", "", 2021-08-22 11:57:08 +0000 UTC
5, geth-proxy, https://github.com/moonrhythm/geth-proxy, "Reverse Proxy for geth node", "", 2021-08-17 12:53:54 +0000 UTC
5, go-storage, https://github.com/appleboy/go-storage, "storage interface for local disk or AWS S3 (or Minio) platform", "", 2021-08-26 00:21:22 +0000 UTC
5, goid, https://github.com/longlihale/goid, "", "", 2021-08-26 08:53:50 +0000 UTC
4, go-cdclient, https://github.com/andrewchambers/go-cdclient, "Fast implementation of the collectd network protocol for go.", "", 2021-08-22 12:14:01 +0000 UTC
4, stack-overflow-cli, https://github.com/5elenay/stack-overflow-cli, "🔍 Find stack overflow questions from your favorite terminal!", "cli,command-line-app,go,golang,stack-overflow,stack-overflow-api,stackoverflow", 2021-08-19 05:26:27 +0000 UTC
4, cast, https://github.com/golobby/cast, "A lightweight casting package for Go projects", "cast,casting,go,golang,golang-package,type-conversion", 2021-08-18 15:28:15 +0000 UTC
4, iter, https://github.com/serge-hulne/iter, "Iter tools for Go(Golang)", "", 2021-08-22 15:53:54 +0000 UTC
4, JstSDK, https://github.com/f1748x/JstSDK, "golang 聚水潭SDK", "", 2021-08-17 11:06:50 +0000 UTC
4, pingo, https://github.com/march0s1as/pingo, "um script simples feito em golang que lhe retornará o resultado dos diretórios/subdomínios obtidos com base na sua wordlist =]", "", 2021-08-23 23:41:21 +0000 UTC
4, daniel-ssh, https://github.com/hackermondev/daniel-ssh, "Access my website from the terminal with SSH!", "go,golang,ssh,ssh-server,website", 2021-08-21 21:54:33 +0000 UTC
4, rancher-user-permissions, https://github.com/dbason/rancher-user-permissions, "", "", 2021-08-20 00:58:11 +0000 UTC
4, autosolve, https://github.com/godtoy/autosolve, "support multi autosolve instances for AYCD https://aycd.io/account/developer/docs#/", "", 2021-08-20 04:18:25 +0000 UTC
4, hack-multisig, https://github.com/quackduck/hack-multisig, "Very security with money sending by multiple doggos ", "", 2021-08-28 18:31:51 +0000 UTC
4, puffy, https://github.com/jieggii/puffy, "(WIP) Extremely simple unixway GitHub webhook listener for push event", "github-webhook-listener,github-webhooks", 2021-08-23 21:27:06 +0000 UTC
4, edotool, https://github.com/evuraan/edotool, "edotool: simulate keyboard input and mouse activity", "cgo,go,linux,wayland,x11", 2021-08-20 05:12:32 +0000 UTC
4, port-scanner-go, https://github.com/nxenon/port-scanner-go, "TCP Port Scanner in GO lang", "", 2021-08-24 11:24:43 +0000 UTC
4, redigosrv, https://github.com/Saner-Lee/redigosrv, "redis protocol server for go.", "", 2021-08-19 10:56:09 +0000 UTC
4, ZeroBot-Plugin-picrew, https://github.com/tdf1939/ZeroBot-Plugin-picrew, "生成随机头像", "", 2021-08-22 15:59:45 +0000 UTC
4, dinogo, https://github.com/mertcandav/dinogo, "Dinogo is an CLI framework for build terminal and shell applications in Go.", "cli,framework,go,library,shell,tool", 2021-08-28 10:55:29 +0000 UTC
4, bad-mail-server, https://github.com/cjdenio/bad-mail-server, "a bad mail server", "", 2021-08-24 03:34:20 +0000 UTC
4, discolored, https://github.com/Fusl/discolored, "stupidly simple discord bot written in golang to allow discord server members to self-assign color roles", "", 2021-08-20 17:55:57 +0000 UTC
4, dotenv, https://github.com/golobby/dotenv, "A lightweight package for loading dot env (.env) files into structs for Go projects", "config,config-file,configuration,configuration-files,configuration-management,dot-env,dotenv,env,env-file,environment-variables,go,golang", 2021-08-19 16:48:45 +0000 UTC
4, cdnParse, https://github.com/tangxiaofeng7/cdnParse, "", "", 2021-08-26 06:15:17 +0000 UTC
4, pulumi-tidb, https://github.com/dragonly/pulumi-tidb, "Deploy TiDB with Pulumi effortlessly.", "", 2021-08-23 08:30:07 +0000 UTC
4, rpc_demo, https://github.com/Enderxq/rpc_demo, "gRpc server and client demo", "", 2021-08-18 02:52:36 +0000 UTC
4, go2rpcx, https://github.com/zsinx/go2rpcx, "根据Golang定义的接口生成rpcx客户端和服务端代码", "generator,rpcx", 2021-08-20 06:24:08 +0000 UTC
4, go-raft, https://github.com/yifengyou/go-raft, "raft协议学习", "", 2021-08-23 09:20:10 +0000 UTC
4, bmgconv, https://github.com/WiiLink24/bmgconv, "cómo se dice \"this code is horrifying\" en español", "", 2021-08-22 08:48:49 +0000 UTC
