2754, ticker, https://github.com/achannarasappa/ticker, "Terminal stock ticker with live updates and position tracking", "", 2021-01-24 03:50:46 +0000 UTC
369, ditto, https://github.com/evilsocket/ditto, "A tool for IDN homograph attacks and detection.", "", 2021-01-28 13:46:48 +0000 UTC
352, ScareCrow, https://github.com/optiv/ScareCrow, "ScareCrow - Payload creation framework designed around EDR bypass.", "", 2021-01-25 02:21:23 +0000 UTC
308, software, https://github.com/deepvalue-network/software, "These are the products of Steve Care Software Inc", "", 2021-01-26 01:00:17 +0000 UTC
202, notify, https://github.com/nikoksr/notify, "A dead simple Go library for sending notifications to various messaging services.", "bot,discord,email,golang,hacktoberfest,messaging,microsoft-teams,notifications,slack,telegram", 2021-01-24 23:07:29 +0000 UTC
129, go-fluent-ffmpeg, https://github.com/modfy/go-fluent-ffmpeg, "A Go implementation of fluent-ffmpeg", "ffmpeg,fluent-ffmpeg,go,go-fluent-ffmpeg", 2021-01-30 19:46:14 +0000 UTC
75, slick, https://github.com/ExaScience/slick, "The Slick programming language is an s-expression surface syntax for Go.", "", 2021-01-29 13:31:48 +0000 UTC
66, ibm_bak, https://github.com/labulaka521/ibm_bak, "IBM Developer 中文网站文章备份", "", 2021-02-03 08:36:04 +0000 UTC
59, hotwire-golang-website, https://github.com/wolfeidau/hotwire-golang-website, "This project provides some working examples using Go and Hotwire Turbo.", "golang,hotwire-turbo", 2021-01-31 06:50:24 +0000 UTC
42, lieu, https://github.com/cblgh/lieu, "community search engine", "community,search,search-engine", 2021-02-03 17:50:01 +0000 UTC
35, reactssr, https://github.com/tmc/reactssr, "reactssr is a package for rendering React applications.", "go,react", 2021-02-04 02:41:37 +0000 UTC
31, botnet-fishbowl, https://github.com/xen0bit/botnet-fishbowl, "Use random bot scanning the internet to seed a Conways Game of Life running on a small LCD on my desk", "", 2021-01-29 00:40:22 +0000 UTC
29, sedna, https://github.com/kubeedge/sedna, "AI tookit over KubeEdge", "", 2021-01-28 03:24:13 +0000 UTC
29, sao-gen-gen, https://github.com/disksing/sao-gen-gen, "骚话生成器生成器", "", 2021-01-24 00:15:15 +0000 UTC
28, deferfuzz, https://github.com/mdempsky/deferfuzz, "Fuzz Go defer/panic/recover", "", 2021-01-26 10:06:50 +0000 UTC
27, lotus-1.4.0, https://github.com/moran666666/lotus-1.4.0, "", "", 2021-01-23 13:54:07 +0000 UTC
25, cloudfront-autoindex, https://github.com/artyom/cloudfront-autoindex, "AWS Lambda to work around index.html S3/CloudFront mess", "aws-lambda,cloudfront,s3-website", 2021-01-29 14:45:41 +0000 UTC
24, team-manager, https://github.com/cilium/team-manager, "Bot to manage team members in GitHub organizations", "", 2021-01-26 17:56:35 +0000 UTC
24, fastreflect, https://github.com/karminski/fastreflect, "A faster method to get elements from an interface (Struct or Slice type) for Go. 一个更快的方法, 用来获取 interface (Struct) 的属性, 或 interface (Slice)  的元素.", "", 2021-01-27 08:16:21 +0000 UTC
22, jisui, https://github.com/sachaos/jisui, "Convert scanned image PDF file to text annotated PDF file", "e-book,gcp-cloud-vision,ocr,ocr-recognition,pdf", 2021-01-31 07:18:43 +0000 UTC
20, testfs, https://github.com/caarlos0/testfs, "A simple `fs.FS` implementation to be used inside tests.", "", 2021-02-04 21:21:26 +0000 UTC
15, LearnosSource, https://github.com/t924417424/LearnosSource, "https://learnos.online 项目开源，可在线创建使用linux系统以及各种编程/测试环境，可使用webssh/ssh终端进行操作。核心功能核心基于docker，项目使用微服务架构。", "", 2021-01-26 10:08:51 +0000 UTC
13, gotemp, https://github.com/camba1/gotemp, "Sample full stack micro services application built using the go-Micro framework.", "", 2021-01-24 23:45:05 +0000 UTC
12, chk, https://github.com/Ripolak/chk, "A small CLI tool to check connection from a local machine to a remote target in various protocols. ", "", 2021-01-29 15:12:19 +0000 UTC
11, twitter-backend, https://github.com/rsharifnasab/twitter-backend, "twitter clone front-end for Internet Engineering course - fall 99 built by go+echo", "backend,echo,go,golang,swagger", 2021-01-26 12:52:49 +0000 UTC
11, sregx, https://github.com/zyedidia/sregx, "A tool and library for using structural regular expressions.", "golang,regular-expressions,structural-regex,structural-regular-expressions", 2021-01-31 01:06:25 +0000 UTC
10, succinct, https://github.com/openacid/succinct, "succinct static kv", "go,golang,kv,static,succicnt", 2021-01-30 16:10:01 +0000 UTC
10, oDrop, https://github.com/flew-software/oDrop, "oDrop, a fast efficient cross-platform file transfer software for server and home environments ", "command-line-tool,file-share,file-transfer,server", 2021-02-01 07:59:39 +0000 UTC
9, terraform-provider-utils, https://github.com/cloudposse/terraform-provider-utils, "The Cloud Posse Terraform Provider for various utilities (E.g. deep merging)", "", 2021-01-25 15:17:00 +0000 UTC
9, DNSLog-Platform-Golang, https://github.com/yumusb/DNSLog-Platform-Golang, "DNSLOG平台 golang 一键启动版", "dnslog,fastjson-rce,golang,shiro-rce", 2021-02-01 14:04:06 +0000 UTC
8, WanxiaoHealthyCheckOnTencentCloud, https://github.com/FNDHSTD/WanxiaoHealthyCheckOnTencentCloud, "完美校园健康打卡 by 腾讯云函数（全自动）", "", 2021-01-28 11:26:28 +0000 UTC
8, reward, https://github.com/rewardenv/reward, "Reward is a Swiss Army knife CLI utility for orchestrating Docker based development environments.", "development,golang,itgcommerce,magento,magento1,magento2,wordpress", 2021-01-29 17:53:08 +0000 UTC
8, mimigo, https://github.com/Zach-Lu/mimigo, "Golang 框架，结合gin，加入了 mongodb 、令牌管理、oss 等业务常用示例。", "", 2021-01-29 04:43:32 +0000 UTC
8, go-mattermost-notify, https://github.com/madrisan/go-mattermost-notify, "Mattermost Posts via its REST API v4 (coded in Go)", "cli-app,golang,mattermost,mattermost-bot,notifications", 2021-01-23 18:21:18 +0000 UTC
7, retter, https://github.com/hyperjumptech/retter, "RETTER is a simple server that provides circuit breaking for Web Applications. By using a CircuitBreaker in your web solution, you make your solution tobe more fault-tolerant, reliable and resilient toward heavy load.", "", 2021-02-01 04:12:11 +0000 UTC
7, gomaze, https://github.com/oddstream/gomaze, "A Go+Ebiten playground for maze ideas", "ebiten,game,go,maze", 2021-01-26 15:34:43 +0000 UTC
7, gno, https://github.com/gnolang/gno, "Gno language", "", 2021-01-29 17:28:08 +0000 UTC
7, go-tarfs, https://github.com/nlepage/go-tarfs, "Read a tar file contents using go1.16 io/fs abstraction", "golang,tar", 2021-02-03 23:30:41 +0000 UTC
7, chrometracing, https://github.com/google/chrometracing, "libraries for various programming languages that make it easy to generate per-process trace files that can be loaded into chrome://tracing", "tracing", 2021-02-04 12:19:18 +0000 UTC
7, ospf3, https://github.com/mdlayher/ospf3, "Package ospf3 implements OSPFv3 (OSPF for IPv6) as described in RFC5340. MIT Licensed.", "go,golang,ipv6,networking,ospf", 2021-01-29 00:18:30 +0000 UTC
7, Bio2ScriptViewer, https://github.com/samuelyuan/Bio2ScriptViewer, "View the script files in the original Resident Evil 2 / Biohazard 2 as pseudocode ", "resident-evil,residentevil", 2021-01-26 04:15:22 +0000 UTC
7, esquenta-imersao-go, https://github.com/codeedu/esquenta-imersao-go, "", "", 2021-01-28 22:55:10 +0000 UTC
7, gofeed, https://github.com/steeling/gofeed, "A database change feed for processing work", "", 2021-01-29 01:05:25 +0000 UTC
7, mautrix-imessage, https://github.com/tulir/mautrix-imessage, "A Matrix-iMessage puppeting bridge", "bridge,golang,imessage,matrix,matrix-appservice,matrix-org", 2021-01-27 13:10:05 +0000 UTC
7, yubage, https://github.com/tv42/yubage, "`age-plugin-yubikey` implementation, encrypt things with a Yubikey/any PIV card", "", 2021-02-03 19:50:14 +0000 UTC
6, AmbushOS, https://github.com/washedev/AmbushOS, "", "", 2021-02-04 11:37:55 +0000 UTC
6, cuetsy, https://github.com/sdboyer/cuetsy, "Experimental CUE->TypeScript exporter", "", 2021-02-01 14:22:16 +0000 UTC
6, bramble, https://github.com/movio/bramble, "The Movio GraphQL Gateway", "", 2021-02-05 02:23:02 +0000 UTC
6, go-i18n, https://github.com/smithyj/go-i18n, "GoLang international library, easy to use, welcome to share and pull request", "", 2021-01-23 06:52:27 +0000 UTC
6, apulisedge, https://github.com/apulis/apulisedge, "", "", 2021-01-25 07:09:50 +0000 UTC
6, easydocker, https://github.com/ldmtam/easydocker, "Easy and simple way to interact with docker for testing purpose", "", 2021-01-24 06:27:09 +0000 UTC
6, go-release, https://github.com/youngjuning/go-release, "A version control tool based on github release.", "cli,golang", 2021-02-03 13:16:23 +0000 UTC
6, IOTA-SmartContracts-Template-Rust, https://github.com/brunoamancio/IOTA-SmartContracts-Template-Rust, "A simple template used to start developing your own smart contracts for ISCP (IOTA Smart Contract Protocol) in Rust and write unit tests in Go.", "iota,iscp,smart-contracts,solo,wasp", 2021-02-04 03:23:58 +0000 UTC
6, infogrid, https://github.com/vitsensei/infogrid, "Find and retrieve latest articles from multiple different news agencies.", "api-rest,golang,news", 2021-01-25 12:27:14 +0000 UTC
6, gotempm, https://github.com/camba1/gotempm, "Sample full stack micro services application built using the Micro platform. ", "", 2021-01-24 23:46:07 +0000 UTC
6, go-sword-admin, https://github.com/sanyueruanjian/go-sword-admin, "GO语言通用后端框架", "", 2021-01-26 13:24:16 +0000 UTC
6, opentelemetry-collector-builder, https://github.com/open-telemetry/opentelemetry-collector-builder, "A CLI tool that generates OpenTelemetry Collector binaries based on a manifest. ", "opentelemetry,opentelemetry-collector", 2021-01-27 23:48:35 +0000 UTC
6, qlite, https://github.com/culion-bear/qlite, "NewSQL distributed storage database based on micro service framework", "", 2021-02-05 08:40:09 +0000 UTC
6, imersao-live-grpc, https://github.com/codeedu/imersao-live-grpc, "", "", 2021-01-30 01:06:25 +0000 UTC
6, zmyy_seckill, https://github.com/sotowang/zmyy_seckill, "知苗易约抢购", "", 2021-01-31 13:17:45 +0000 UTC
6, gf-library, https://github.com/rxrddd/gf-library, "gf框架封装的一些业务小组件", "", 2021-01-30 16:08:32 +0000 UTC
6, drl-exporter, https://github.com/m47ik/drl-exporter, "Prometheus exporter for dockerhub rate limits", "", 2021-02-03 05:13:53 +0000 UTC
6, vncfreethumb, https://github.com/alltom/vncfreethumb, "Prototype of swiping a region of a window to create its minimized thumbnail", "", 2021-01-30 21:30:33 +0000 UTC
6, goS3, https://github.com/Mirhatyasar/goS3, "Simple go tool for bruteforcing S3 buckets", "", 2021-01-31 18:14:01 +0000 UTC
5, smart-vpn-client, https://github.com/networkop/smart-vpn-client, "Smart VPN client", "", 2021-01-23 14:35:24 +0000 UTC
5, mysocketctl-go, https://github.com/mysocketio/mysocketctl-go, "mysocketctl command line tool for mysocket.io", "", 2021-01-27 20:53:35 +0000 UTC
5, JiraOdooTimesheetLink, https://github.com/Kaporos/JiraOdooTimesheetLink, "This simple AWS Lambda app link your jira worklog to your odoo timesheets", "", 2021-01-31 15:11:41 +0000 UTC
5, clickhouse-github-action, https://github.com/EpicStep/clickhouse-github-action, "ClickHouse in GitHub Actions", "actions,clickhouse,github-actions", 2021-01-23 15:21:51 +0000 UTC
5, goxdp-template, https://github.com/takehaya/goxdp-template, "A sample for writing XDP programs in Go", "ebpf,go,golang,network-programming,xdp", 2021-01-25 14:34:13 +0000 UTC
5, go-sklearn-example, https://github.com/mattn/go-sklearn-example, "", "", 2021-01-26 06:37:54 +0000 UTC
5, nasa.so, https://github.com/takonomura/nasa.so, "なさそう", "", 2021-01-23 11:27:15 +0000 UTC
5, spamchk, https://github.com/irevenko/spamchk, "🔎⚠️ A tiny spam detection library ", "", 2021-01-25 23:07:05 +0000 UTC
5, gossb-rooms, https://github.com/ssb-ngi-pointer/gossb-rooms, "Room server implemented in Go", "", 2021-02-01 15:44:30 +0000 UTC
5, gofare, https://github.com/joanbono/gofare, "Golang utility to pretty print Mifare dump", "go,golang,mifare,mifare1k,mifare4k,nfc", 2021-02-03 07:11:34 +0000 UTC
5, moxspec, https://github.com/actapio/moxspec, "", "", 2021-01-30 13:52:44 +0000 UTC
5, gflib, https://github.com/dabuge/gflib, "goframe 框架第三方常用组件库", "", 2021-01-25 05:53:18 +0000 UTC
5, go-blocknative, https://github.com/bonedaddy/go-blocknative, "blocknative websocket api client in golang", "blockchain,blocknative,blocknative-api,defi,ethereum,ethereum-events,golang,smart-contracts,websockets", 2021-01-28 20:49:37 +0000 UTC
5, example-single-sign-on, https://github.com/BARJ/example-single-sign-on, "Dockerized example of Single Sign-On (SSO) written in Go and React", "", 2021-02-01 10:21:51 +0000 UTC
5, pod-graceful-drain, https://github.com/foriequal0/pod-graceful-drain, "You don't need `lifecycle: { preStop: { exec: { command: [\"sleep\", \"30\"] } } }`", "", 2021-02-03 04:56:59 +0000 UTC
5, buneary, https://github.com/dominikbraun/buneary, "An easy-to-use CLI client for RabbitMQ.", "", 2021-02-04 11:26:07 +0000 UTC
5, ilggo.ga, https://github.com/pmh-only/ilggo.ga, "ilggo.ga - bbs-like novel writting community", "", 2021-01-30 16:35:09 +0000 UTC
5, go-india, https://github.com/itsksaurabh/go-india, "Code written in Go to generate the map of India in Tricolor 🇮🇳", "", 2021-01-26 19:58:05 +0000 UTC
5, client-go, https://github.com/kris-nova/client-go, "Go client for the Photoprism Application", "", 2021-01-31 00:34:14 +0000 UTC
5, s3iofs, https://github.com/wolfeidau/s3iofs, "This package provides an S3 implementation for Go1.16 filesystem interface.", "aws,golang,s3", 2021-01-27 11:15:11 +0000 UTC
5, helmunit, https://github.com/Waterdrips/helmunit, "", "", 2021-01-23 15:43:23 +0000 UTC
5, streamingfast-client, https://github.com/streamingfast/streamingfast-client, "Fastest ", "", 2021-01-27 20:14:35 +0000 UTC
4, flood, https://github.com/gouthamve/flood, "Influx write proxy for Cortex", "", 2021-01-30 22:22:28 +0000 UTC
4, yomo-flow-ssvm-example, https://github.com/yomorun/yomo-flow-ssvm-example, "SSVM 🙌  YoMo: This example demonstrates writing yomo-flow interop with WebAssembly by SSVM", "edge-computing,ssvm,stream-processing,webassembly,yomo", 2021-01-25 16:29:55 +0000 UTC
4, website-monitor, https://github.com/NouamaneTazi/website-monitor, "A tool that helps you monitor a collection of websites using various metrics.", "go,http,monitoring,reliability,uptime", 2021-01-28 11:23:49 +0000 UTC
4, good-weekend, https://github.com/Namchee/good-weekend, "Automatically closes weekend-submitted pull requests. Enjoy your good weekends!", "github-actions,weekend", 2021-01-23 11:19:37 +0000 UTC
4, optimism-tx-format, https://github.com/gakonst/optimism-tx-format, "Shows how optimistic geth modifies transactions that get submitted to it by converting them to OVM Messages and then calls to the OVM Execution Manager", "", 2021-01-23 08:54:19 +0000 UTC
4, echo-server, https://github.com/tonyalaribe/echo-server, "", "", 2021-01-26 17:08:46 +0000 UTC
4, kim, https://github.com/rancher/kim, "In ur kubernetes, buildin ur imagez", "", 2021-01-26 18:56:37 +0000 UTC
4, oapi-extensions-middleware, https://github.com/yolossn/oapi-extensions-middleware, "Adds extension props to request context", "", 2021-02-03 18:35:16 +0000 UTC
4, tcp.io, https://github.com/flew-software/tcp.io, "Real-Time event-based communication library for Go Lang, inspired by socket.io", "", 2021-02-03 15:58:31 +0000 UTC
4, OPQBot, https://github.com/mcoo/OPQBot, "OPQBot", "", 2021-01-23 03:14:10 +0000 UTC
4, miniflow, https://github.com/emryx26/miniflow, "a command line task executor, puts tasks in a dag and resolve dependencies.", "", 2021-01-24 16:59:01 +0000 UTC
4, Aryzath, https://github.com/vindecodex/Aryzath, "Aryzath is just a dragon name, but this repo is all about DESIGN PATERNS implemented using my favorite language Google's Go Language (Golang).", "design,design-patterns,golang", 2021-01-25 04:35:07 +0000 UTC
4, acai, https://github.com/moorara/acai, "🫐 Açaí is an Application Framework for Go", "go,golang", 2021-02-01 18:37:25 +0000 UTC
4, go_container, https://github.com/liusuxian/go_container, "golang container", "", 2021-02-05 06:14:54 +0000 UTC
