72, Pigiron, https://github.com/plewto/Pigiron, "Pigiron is a MIDI routing utility with an extensive OSC interface.", "osc,midi", 2021-08-12 06:02:58 +0000 UTC
67, goDomain, https://github.com/Rvn0xsy/goDomain, "Windowsæ´»åŠ¨ç›®å½•ä¸­çš„LDAPä¿¡æ¯æ”¶é›†å·¥å…·", "", 2021-08-11 04:08:53 +0000 UTC
25, ZYX-20, https://github.com/ZYXnetwork/ZYX-20, "", "", 2021-08-10 10:00:58 +0000 UTC
19, go-obj, https://github.com/aclements/go-obj, "Object file abstractions in Go", "", 2021-08-11 20:18:08 +0000 UTC
19, doge-getsys, https://github.com/timwhitez/doge-getsys, "An easy way to getsystem by golang.", "", 2021-08-13 07:34:47 +0000 UTC
17, updater, https://github.com/umputun/updater, "Simple web-hook based receiver executing things via HTTP request", "docker,updates,update-checker,update-service", 2021-08-10 16:17:30 +0000 UTC
16, dongle, https://github.com/golang-module/dongle, "A simple, semantic and developer-friendly golang package for encoding&decoding and encryption&decryption", "", 2021-08-11 07:11:54 +0000 UTC
15, crunchyroll-go, https://github.com/ByteDream/crunchyroll-go, "A crunchyroll api integration in go with included cli", "go,golang,anime,crunchyroll,anime-downloader,crunchyroll-downloader,anime-streaming,crunchyroll-api", 2021-08-09 22:33:46 +0000 UTC
10, Queue-it-Proof-of-Work, https://github.com/etaaa/Queue-it-Proof-of-Work, "A Golang and Python solution for Queue-it's Proof-of-Work challenge.", "python,go,golang", 2021-08-09 22:56:44 +0000 UTC
9, goelftools, https://github.com/hnts/goelftools, "Library for parsing ELF files written in pure Go.", "go,golang,pwn,elf,go-library,elf-parser", 2021-08-14 02:38:06 +0000 UTC
8, jwz, https://github.com/gatherstars-com/jwz, "Go implementation of the JWZ email threading algorithm", "", 2021-08-10 06:10:10 +0000 UTC
8, salt, https://github.com/odpf/salt, "Salt is a collection of libraries and tools used in the ODPF ecosystem to improve the experience of developing projects with Go.", "golang,libraries,cloud-native,common", 2021-08-11 08:30:00 +0000 UTC
8, kdl, https://github.com/alecthomas/kdl, "Go parser for KDL", "", 2021-08-14 10:24:45 +0000 UTC
7, golang-uuid-loader, https://github.com/TRYblog/golang-uuid-loader, "golang uuid-shellcodeåŠ è½½å™¨,åˆ†ç¦»æ‰§è¡Œ,å¯ç›´æ¥æŠŠshellcodeå†™å…¥ç¨‹åºã€‚", "", 2021-08-12 10:52:37 +0000 UTC
7, censor-api, https://github.com/AkinoKaede/censor-api, "The best censorship API.", "", 2021-08-12 01:39:31 +0000 UTC
6, sample-tailscale, https://github.com/jonfriesen/sample-tailscale, "", "", 2021-08-10 19:36:38 +0000 UTC
6, pod-exec-guard-kubewebhook-tutorial, https://github.com/slok/pod-exec-guard-kubewebhook-tutorial, "Kubernetes webhook development (validating admission webhook) tutorial using kubewebhook", "kubernetes,webhooks,k8s,admission-webhook,validating-admission-webhook", 2021-08-12 16:41:55 +0000 UTC
6, sonarbyte, https://github.com/channyein1337/sonarbyte, " sonarbyte is a simple and fast subdomain scanner written in go to extract subdomain from Rapid7's DNS Database using omnisint's api.", "", 2021-08-10 16:52:09 +0000 UTC
6, play-from-disk-h264, https://github.com/Sean-Der/play-from-disk-h264, "Example of using Pion WebRTC to play H264 + Ogg from disk", "", 2021-08-09 14:34:36 +0000 UTC
6, unixtransport, https://github.com/peterbourgon/unixtransport, "Support for Unix domain sockets in Go HTTP clients", "", 2021-08-13 17:41:23 +0000 UTC
6, zeit, https://github.com/elkowar/zeit, "A simple command line time description parser", "", 2021-08-09 10:13:08 +0000 UTC
6, kubescape, https://github.com/armosec/kubescape, "kubescape is a tool for testing the configuration of Kubernetes clusters from security perspective based on different industry accepted best practices", "", 2021-08-12 10:39:29 +0000 UTC
6, ginapi, https://github.com/lengyue1084/ginapi, "gin apiçš„è„šæ‰‹æ¶", "", 2021-08-11 03:32:55 +0000 UTC
5, IDAGIO-Downloader, https://github.com/Sorrow446/IDAGIO-Downloader, "", "", 2021-08-09 14:37:48 +0000 UTC
5, RLLOCK, https://github.com/lin0601/RLLOCK, "redisé”ç»­å‘½", "", 2021-08-12 02:43:12 +0000 UTC
5, alpnpass, https://github.com/VerSprite/alpnpass, "This tool will listen on a given port, strip SSL encryption, forward traffic through a plain TCP proxy, then encrypt the returning traffic again and send it to the target of your choice. Unlike most SSL stripping solutions this tool will negotiate ALPN and preserve the negotiated protocol all the way to the target.", "tls,ssl,security,mitm,mitmproxy,alpn,security-tools", 2021-08-09 16:40:57 +0000 UTC
5, conflux-cmd-wallet, https://github.com/coral922/conflux-cmd-wallet, "A Full-featured Offline Conflux Wallet .", "", 2021-08-11 12:18:55 +0000 UTC
4, micro, https://github.com/wjlzr/micro, "å¾®æœåŠ¡æ¶æ„-micro-åŸºäºgo-zero zrpc etcd å•ç‹¬é›†æˆorm-gorm æ—¥å¿—-uber/zap", "", 2021-08-09 03:56:30 +0000 UTC
4, xmus-router, https://github.com/amupxm/xmus-router, "Simple router build on `net/http` supports custom middleWare.", "", 2021-08-12 04:43:09 +0000 UTC
4, aces, https://github.com/quackduck/aces, "Encode in a character set of your choice", "", 2021-08-09 04:06:37 +0000 UTC
4, gosendmail, https://github.com/jeffotoni/gosendmail, "envio de email via SMTP com anexo usando Go", "go,golang,email", 2021-08-09 16:42:16 +0000 UTC
4, igovium, https://github.com/pilillo/igovium, "Multi-level caching service in Go", "", 2021-08-09 18:02:53 +0000 UTC
4, Ka-ineshizuku-Project, https://github.com/ssp97/Ka-ineshizuku-Project, "a oicq chat robot", "", 2021-08-09 04:53:13 +0000 UTC
4, HRA-Downloader, https://github.com/Sorrow446/HRA-Downloader, "Go port of my highresaudio tool.", "", 2021-08-10 23:31:25 +0000 UTC
4, cli, https://github.com/grifpkg/cli, "", "", 2021-08-11 06:03:25 +0000 UTC
3, sqlpp, https://github.com/nzmprlr/sqlpp, "A database connection wrapper to cache prepared statements by transforming query to use with array arguments.", "mysql,golang,postgres,wrapper,sql", 2021-08-12 18:56:16 +0000 UTC
3, go-ddd-example, https://github.com/rozturac/go-ddd-example, "/Golang - DDD, Clean Code", "golang,solid,echo,ddd,domain-driven-design,design-patterns,restful-api,mongo-db", 2021-08-11 13:03:11 +0000 UTC
3, nmapprom, https://github.com/OisinA/nmapprom, "Prometheus exporter for counting connected devices to a network using nmap", "", 2021-08-13 17:59:18 +0000 UTC
3, vsphere-priv-check, https://github.com/rvanderp3/vsphere-priv-check, "", "", 2021-08-10 18:18:30 +0000 UTC
3, resource-metrics, https://github.com/kmodules/resource-metrics, "Kubernetes resource metrics calculator", "", 2021-08-09 21:28:35 +0000 UTC
3, ser, https://github.com/changkun/ser, "a simple http server as replacement of python -m http.server", "", 2021-08-10 11:32:03 +0000 UTC
3, ns-x, https://github.com/bytedance/ns-x, "An easy-to-use, flexible network simulator library in Go.", "simulator,network,ns-3", 2021-08-13 08:38:14 +0000 UTC
3, go-ds-cluster, https://github.com/filedrive-team/go-ds-cluster, "gathering distributed key-value datastores to become a cluster", "", 2021-08-10 06:10:03 +0000 UTC
3, SuperFastjsonScan, https://github.com/EmYiQing/SuperFastjsonScan, "Scan Fastjson Use Golang Only", "rmi,pentesting,fastjson,web-security-research,fastjson-rce", 2021-08-09 13:52:36 +0000 UTC
3, mux, https://github.com/obity/mux, "Mux is a simple and efficient route distributor that supports the net/http interface of the standard library. ", "router,mux,http-router,http-multiplexer", 2021-08-10 10:00:42 +0000 UTC
3, journal, https://github.com/PaulEbose/journal, "ğŸ“” Preserve your memories, self-reflect and record ideas on-the-go with Journal.", "go,cli,journal", 2021-08-12 19:20:32 +0000 UTC
3, fibonacci-service, https://github.com/midaef/fibonacci-service, "A service for returning a slice of a sequence of numbers from the Fibonacci series from x to y with a cache", "", 2021-08-12 15:47:21 +0000 UTC
3, coninput, https://github.com/erikgeiser/coninput, "Go library for input handling using Windows Console API", "", 2021-08-14 15:57:06 +0000 UTC
3, gfblog, https://github.com/OxCaffee/gfblog, ":cyclone: ä¸€æ¬¾åŸºäºgolangå’Œvueçš„åšå®¢ç³»ç»Ÿï¼Œåç«¯é‡‡ç”¨go-frameæ¡†æ¶ï¼Œæ”¯æŒjwtè®¤è¯ï¼Œrpcè°ƒç”¨ï¼Œdockeréƒ¨ç½²ï¼Œæ­£åœ¨åŠªåŠ›å®Œå–„", "", 2021-08-11 05:33:33 +0000 UTC
3, mysqlddl, https://github.com/melodyfx/mysqlddl, "MySQL DDLå®æ—¶ç›‘æ§", "", 2021-08-10 02:41:12 +0000 UTC
3, whatsnew, https://github.com/jbowes/whatsnew, "Check for new github releases of your Golang application ğŸŠ", "go,golang,updates,releases,golang-library", 2021-08-09 23:21:12 +0000 UTC
3, go-generate-icon, https://github.com/inyunussenem/go-generate-icon, "It compiles SVG files and adds them to the javascript file.", "", 2021-08-14 20:08:03 +0000 UTC
2, go-pinger, https://github.com/harishdurga/go-pinger, "A simple Go app to ping.", "go,golang,mongodb,concurrency,ping,gorutines", 2021-08-10 02:57:27 +0000 UTC
2, bitwin-sdk-go, https://github.com/xup6m6fu04/bitwin-sdk-go, "Bitwin API version.3 SDK for Go", "", 2021-08-09 09:50:35 +0000 UTC
2, Go-Code, https://github.com/CleanMachine1/Go-Code, "", "go", 2021-08-10 19:25:55 +0000 UTC
2, kmatch, https://github.com/kralicky/kmatch, "Gomega matcher library for Kubernetes objects", "", 2021-08-11 16:57:24 +0000 UTC
2, DNS-Poisoning, https://github.com/shashankgoranta/DNS-Poisoning, "An on-path DNS poisoning attack tool and a passive DNS poisoning attack detector. ", "", 2021-08-10 03:39:00 +0000 UTC
2, go-pcqq, https://github.com/Xhs753/go-pcqq, "ä¸€ä¸ªåŸºäºpcqqåè®®çš„qqæœºå™¨äººï¼ˆæºä»£ç ç”±Githubå¤§ä½¬@DawnNightsæä¾›ï¼‰ä¼šä¸æ–­ä¼˜åŒ–", "", 2021-08-09 02:04:19 +0000 UTC
2, Packet-Sniffer, https://github.com/shashankgoranta/Packet-Sniffer, "A passive network monitoring application written in Go using the GoPacket library.", "", 2021-08-10 03:09:07 +0000 UTC
2, git-private, https://github.com/erkkah/git-private, "Store private data inside a git repository.", "git,golang,encryption,git-addons,secrets-management,age-encryption", 2021-08-09 11:46:52 +0000 UTC
2, asmdb, https://github.com/go-asm/asmdb, "asmdb provides auto-generated an assembly instruction set database from asmjit/asmdb", "go,assembly", 2021-08-13 14:04:06 +0000 UTC
2, owl, https://github.com/ibanyu/owl, "a db usage, manager tool, committed to standardizing the data, index in the database and operations to the database.", "", 2021-08-12 07:06:40 +0000 UTC
2, microshell, https://github.com/blkmlk/microshell, "Free Implementation of RouterOS Shell", "", 2021-08-13 23:51:22 +0000 UTC
2, k6-plugin, https://github.com/vesoft-inc/k6-plugin, "", "", 2021-08-11 07:54:10 +0000 UTC
2, satdress, https://github.com/fiatjaf/satdress, "Federated Lightning addresses server.", "", 2021-08-13 16:35:53 +0000 UTC
2, QuickNotice-SERVER-gRpc, https://github.com/sjy-dv/QuickNotice-SERVER-gRpc, "", "", 2021-08-13 03:03:44 +0000 UTC
2, dapr-wasm, https://github.com/second-state/dapr-wasm, "A template project to demonstrate how to run WebAssembly functions as sidecar microservices in dapr", "rust,golang,microservice,webassembly,rust-lang,sidecar,dapr,wasmedge", 2021-08-11 07:15:13 +0000 UTC
2, twofactor, https://github.com/dannywolfmx/twofactor, "Two factor authenticator in go", "", 2021-08-11 18:03:05 +0000 UTC
2, realip, https://github.com/issmeftah/realip, "extract client real IP address", "", 2021-08-11 22:26:15 +0000 UTC
2, golang.amazon, https://github.com/swordGhostKing/golang.amazon, "golangå†™çš„äºšé©¬é€Šç›¸å…³çš„æ¥å£ï¼Œä»¥æŠ¥è¡¨ï¼Œè®¢å•ï¼Œå•†å“åº“å­˜ä¸ºä¸»", "", 2021-08-13 07:24:58 +0000 UTC
2, graphql-parser-bench, https://github.com/StarpTech/graphql-parser-bench, "GraphQL parser comparison in different languages", "", 2021-08-14 16:40:37 +0000 UTC
2, LibSagerNetCore, https://github.com/SagerNet/LibSagerNetCore, "", "", 2021-08-14 18:03:07 +0000 UTC
2, Encrypted-Proxy-Channel, https://github.com/shashankgoranta/Encrypted-Proxy-Channel, "The tool pbproxy is for adding an extra layer of protection to publicly accessible network services. The program will be written in Go using the Crypto library.", "", 2021-08-10 03:52:35 +0000 UTC
2, programming-class-homework, https://github.com/ranon-rat/programming-class-homework, "A simple project that i made for my homework", "", 2021-08-12 04:57:44 +0000 UTC
2, fastgo, https://github.com/long2ice/fastgo, "Gin + Swagger = FastGo", "api,swagger,gin,fastapi", 2021-08-10 14:54:54 +0000 UTC
2, radix-go, https://github.com/bergusman/radix-go, "Radix (base) conversion", "go,golang,base58,strconv,radix,positional-numeral-systems,base,positional-systems", 2021-08-10 14:53:40 +0000 UTC
2, LogAnalyzer, https://github.com/johnssimon007/LogAnalyzer, "Analyze logs with custom regex patterns", "", 2021-08-12 01:25:40 +0000 UTC
2, hexagonarch, https://github.com/covrom/hexagonarch, "Hexagonal (clean) architecture template with Golang", "go,golang,architecture,clean,clean-architecture,hexagonal,hexagonal-architecture", 2021-08-10 04:56:03 +0000 UTC
2, gocrypto, https://github.com/houseme/gocrypto, "A general solution for commonly used crypt in golang", "go,golang,hex,cryptography,base64,crypto,encryption,aes,rsa,hash", 2021-08-10 07:10:31 +0000 UTC
2, oci-service-operator, https://github.com/oracle/oci-service-operator, "OCI Service Operator for Kubernetes (OSOK) simplifies the process and provides a seamless experience for the container-native application in managing and connecting to OCI services/resources.", "kubernetes,cloud,kubernetes-operator,oracle-cloud,oracle-cloud-infrastructure,oracle-streaming,operator-sdk,autonomous-database,oci-service-operator", 2021-08-11 12:41:16 +0000 UTC
2, command-injection-scanner, https://github.com/Email-Analysis-Toolkit/command-injection-scanner, "", "", 2021-08-10 12:40:20 +0000 UTC
2, minio-, https://github.com/1809765010/minio-, "", "", 2021-08-10 09:36:03 +0000 UTC
2, mysql-go, https://github.com/grand-x/mysql-go, "", "", 2021-08-12 15:50:31 +0000 UTC
2, encoding, https://github.com/gomodules/encoding, "", "", 2021-08-10 15:12:21 +0000 UTC
2, Dynasty-Warriors-8-Empires-Thing-For-stk5, https://github.com/skiesel/Dynasty-Warriors-8-Empires-Thing-For-stk5, "", "", 2021-08-11 19:03:01 +0000 UTC
2, golang.shop, https://github.com/swordGhostKing/golang.shop, "golangå†™çš„åº—é“º", "", 2021-08-13 08:23:45 +0000 UTC
2, process-limiter-go, https://github.com/grand-x/process-limiter-go, "", "", 2021-08-12 15:28:45 +0000 UTC
2, AuthGG-Go, https://github.com/smartass08/AuthGG-Go, "Golang wrapper for AuthGG, Customised for my liking", "", 2021-08-14 02:38:49 +0000 UTC
2, provider-tf-aws, https://github.com/crossplane-contrib/provider-tf-aws, "AWS Provider for Crossplane that uses Terraform as its API", "", 2021-08-09 19:54:21 +0000 UTC
2, golang.facebook, https://github.com/swordGhostKing/golang.facebook, "golang å†™çš„ facebookç›¸å…³æ¥å£,ç›®å‰ä»¥å¹¿å‘Šæ–¹é¢çš„ä¸ºä¸»", "", 2021-08-13 07:24:05 +0000 UTC
1, gession, https://github.com/wangluozhe/gession, "Golangè¯­è¨€ç¼–å†™çš„Sessionæ¡†æ¶ï¼Œé€‚ç”¨äºæ‰€æœ‰Golangçš„WEBå¼€å‘æ¡†æ¶ä½¿ç”¨ã€‚", "", 2021-08-09 09:24:34 +0000 UTC
1, gozeropprof, https://github.com/Jokeramc/gozeropprof, "go-zero-pprof", "", 2021-08-09 07:31:50 +0000 UTC
1, GoHTTP-Gin, https://github.com/zyuq123/GoHTTP-Gin, "ä¸€ä¸ªä½¿ç”¨Ginæ¡†æ¶å¼€å‘çš„ç®€æ˜“HTTPçš„Demoï¼Œå¯ä»¥æ ¹æ®è‡ªå·±éœ€è¦è¿›è¡Œæ‰©å±•", "", 2021-08-11 07:20:08 +0000 UTC
1, easyPhoneParser, https://github.com/Squidward-mv/easyPhoneParser, "", "", 2021-08-10 13:59:16 +0000 UTC
1, ANTLP, https://github.com/AditiRM/ANTLP, "Yet ANother Tool for Lexer & Parser generator", "lexer-parser", 2021-08-10 18:17:19 +0000 UTC
1, hubspotcli, https://github.com/denzuko/hubspotcli, "golang hubspot cli client for serverless, cicd, and containers", "", 2021-08-10 06:04:56 +0000 UTC
1, blockchain-release-monitor, https://github.com/xiaobaiskill/blockchain-release-monitor, "", "", 2021-08-12 03:38:42 +0000 UTC
1, gowiki, https://github.com/Olive105/gowiki, "", "", 2021-08-10 12:55:46 +0000 UTC
1, web-service-gin, https://github.com/Olive105/web-service-gin, "", "", 2021-08-09 23:42:41 +0000 UTC
1, layla-go, https://github.com/mb0/layla-go, "", "", 2021-08-09 11:48:27 +0000 UTC
