916, lotus, https://github.com/WorldDbs/lotus, "", "", 2021-05-17 00:58:10 +0000 UTC
184, specs-actors, https://github.com/WorldDbs/specs-actors, "", "", 2021-05-17 00:58:33 +0000 UTC
150, core, https://github.com/bitclout/core, "BitClout core node", "bitclout", 2021-05-18 15:12:24 +0000 UTC
122, koala, https://github.com/heiyeluren/koala, "koala通用频率控制系统，一个应对所有频次控制高度配置化的通用反作弊系统（规则引擎），高性能可扩展。 (the require golang >= 1.0)", "", 2021-05-18 17:06:01 +0000 UTC
100, shortlink, https://github.com/go-awesome/shortlink, "High-Performance Shortlink ( Short URL ) app creator in Golang. For privacy reasons, you may prefer to host your own short URL app and this is the one to use.", "golang,golang-library,shortlink,golang-package,golang-examples,shortlinks,golang-application", 2021-05-19 18:27:28 +0000 UTC
85, iam, https://github.com/marmotedu/iam, "极客时间《Go 语言项目开发实战》教学项目", "", 2021-05-26 05:06:46 +0000 UTC
84, crank4go, https://github.com/torchcc/crank4go, "API Gateway implemented in Golang", "microservice,api-gateway,websockets,reverse-proxy,internal-network,reverse,service-registration,dmz", 2021-05-20 13:34:21 +0000 UTC
67, Clash.Mini, https://github.com/Clash-Mini/Clash.Mini, "Clash.Mini", "", 2021-05-18 09:16:37 +0000 UTC
63, labor, https://github.com/yisar/labor, "Simple implementation of Web Container", "web-container,stackblitz", 2021-05-24 08:56:53 +0000 UTC
53, nats-roundtripper, https://github.com/ripienaar/nats-roundtripper, "", "", 2021-05-15 09:59:14 +0000 UTC
50, go-mod-archiver, https://github.com/tailscale/go-mod-archiver, "go.mod git archiver", "", 2021-05-24 16:43:17 +0000 UTC
48, fhttp, https://github.com/zMrKrabz/fhttp, "The f stands for flex.", "", 2021-05-15 16:55:42 +0000 UTC
40, go-map-schema, https://github.com/Kangaroux/go-map-schema, "Simple JSON type checking.", "api,golang,json,schema,validation,types", 2021-05-20 04:05:46 +0000 UTC
39, GoShellcode, https://github.com/yoda66/GoShellcode, "", "", 2021-05-20 14:21:37 +0000 UTC
37, run-evm-code, https://github.com/fxfactorial/run-evm-code, "run ABI encoded data against the ethereum blockchain", "", 2021-05-16 22:37:42 +0000 UTC
35, hermit, https://github.com/cashapp/hermit, "Hermit manages isolated, self-bootstrapping sets of tools in software projects.", "", 2021-05-20 04:06:55 +0000 UTC
33, memex, https://github.com/rsms/memex, "Software for archiving my digital stuff like tweets", "", 2021-05-23 21:30:04 +0000 UTC
32, Sekura, https://github.com/Cookie04DE/Sekura, "Encryption tool that's heavily inspired by the Rubberhose file system (https://en.wikipedia.org/wiki/Rubberhose_(file_system)).", "filesystem,nbd,deniable-crypto,deniable-encryption", 2021-05-16 12:45:34 +0000 UTC
28, backend, https://github.com/bitclout/backend, "HTTP API for a BitClout node", "bitclout", 2021-05-18 15:12:31 +0000 UTC
26, Open-IM-Server, https://github.com/OpenIMSDK/Open-IM-Server, "Open-IM-Server is open source instant messaging Server.Backend in Go.", "go,chat,golang,telegram,messaging,messenger,im,imserver,imsdk", 2021-05-26 09:26:32 +0000 UTC
26, prom_bad_apple, https://github.com/MacroPower/prom_bad_apple, "Plays videos using Prometheus, e.g. Bad Apple.", "prometheus,bad-apple", 2021-05-17 00:59:45 +0000 UTC
24, sqlc-grpc, https://github.com/walterwanderley/sqlc-grpc, "Create a gRPC server from code generated by sqlc", "", 2021-05-22 22:17:50 +0000 UTC
24, mangodl, https://github.com/Gyro7/mangodl, "An easy-to-use cli tool for downloading manga", "go,cli,golang,manga,cli-app,manga-downloader", 2021-05-24 15:48:27 +0000 UTC
24, mocker, https://github.com/Ananto30/mocker, "Create your own blazing fast mock server with just a JSON file!", "go,golang,mock-server,fasthttp", 2021-05-18 08:17:44 +0000 UTC
23, scrapligo, https://github.com/scrapli/scrapligo, "scrapli, but in go!", "", 2021-05-18 22:11:57 +0000 UTC
22, tor-proxy, https://github.com/Narasimha1997/tor-proxy, "An experimental Tor-Proxy serivce written in Go using Go-proxy and Go-libtor. ", "", 2021-05-22 14:29:51 +0000 UTC
20, limitio, https://github.com/nanmu42/limitio, "Golang io.Reader and io.Writer with limit", "go,golang,io", 2021-05-25 03:48:22 +0000 UTC
20, instl, https://github.com/instl-sh/instl, "💻 A one-line installer for GitHub projects!", "github,deployment,service,installer", 2021-05-15 22:55:43 +0000 UTC
19, dnsharper, https://github.com/marshall-lee/dnsharper, "", "", 2021-05-19 16:50:09 +0000 UTC
19, JDC, https://github.com/huayu8/JDC, "QL面板扫码添加cookie", "", 2021-05-25 13:34:47 +0000 UTC
18, goodbots, https://github.com/eywu/goodbots, "Verify IP addresses of respectful crawlers like Googlebot by reverse dns and forward dns lookups", "", 2021-05-16 06:31:15 +0000 UTC
16, chia-bls-go, https://github.com/chuwt/chia-bls-go, "chia-bls-signature in go, chia bls 签名工具go实现", "bls-signature,chia,chia-blockchain", 2021-05-15 00:36:13 +0000 UTC
16, go_shell_socket, https://github.com/spxvszero/go_shell_socket, "run shell scripts by websocket with go lauguage", "", 2021-05-16 06:30:19 +0000 UTC
15, shasm, https://github.com/shoyaaa/shasm, "Assembly syntax that makes you feel like you're writing code in a high-level language. ", "", 2021-05-21 19:32:35 +0000 UTC
15, libvault, https://github.com/canidam/libvault, "A lightweight Vault client module written in Go, with no dependencies, that is intuitive and user-friendly", "", 2021-05-20 06:28:50 +0000 UTC
14, remarkable-encryption, https://github.com/RedTeamPentesting/remarkable-encryption, "A document encryption solution for the reMarkable 2 ePaper tablet.", "", 2021-05-21 10:52:57 +0000 UTC
14, gohowmuch, https://github.com/ledongthuc/gohowmuch, "Cryptocurrencies prices and graph on the terminal", "golang,terminal,graphs,cryptocurrencies,prices", 2021-05-21 06:25:59 +0000 UTC
13, tbd, https://github.com/lucasepe/tbd, "\"to be defined\" - a really simple way to create text templates with placeholders", "golang,placeholder,commandline-tool,text-template,dotenv-files", 2021-05-21 13:11:33 +0000 UTC
13, gxor, https://github.com/Rvn0xsy/gxor, "gxor程序根据输入的二进制文件进行异或运算输出", "", 2021-05-18 15:22:42 +0000 UTC
11, squizit, https://github.com/MrCyjaneK/squizit, "Ch3@t for squizizz. Open Source. | p.s. Quizizz, I want to work for you, email me at cyjan@mrcyjanek.net", "", 2021-05-25 17:59:29 +0000 UTC
11, postgrest-go, https://github.com/supabase/postgrest-go, "", "", 2021-05-23 13:36:28 +0000 UTC
10, cloudig, https://github.com/Optum/cloudig, "Cloud governance reports from native services in a clear and readable digest ", "go,aws,security,cloud,athena,reporting,inspector,audit,compliance,aws-iam,aws-config,cloudtrail,governance,least-privilege,aws-phd,well-architected,ecr-scan,trusted-advisor", 2021-05-18 22:10:23 +0000 UTC
10, veryfi-go, https://github.com/veryfi/veryfi-go, "Go module for communicating with the Veryfi OCR API", "", 2021-05-20 19:02:43 +0000 UTC
9, mkvm, https://github.com/Xe/mkvm, "Makes a VM, imaginative name, I know", "", 2021-05-16 03:47:30 +0000 UTC
9, cinit, https://github.com/prologic/cinit, "cinit is a minimal and correctly functioning init (PID 1) for Docker Containers running in Swarm clusters.", "docker,dockerfile,secrets,swarm,init,swarm-mode", 2021-05-21 04:18:29 +0000 UTC
9, jwt, https://github.com/golang-jwt/jwt, "Community maintained clone of https://github.com/dgrijalva/jwt-go", "go,golang,jwt,auth", 2021-05-18 22:42:37 +0000 UTC
9, amorph, https://github.com/clucia/amorph, "library for working amorphous data (as when you decode json into an interface{})", "", 2021-05-15 23:19:34 +0000 UTC
8, floppa-programming-language, https://github.com/5elenay/floppa-programming-language, "Floppa programming language inspired by the brainf*ck programming language. Created just for fun and you can convert your brainf*ck code to floppa code.", "golang,compiler,brainfuck,floppa,big-floppa", 2021-05-15 18:52:37 +0000 UTC
8, vine, https://github.com/vineio/vine, "", "", 2021-05-16 09:51:51 +0000 UTC
8, mongodb-dumper, https://github.com/bitclout/mongodb-dumper, "Dump BitClout chain data into MongoDB", "bitclout", 2021-05-18 15:43:29 +0000 UTC
8, ogimgd, https://github.com/nDmitry/ogimgd, "Social previews generator as a microservice.", "golang,microservice,service,social-preview,ogimage", 2021-05-21 15:04:05 +0000 UTC
7, pod-security-admission, https://github.com/kubernetes/pod-security-admission, "Kubernetes Pod Security Standards implementation - https://github.com/kubernetes/enhancements/blob/master/keps/sig-auth/2579-psp-replacement/README.md", "k8s-staging,k8s-sig-auth", 2021-05-21 04:06:59 +0000 UTC
7, ino, https://github.com/audibleblink/ino, "In 'n Out - See what goes in and comes out of PEs/DLLs", "winapi,reverse-engineering,binary-analysis", 2021-05-20 01:23:08 +0000 UTC
7, api, https://github.com/open-cluster-management-io/api, "core apis for open-cluster-management", "", 2021-05-17 01:46:14 +0000 UTC
7, telefonist, https://github.com/negbie/telefonist, "", "", 2021-05-16 21:29:59 +0000 UTC
7, work, https://github.com/open-cluster-management-io/work, "resource manifest distribution among multiple clusters.", "", 2021-05-19 06:22:11 +0000 UTC
7, goql, https://github.com/getoutreach/goql, "A GraphQL client package written in Go.", "go,graphql,golang,golang-library,golang-package,client-library", 2021-05-24 21:44:47 +0000 UTC
7, icka, https://github.com/osm/icka, "", "", 2021-05-16 13:43:03 +0000 UTC
6, rests_v, https://github.com/cwon/rests_v, "잔여 백신 맵 서비스 모니터링", "", 2021-05-27 09:39:03 +0000 UTC
6, memeduck, https://github.com/genkami/memeduck, "memeduck is a SQL query builder for Cloud Spanner", "go,golang,sql,google-cloud,query-builder,spanner,cloud-spanner", 2021-05-21 11:52:13 +0000 UTC
6, meeting-minutes-bot, https://github.com/arhat-dev/meeting-minutes-bot, "A meeting minutes bot for Telegram", "", 2021-05-19 08:15:46 +0000 UTC
6, registration, https://github.com/open-cluster-management-io/registration, "cluster registration and lifecycle", "", 2021-05-18 09:07:41 +0000 UTC
6, fsutil, https://github.com/encoredev/fsutil, "fsutil provides adapters for io/fs to work with FUSE and other utilities.", "", 2021-05-27 01:36:34 +0000 UTC
6, timefinder, https://github.com/DanPlayer/timefinder, "自然语言（中文）提取时间", "", 2021-05-20 06:32:17 +0000 UTC
6, farely, https://github.com/chermehdi/farely, "A load balancer supporting multiple LB strategies written in Go", "golang,load-balancer", 2021-05-16 17:04:55 +0000 UTC
6, xordump, https://github.com/audibleblink/xordump, "", "", 2021-05-17 18:54:12 +0000 UTC
5, WSMicroService, https://github.com/bydmm/WSMicroService, "搞事情全WS微服务框架搭建中", "", 2021-05-23 14:39:07 +0000 UTC
5, veilig, https://github.com/noqqe/veilig, "Toy TLS certificate viewer", "", 2021-05-18 06:32:15 +0000 UTC
5, NixPM, https://github.com/AmazingMech2418/NixPM, "Nix Package Manager for Repl.it", "", 2021-05-25 21:13:32 +0000 UTC
5, localhost22, https://github.com/bfu4/localhost22, "filehost api, will be here:", "", 2021-05-19 17:19:52 +0000 UTC
5, OPQBot-GroupManager, https://github.com/opq-osc/OPQBot-GroupManager, "OPQBot 群管理机器人", "", 2021-05-25 05:10:46 +0000 UTC
5, Gin_Starter, https://github.com/FlameMida/Gin_Starter, "Gin+Gorm quickStart", "", 2021-05-17 10:36:49 +0000 UTC
5, cryptgo, https://github.com/Gituser143/cryptgo, "A terminal application to watch crypto prices!", "go,golang,crypto,bitcoin,ethereum,tui,cryptocurrency,coin,terminal-based,cryptocurrency-exchanges,crypto-prices,crypto-price-tracker", 2021-05-20 06:36:28 +0000 UTC
5, chia-log-analyzer, https://github.com/kubec/chia-log-analyzer, "Simply realtime chia log analyzer for chia coin (XCH) farmers", "chia,chia-blockchain,chia-farmer,chia-plots,chia-network,chia-farm,chia-node,chia-cryptocurrency", 2021-05-27 08:56:51 +0000 UTC
5, chat, https://github.com/awesome-cmd/chat, "chat in cli.", "", 2021-05-21 05:42:07 +0000 UTC
5, registration-operator, https://github.com/open-cluster-management-io/registration-operator, "operator to install cluster manager and klusterlet.", "", 2021-05-19 08:32:33 +0000 UTC
5, dabulang, https://github.com/stickyPiston/dabulang, "Dabulang is an interpreted object-oriented programming language aimed towards game development.", "programming-language,golang,game-development", 2021-05-17 10:14:51 +0000 UTC
5, GoJWTBrute2, https://github.com/Unknow101/GoJWTBrute2, "Simple Golang JWT Bruteforcer 2", "", 2021-05-25 19:24:07 +0000 UTC
5, Falabella, https://github.com/YashMeh/Falabella, "Falabella :racehorse: :horse: is a content(PDF,PPT,XLSX,CSV etc.) loading and searching software that can be used to rank content based on the given keywords.", "golang,elasticsearch,concurrency,indexing,provider-pattern,apachetika", 2021-05-17 18:26:46 +0000 UTC
5, chitanda-gin, https://github.com/fyxemmmm/chitanda-gin, "Chitanda is a web scaffold which is based on gin.", "", 2021-05-16 13:21:21 +0000 UTC
5, gogo, https://github.com/kortschak/gogo, "gogo enables programmatic queries of a Gene Ontology graph", "", 2021-05-22 03:14:35 +0000 UTC
5, fly-log-shipper, https://github.com/superfly/fly-log-shipper, "Ship logs from fly to other providers", "", 2021-05-20 16:03:18 +0000 UTC
4, memstat, https://github.com/ashishkhuraishy/memstat, "CLI app which will display your runtime memory status in a cool way", "", 2021-05-23 15:57:41 +0000 UTC
4, rss3go-lib, https://github.com/nyawork/rss3go-lib, "Library for RSS3 in golang", "", 2021-05-22 09:44:56 +0000 UTC
4, onair, https://github.com/Neulhan/onair, "fiber-air-docker development environment boilerplate, examples", "go,docker-compose,air", 2021-05-19 16:32:57 +0000 UTC
4, golang-HiPac-tunnel, https://github.com/marywangran/golang-HiPac-tunnel, "high perfermance tunnel in golang", "", 2021-05-22 02:14:19 +0000 UTC
4, arcoz.site, https://github.com/Arcoz0308/arcoz.site, "", "", 2021-05-15 07:15:08 +0000 UTC
4, go-generate-social-banners, https://github.com/sophiabrandt/go-generate-social-banners, "Automatically generate social media images", "", 2021-05-21 06:55:20 +0000 UTC
4, spoticlient, https://github.com/giovannigravili/spoticlient, "🌸 Make your own flashcards deck, learn it and keep flowing, now for the terminal!", "cli,json,flashcards,anki", 2021-05-17 12:12:28 +0000 UTC
4, cowin-tracker, https://github.com/abhimanyu003/cowin-tracker, "A simple cross-platform CoWIN tracker", "go,golang,cowin,cowin-vaccine-tracker,cowin-notifier", 2021-05-23 03:53:25 +0000 UTC
4, chia-bouncer, https://github.com/St3ffn/chia-bouncer, "CLI Tool to remove unwanted connections from your Chia Node based on Geo IP Location.", "go,cli,golang,chia,chia-blockchain,chia-farmer,chia-network,chia-farm", 2021-05-15 12:08:00 +0000 UTC
4, notiongo, https://github.com/tempor1s/notiongo, "(Golang) Go bindings for Notion (WIP)", "go,golang,notion,notion-api,notiongo", 2021-05-15 02:27:25 +0000 UTC
4, session, https://github.com/flamego/session, "Package session is a middleware that provides the session management for Flamego", "go,middleware,session,lsif-enabled,flamego", 2021-05-15 15:25:17 +0000 UTC
4, notion, https://github.com/kjk/notion, "Go client for official Notion API.", "", 2021-05-16 20:05:37 +0000 UTC
4, xk6bundler, https://github.com/szkiba/xk6bundler, "Bundle k6 with extensions as fast and easily as possible", "xk6,k6-extension", 2021-05-16 14:13:21 +0000 UTC
4, ok, https://github.com/ErrorNoInternet/ok, "This is a command that simply prints \"ok\" onto your screen whenever you run the \"ok\" command", "", 2021-05-15 14:13:01 +0000 UTC
4, MinecraftLightServer, https://github.com/ErikPelli/MinecraftLightServer, "A Minecraft server reduced to the bone, to learn the concepts behind it.", "golang,minecraft,server,minecraft-server", 2021-05-18 17:39:41 +0000 UTC
4, goMysqlSync, https://github.com/j262965682/goMysqlSync, "mysql to mysql 轻量级多线程的库表数据同步", "", 2021-05-17 11:50:53 +0000 UTC
4, rpcx-nacos, https://github.com/rpcxio/rpcx-nacos, "支持阿里nacus做服务发现", "", 2021-05-24 23:48:47 +0000 UTC
4, magistergo, https://github.com/J0eppp/magistergo, "A go implementation of the Magister 6 API", "", 2021-05-21 11:29:24 +0000 UTC
